,0,1,2,3
15,George Michael,pop,Freedom 90,"I won't let you down 
 I will not give you up 
 Gotta have some faith in the sound 
 It's the one good thing that I've got 
 I won't let you down 
 So please don't give me up 
 Because I would really, really love to stick around 
 Heaven knows I was just a young boy 
 Didn't know what I wanted to be 
 I was every little hungry schoolgirl's pride and joy 
 And I guess it was enough for me 
 To win the race? A prettier face 
 Brand new clothes and a big fat place 
 On your rock and roll TV 
 But today the way I play the game is not the same 
 No way 
 Think I'm gonna get me some happy 
 I think there's something you should know 
 I think it's time I told you so 
 There's something deep inside of me 
 There's someone else I've got to be 
 Take back your picture in a frame 
 Take back your singing in the rain 
 I just hope you understand 
 Sometimes the clothes do not make the man 
 All we have to do now 
 Is take these lies and make them true somehow 
 All we have to see 
 Is that I don't belong to you 
 And you don't belong to me 
 Freedom 
 You've gotta give for what you take 
 Freedom 
 You've gotta give for what you take 
 Heaven knows we sure had some fun boy 
 What a kick just a buddy and me 
 We had every big shot good-time band on the run boy 
 We were living in a fantasy 
 We won the race 
 Got out of the place 
 I went back home got a brand new face 
 For the boys on MTV 
 But today the way I play the game has got to change 
 Oh yeah 
 Now I'm gonna get myself happy 
 I think there's something you should know 
 I think it's time I stopped the show 
 There's something deep inside of me 
 There's someone I forgot to be 
 Take back your picture in a frame 
 Don't think that I'll be back again 
 I just hope you understand 
 Sometimes the clothes do not make the man 
 All we have to do now 
 Is take these lies and make them true somehow 
 All we have to see 
 Is that I don't belong to you 
 And you don't belong to me 
 Freedom 
 You've gotta give for what you take 
 Freedom 
 You've gotta give for what you take 
 Well it looks like the road to heaven 
 But it feels like the road to hell 
 When I knew which side my bread was buttered 
 I took the knife as well 
 Posing for another picture 
 Everybody's got to sell 
 But when you shake your ass 
 They notice fast 
 And some mistakes were built to last 
 That's what you get 
 I say that's what you get 
 That's what you get for changing your mind 
 And after all this time 
 I just hope you understand 
 Sometimes the clothes 
 Do not make the man 
 I'll hold on to my freedom 
 May not be what you want from me 
 Just the way it's got to be 
 Lose the face now 
 I've got to live"
16,George Michael,pop,They Won't Go When I Go,"No more lying friends 
 Wanting tragic ends 
 Though they do pretend 
 They won't go when I go 
 All those bleeding hearts 
 With sorrows to impart 
 Were right here from the start 
 And they won't go when I go 
 And I'll go where I've longed 
 To go so long 
 Away from tears 
 Gone from painful cries 
 Away from saddened eyes 
 Along with them I'll bide 
 Because they won't go when I go 
 Big men feeling small 
 Weak ones standing tall 
 I will watch them fall 
 They won't go when I go 
 And I'll go where I've long 
 To go so long 
 Away from tears 
 Unclean minds mislead the pure 
 The innocent will leave for sure 
 For them there is a resting place 
 People sinning just for fun 
 They will never see the sun 
 For they can never show their faces 
 There ain't no room for the hopeless sinner 
 Who will take more then he will give 
 He ain't hardly gonna give 
 The greed of man will be 
 Far away from me 
 And my soul will be free 
 They won't go when I go 
 Since my soul conceived 
 All that I believe 
 The kingdom I will see 
 'Cause they won't go when I go 
 When I go 
 Where I'll go 
 No one can keep me 
 From my destiny"
17,George Michael,pop,Something To Save,"If you've got something to say 
 Why don't you say it 
 If you've got something to give 
 Why don't you give it to me 
 Day after day I have to say it 
 We're moving further from heaven 
 And closer to the deep blue sea 
 'Cause I have no secrets from you 
 And I have nothing left to hide 
 And I'm open to all your questions 
 Why can't you reach inside 
 Like I have 
 Like I have for you 
 And all these games that you play 
 Don't tell me how a man should be 
 Some would say if you knew 
 You wouldn't be here with me 
 I love you 
 I still love you 
 But I guess it's time to let you be 
 'Cause I have no secrets from you 
 And I have nothing left to hide 
 And I'm so tired of all these questions 
 'Cause maybe you just changed your mind 
 Like I have 
 Like I have 
 Like I have 
 Like I have 
 When I was at your doorstep 
 You told me to look around 
 Said come in 
 You and your heart sit down 
 But you better watch your step 
 'Cause you're not far from the ground 
 And one fine day this all falls down 
 Like I have 
 Like I have 
 If you've got something to say 
 Why don't you say it 
 If you've got something to give 
 Why don't you give it to me 
 Day after day I have to say it 
 If we've got something to save 
 Why don't we save it"
18,George Michael,pop,Cowboys And Angels,"When your heart's in someone else's hands 
 Monkey see and monkey do 
 Their wish is your command 
 You're not to blame 
 Everyone's the same 
 All you do is love and love is all you do 
 I should know by now the way I fought for you 
 You're not to blame 
 Everyone's the same 
 I know you think that you're safe 
 Mister 
 Harmless deception that keeps love at bay 
 It's the ones who resist that we most want to kiss 
 Wouldn't you say? 
 Cowboys and angels 
 They all have the time for you 
 Why should I imagine 
 That I'd be a find for you 
 Why should I imagine 
 That I'd have something to say 
 But that scar on your face 
 That beautiful face of yours 
 In your heart there's a trace 
 Of someone before 
 When your heart's in someone else's plans 
 Things you say and things you do 
 They don't understand 
 It's such a shame 
 Always ends the same 
 You can call it love but I don't think it's true 
 You should know by now 
 I'm not the boy for you 
 You're not to blame 
 Always ends the same 
 I know you think that you're safe 
 Sister 
 Harmless affection that keeps things this way 
 It's the ones who persist for the sake of a kiss 
 Who will pay 
 Cowboys and angels 
 They all take a shine to you 
 Why should I imagine 
 That I was designed for you 
 Why should I believe 
 That you would stay 
 But that scar on your face 
 That beautiful face of yours 
 Don't you think that I know 
 They hurt you before 
 Take this man to your bed 
 Maybe his hands 
 Will help you forget 
 Please be stronger than your past 
 The future may still give you a chance"
19,George Michael,pop,Waiting For That Day,"Now every day I see you in some other face 
 They crack a smile, talk a while 
 Try to take your place 
 My memory serves me far too well 
 I just sit here on this mountain thinking to myself 
 You're a fool boy 
 Why don't you go down 
 Find somebody 
 Find somebody else 
 My memory serves me far too well 
 It's not as though we just broke up 
 It's not as though it was yesterday 
 But something I just can't explain 
 Something in me needs this pain 
 I know I'll never see your face again 
 C'mon now 
 I've got to be strong now 
 Now everybody's talking about this new decade 
 Like you say the magic number 
 Then just say goodbye to 
 The stupid mistakes you made 
 Oh my memory serves me far too well 
 Don't you know that 
 The years will come and go 
 Some of us will change our lives 
 Some of us still have nothing to show 
 Nothing baby 
 But memories 
 And if these wounds 
 They are self inflicted 
 I don't really know 
 How my poor heart could have protected me 
 But if I have to carry this pain 
 If you will not share the blame 
 I deserve to see your face again 
 C'mon now 
 You don't have to be so strong now 
 Come back 
 Come back to me darling 
 I will make it worth your while 
 Come back to your baby 
 I miss your kiss 
 I miss your smile 
 Seems to me the peace I search to find 
 Ain't gonna be mine until you say you will 
 Don't you keep me waiting for that day 
 I know 
 You hear these words that I say 
 You can't always get what you want..."
20,George Michael,pop,Mother's Pride,"Oh she knows 
 She takes his hand 
 And prays the child will understand 
 At the door they watch the men go by 
 In the clothes that daddy wore 
 Mothers pride 
 Baby Boy 
 His father's eyes 
 He's a soldier waiting for war 
 Time will come 
 He'll hold a gun 
 His father's son 
 And as he grows 
 He hears the band 
 Takes the step from boy to man 
 And at the shore she waves her son goodbye 
 Like the man she did before 
 Mothers pride 
 Just a boy 
 His country's eyes 
 He's a soldier waving at the shore 
 And in her heart the time has come 
 To lose a son 
 And all the husbands, all the sons, all the lovers gone 
 They make no difference 
 No difference in the end 
 Still hear the woman say your daddy died a hero 
 In the name of God and man 
 Mothers pride 
 Crazy boy 
 His lifeless eyes 
 He's a soldier now forevermore 
 He'll hold a gun till kingdom come"
21,George Michael,pop,Heal The Pain,"Let me tell you a secret 
 Put it in your heart and keep it 
 Something that I want you to know 
 Do something for me 
 Listen to my simple story 
 And maybe we'll have someting to show 
 You tell me you're cold on the inside 
 How can the outside world 
 Be a place that your heart can embrace 
 Be good to yourself 
 Because nobody else 
 Has the power to make you happy 
 How can I help you 
 Please let me try to 
 I can heal the pain 
 That you're feeling inside 
 Whenever you want me 
 You know that I will be 
 Waiting for the day 
 That you say you'll be mine 
 He must have really hurt you 
 To make you say the things that you do 
 He must have really hurt you 
 To make those pretty eyes look so blue 
 He must have known 
 That he could 
 That you'd never leave him 
 Now you can't see my love is good 
 And that I'm not him 
 How can I help you 
 Please let me try to 
 I can heal the pain 
 That you're feeling inside 
 Whenever you want me 
 You know that I will be 
 Waiting for the day 
 That you say you'll be mine 
 Who needs a lover 
 That can't be a friend 
 Something tells me I'm the one you've been looking for 
 If you ever should see him again 
 Won't you tell him you've found someone who gives you more 
 Someone who will protect you 
 Love and respect you 
 All those things 
 That he never could bring to you 
 Like I do 
 Or rather I would 
 Won't you show me your heart 
 Like you should 
 Won't you let me in 
 Let this love begin 
 Won't you show me your heart now 
 I'll be good to you 
 I can make this thing true 
 And get to your heart somehow"
22,George Michael,pop,Soul Free,"Higher, higher 
 Won't you come with me 
 Baby gonna get my soul free 
 Now you and me 
 I guess we see things differently 
 We're night and day 
 A bad connection some would say 
 And I don't want nothing to change 
 I don't want nothing to change 
 Because 
 When you touch me baby 
 I don't have no choice 
 Oh that sweet temptation 
 In your voice... 
 Higher, higher 
 Won't you come with me 
 Baby gonna get my soul free 
 Now seems to me 
 Some things have just got to be 
 The games we play 
 Break up make-up day by day 
 And I don't want nothing to change 
 Said I don't want nothing to change 
 Because 
 When you touch me baby 
 I don't have no choice 
 Oh that sweet temptation 
 In your voice 
 Higher, higher 
 Won't you come with me 
 Baby gonna get my soul free"
23,George Michael,pop,Waiting (Reprise),"Well, there ain't no point in moving on 
 Until you've got somewhere to go 
 And the road that I have walked upon 
 Well it filled my pockets 
 And emptied out my soul 
 All those insecurities 
 That have held me down for so long 
 I can't say that I've found a cure for these 
 But at least I know them 
 So they're not so strong 
 You look for your dreams in Heaven 
 But what the hell are you supposed to do 
 When they come true? 
 Well there's one year of my life in these songs 
 And some of them are about you 
 Now I know there is no way I can write those wrongs 
 Believe me 
 I would not lie you've hurt my pride 
 And I guess there's a road without you 
 But you once said 
 There's a way back for every man 
 So here I am 
 Don't people change? 
 Here I am 
 Is it too late to try again? 
 Here I am"
24,George Michael,pop,If You Were My Woman,"If you were my woman 
 And I was your man 
 There would be no other woman 
 You'd be weak as a lamb 
 If you had the strength to walk out that door 
 My love would overrule my sense I would call you back for more 
 If you were my woman 
 If you were my woman 
 And I was your man, Yeah! 
 He tears you down darlin' 
 Says your nothing at all 
 But I'll be there for darlin' 
 When he lets you fall 
 You're like a diamond 
 But he treats you like glass 
 Yet you beg him to love you 
 With me you don't ask 
 If you were my woman 
 If you were my woman 
 Here's what I'd do, Oh 
 I'd never, no, no, no stop lovin' you 
 Whoa! Yeah! 
 My darlin' 
 Life is so crazy 
 And love is so unkind 
 Because he came first, darlin' 
 Will he hang on your mind 
 You're a part of me 
 And you don't even know it 
 I'm what you need 
 But I'm too afraid to show it 
 If you were my woman 
 Here's what I'd do, Oh 
 I'd never, no, no, no 
 Whoa! Oh! 
 My darlin' If you were my woman 
 Sweet lovin' woman 
 I said 
 If you were my woman 
 If you were my woman 
 I said 
 If you were my woman 
 If you were my woman 
 Here's what I would do, Oh 
 I'd never, no, no, no stop lovin' you 
 Whoa! Yeah! 
 Never, never, no 
 Hmm..."
25,George Michael,pop,Killer,"So you want, to be free 
 To live your life, the way you wanna be 
 Will you give, if we cry 
 Will we live, or will we die 
 Tainted hearts, heal with time 
 Shoot bad love, so we can 
 Stop the bleeding, yeah... 
 Solitary brother, is there still a part of you that wants to live? 
 Solitary sister, is there still a part of you that wants to give? 
 Solitary brother, is there still a part of you that wants to live? 
 Solitary sister, is there still a part of you that wants to give? 
 If we try to live our lives 
 The way we wanna be 
 Solitary brother, is there still a part of you that wants to live? 
 Solitary sister, is there still a part of you that wants to give? 
 Solitary brother, is there still a part of you that wants to live? 
 Solitary sister, is there still a part of you that wants to give? 
 Racism in future kings can only lead to no good 
 And besides, all our sons and daughters already 
 Know how that feels"
26,George Michael,pop,Papa Was A Rollin' Stone,"It was the third of September 
 That day I'll always remember, yes I will 
 'Cause that was the day that my daddy died 
 Never had a chance to see him, no 
 Never heard nothing but bad things about him 
 Mama, I'm depending on you to tell me the truth 
 Mama just hung her head and said 
 ""Papa was a rollin' stone 
 Wherever he laid his hat was his home 
 And when he died 
 All he left us was alone"" 
 Hey, mama, is it true what they say 
 That papa never worked aday in his life 
 Some bad talk going around sayin' 
 Papa had three outside children 
 And another wife 
 That ain't right 
 Heard some talk about papa and his storefront 
 Preachin' 
 Talkin' about saving souls and all the time 
 Leachin' 
 And dealing in dirt 
 Stealin' in the name of the Lord 
 But mama she just said 
 ""Papa was a rollin' stone 
 Wherever he laid his hat was his home 
 And when he died 
 All he left us was alone"" 
 Say I heard my papa was a jack of all trades 
 Is that what papa sent to an early grave? 
 Folks say papa would beg, borrow or steal just 
 To pay his bills 
 Hey, mama, folks say papa was never much in thinkin' 
 Spent most of his time chasin' women and drinkin' 
 But mother, I'm depending on you 
 To tell me the truth 
 But my mama she just said 
 ""Papa was a rollin' stone 
 Wherever he laid his hat was his home 
 And when he died 
 All he left us was alone"" 
 ""Papa was a rollin' stone 
 Wherever he laid his hat was his home 
 And when he died 
 All he left us was alone"""
27,George Michael,pop,Calling You,"A desert road from Vegas to nowhere 
 Someplace better than where you've been 
 A coffee machine that needs some fixin' 
 In a little cafe just around the bend 
 I am calling you 
 Can't you hear me? 
 I am calling you 
 I am calling you 
 Can't you hear me? 
 I am calling you 
 A desert road from Vegas to nowhere 
 Someplace better than where you've been 
 A coffee machine that needs some fixin' 
 In a little cafe just around the bend 
 A hot dry wind blows right through me 
 The baby's crying so I can't sleep 
 But we both know the change is coming 
 Come in closer, sweet release 
 I am calling you 
 Can't you hear me? 
 I am calling you 
 Desert road from Vegas to nowhere"
28,George Michael,pop,Jesus To A Child,"Kindness in your eyes 
 I guess you heard me cry 
 You smiled at me like Jesus to a child 
 I'm blessed I know 
 Heaven sent and heaven stole 
 You smiled at me like Jesus to a child 
 And what have I learned from all this pain 
 I thought I never feel the same about anyone or anything again 
 But now I know 
 When you find a love 
 When you know that it exists 
 Then the lover that you miss 
 Will come to you on those cold, cold nights 
 When you've been loved 
 When you know it holds such bliss 
 Then the lover that you kissed 
 Will comfort you when there's no hope in sight 
 Sadness in my eyes 
 No one guessed and no one tried 
 You smiled at me like Jesus to a child 
 Loveless and cold 
 With your last breath you saved my soul 
 You smiled at me like Jesus to a child 
 And what have I learned from all these tears 
 I've waited for you all those years 
 Then just when it began he took your love away 
 But I still say 
 When you find a love 
 When you know that it exists 
 Then the lover that you miss 
 Will come to you on those cold, cold nights 
 When you've been loved 
 When you know it holds such bliss 
 Then the lover that you kissed 
 Will comfort you when there's no hope in sight 
 So the words you could not say 
 I'll sing them for you 
 And the love we would have made 
 I'll make it for two 
 For every single memory 
 Has become a part of me 
 You will always be my love 
 Well I've been loved so I know just what love is 
 And the lover that I kissed is always by my side 
 Oh the lover I still miss... was Jesus to a child"
29,George Michael,pop,Fastlove,"Gotta get up, get down 
 Ooh ooh, baby baby 
 Looking for some education 
 Made my way into the night 
 All that bullshit conversation 
 Baby can't you read the signs? 
 I won't bore you with the details, baby 
 I don't even wanna waste your time 
 Let's just say that maybe 
 You could help to ease my mind 
 Baby, I ain't Mr. Right 
 But if you're looking for fast love 
 If that's love in your eyes, it's more than enough 
 Had some bad love 
 Some fast love, is all that I've got on my mind 
 Ooh, yeah yeah (ooh ooh, baby baby) 
 What's there to think about baby? 
 (Ooh ooh, baby baby) 
 Hey baby, oh yeah (ooh ooh, baby baby) 
 Looking for some affirmation, made my way into the sun 
 My friends got their ladies, they're all having babies 
 But I just want to have some fun 
 I won't bore you with the detail baby 
 You gotta get there in your own sweet time 
 Let's just say that maybe, you could help 
 To ease my mind, baby, I ain't Mr. Right 
 But if you're looking for fast love 
 If that's love in your eyes, it's more than enough 
 Had some bad love 
 Some fast love, is all that I've got on my mind 
 So close I can taste it now baby, so close 
 In the absence of security, I made my way into the night 
 Stupid Cupid keeps on calling me 
 And I see lovin' in his eyes 
 I miss my baby, oh yeah, I miss my baby tonight 
 So why don't we make a little room 
 In my BMW, babe, searchin' for some peace of mind 
 Hey, I'll help you find it 
 I do believe that we are practicing the same religion 
 Oh you really oughta get up now, that's right 
 Oh you really oughta get up"
30,George Michael,pop,Older,"I should have known, it seemed too easy 
 You were there, and I was breathing blue 
 Strange baby, don't you think I'm looking older? 
 But something good has happened to me 
 Change is a stranger you have yet to know 
 Well, you're out of time, I'm letting go, you'll be fine 
 Well, that much I know 
 You're out of time, I'm letting go 
 I'm not the man you want 
 I should have known, it seemed so easy 
 You were there, I thought I needed you 
 You 
 Strange baby, don't you think I'm looking older? 
 But something good has happened to me 
 Change is a stranger who never seems to show 
 So you're out of time, I'm letting go, you'll be fine 
 Or maybe you won't 
 You're out of time, I'm letting go 
 I'm not the man that you want 
 I never should have looked back in your direction 
 I know that, just the same old fights again, baby 
 These are wasted days without affection 
 I'm not that foolish anymore 
 So you're out of time, I'm letting go, you'll be fine 
 Well, that much I know 
 You're out of time, I'm letting go 
 I'm not the man that you want"
31,George Michael,pop,Spinning The Wheel,"Five o'clock in the morning you ain't home 
 I can't help thinking that's strange 
 Baby I just want you to know I won't go through this again 
 Yes, those clouds are closing in 
 And I will not accept this as a part of my life 
 I will not live in fear of what may be 
 And the lessons that I learned 
 I would rather be alone than watch you spinning that wheel for me 
 You've got a thing about danger 
 Ain't you getting what you want from me 
 You've got a thing about strangers 
 Baby that's what we used to be 
 You've got a thing about danger baby 
 I guess the hungry just can't see 
 One of these days you gonna bring some home to me 
 Six o'clock in the morning you ain't home 
 I can't help thinking it's strange 
 It seems that everybody takes their chances these days 
 Oh yeah, we're standing in the rain 
 And I will not accept this as a part of my life 
 I will not live in fear of what may be 
 And the lessons that I learned 
 I would rather be alone than watch you spinning that wheel for me 
 You've got a thing about danger 
 Ain't you getting what you want from me 
 You've got a thing about strangers 
 Baby that's what we used to be 
 You've got a thing about danger baby 
 I guess the hungry just can't see 
 One of these days you gonna bring some home to me 
 How can you love me when you're playing with my life 
 You say give me time and I'll do better I swear 
 Give me time and I'll lead you back to despair 
 And I don't want to go back there"
32,George Michael,pop,It Doesn't Really Matter,"It doesn't really matter that I loved you 
 How many reasons call 
 It doesn't really matter at all 
 It doesn't matter that I failed to 
 Break down your father's wall 
 It doesn't matter at all 
 Why tell me you don't understand when you do 
 I thought I had something to say 
 But it really doesn't matter at all... 
 I changed my name 
 To be rid of the things that I want from you 
 It's strange 
 But a name is a name and the truth is the truth 
 Oh, there is always 
 Always someone to remind me 
 So I learn to live with shame 
 Tell myself I feel no pain 
 But I do 
 And if I have to tell you 
 Then it really doesn't matter at all... 
 And it's no good looking back 
 Because time's a thief and I believe that 
 I'm too old for that 
 We're just saying the things that we've said 
 Forever 
 It doesn't really matter that I loved you 
 How many seasons fall 
 It's too bad 
 It really doesn't matter at all"
33,George Michael,pop,The Strangest Thing,"Take my life 
 Time has been twisting the knife 
 I don't recognise 
 People I care for 
 Take my dreams 
 Childish and weak at the seams 
 Please don't analyse 
 Please just be there for me 
 The things that I know 
 Nobody told me 
 The seeds that are sown 
 They still control me 
 There's a liar in my head 
 There's a thief upon my bed 
 And the strangest thing 
 Is I cannot seem to get my eyes open 
 Take my hand 
 Lead me to some peaceful land 
 That I cannot find 
 Inside my head 
 Wake me with love 
 It's all I need 
 But in all this time 
 Still no one said 
 If I had not asked 
 Would you have told me 
 If you call this love 
 Why don't you hold me? 
 There's a liar in my head 
 There's a thief upon my bed 
 And the strangest thing 
 Is I cannot seem to get my eyes open 
 Give me something I can hold 
 Give me something to believe in 
 I am frightened for my soul 
 Please, please 
 Make love to me, send love through me 
 Heal me with your crime 
 The only one who ever knew me 
 We've wasted so much time 
 So much time"
34,George Michael,pop,To Be Forgiven,"I'm going down 
 Won't you help me 
 Save me from myself 
 I hear the sound of a memory 
 Maybe time will tell 
 Suddenly my life is like a river 
 Taking me places I don't want to go 
 But like all good men who swim too well 
 It takes all that I have just to cry for help 
 Then that voice in my head 
 Tells me no 
 I'm going down 
 Won't you help me 
 Save me from myself 
 I look around for a fantasy 
 Maybe 
 Who can tell? 
 Let me live my life beside the river 
 Take me to places where a child can grow 
 And then 
 Maybe the boy inside will forsake me 
 Maybe 
 The child in me 
 Will just let me go 
 I'm going down 
 The cold, cold water is rushing in 
 I'm going down 
 And I would beg to be forgiven 
 If I knew my sin"
