,0,1,2,3
35,George Michael,pop,Move On,"I've been in and out of favour with Lady Luck 
 I gotta tell ya 
 I've seen things I've never wanted to see 
 I've got to get back on my feet 
 I feel like I've been sleeping 
 Sweet, sweet time 
 Has been a real good friend of mine 
 Waiting for that change of season 
 Oh the winter's been so long 
 Searching for that rhyme or reason 
 You've just got to 
 Move on 
 Hold it together, move on 
 Life's so short, move on 
 Only time can set you free 
 You put your fears behind you 
 Better get yourself where you wanna be 
 I think of all the days and night that I spent crying 
 And I move on 
 I've been in and out of favour with love 
 Because I gotta tell ya 
 I've been things I never wanted to be 
 And then some angel called me up 
 Told me I was sleeping 
 Don't waste time 
 'Cause even angels say goodbye 
 Waiting for that change of season 
 Oh the winter's been so long 
 Searching for that rhyme or reason 
 You've just got to 
 Move on 
 Hold it together, move on 
 Life's so short, move on 
 Only time can set you free 
 You put your tears behind you 
 Better get yourself where you wanna be 
 I think of all the days and night that I spent crying 
 Endlessly 
 And oh, there goes another season 
 Getting hard to find a decent song to play 
 But oh, I guess I got my reasons 
 Everybody thinks I'm doing AOK 
 They ought to know by now 
 Move on 
 Hold it together, move on 
 Life's so short, move on 
 Only time can set you free 
 You put your tears behind you 
 Better get yourself where you wanna be 
 I think of all the days and night that I spent crying 
 Until my angel set me free 
 I'm gonna be lucky in love someday"
36,George Michael,pop,Star People,"Star people 
 Counting your money until your soul turns green 
 Star people 
 Counting the cost of your desire to be seen 
 I do not count myself among you 
 I may be living in a dream 
 It's just there seems so many of you 
 Can't help but hope there's a difference between... 
 You and me 
 (You're a star) 
 I'm talking to you 
 And you should go far (you're a star) 
 I said, maybe your mama gave you up boy 
 (It's the same old same old) 
 Maybe your daddy didn't love you enough, girl 
 (How much is enough) 
 Star people 
 Never forget you're secret's safe with me, just 
 Look at all the wonderful people 
 Trying to forget they had to pay for what you see 
 It's a dream 
 With a nightmare stuck in the middle 
 But listen brother, where would you be 
 Without all of that attention 
 You'd die, I'd die, we'd die 
 Wouldn't we? 
 Well wouldn't we 
 Big, big, star! 
 Should go far! 
 I said, maybe your mama gave you up boy 
 (It's the same old same old) 
 Maybe your daddy didn't love you enough, girl 
 (How much is enough) 
 Talk about your mother, talk about your father 
 Talk about the people who have made you what you are 
 Talk about your teacher, the bully boy who beat you 
 Talk about the people who have paid for that new sports car 
 Did you get off on a bad foot, baby 
 Do you have a little tale to tell 
 Is that why you're a star? 
 Is that what makes a star? 
 Now, nothing comes from nothing, baby 
 That fame and fortune's heaven sent 
 And who gives a f*** about your problems, darling 
 When you can pay the rent 
 How much is enough?"
37,George Michael,pop,You Have Been Loved,"She takes the back road and the lane 
 Past the school that has not changed 
 In all this time 
 She thinks of when the boy was young 
 All the battles she had won 
 Just to give him life 
 That man 
 She loved that man 
 For all his life 
 But now we meet to take him flowers 
 And only God knows why 
 For what's the use in pressing palms 
 When children fade in mother's arms 
 It's a cruel world 
 We've so much to lose 
 And what we have to learn we rarely choose 
 So if it's God who took her son 
 He cannot be the one living in her mind 
 Take care my love, she said 
 Don't think that God is dead 
 Take care my love, she said 
 You have been loved 
 If I was weak, forgive me 
 But I was terrified 
 You brushed my eyes with angels wings, full of love 
 The kind that makes devils cry 
 So these days 
 My life has changed 
 And I'll be fine 
 But she just sits and counts the hours 
 Searching for her crime 
 So what's the use of pressing palms 
 If you won't keep such love from harm 
 It's a cruel world 
 You've so much to prove 
 And heaven helps the ones who wait for you 
 Well I've no daughters, I've no sons 
 Guess I'm the only one 
 Living in my life 
 Take care my love, he said 
 Don't think that God is dead 
 Take care my love, he said 
 You have been loved..."
38,George Michael,pop,Free,"Feels good 
 To be free..."
39,George Michael,pop,Outside,"I think I'm done with the sofa 
 I think I'm done with the hall 
 I think I'm done with the kitchen table, baby 
 Let's go outside (let's go outside) in the sunshine 
 I know you want to, but you can't say yeah 
 Let's go outside in the moonshine 
 Take me to the places that I love best 
 So my angel, she says, don't you worry 
 'Bout the things they're saying, yeah 
 Got no friends in high places and the game that you gave away 
 Wasn't worth playing 
 Let's go outside in the sunshine 
 I know you want to, but you can't say yeah 
 Let's go outside in the meantime 
 Take me to the places that I love best 
 And yes, I've been bad 
 Doctor, won't you do with me what you can 
 You see I think about it all the time, twenty-four seven 
 (Twenty- four, twenty-four seven) 
 You say you want it, you got it 
 I never really said it before 
 There's nothing here, but flesh and bone 
 There's nothing more, nothing more 
 There's nothing more, oh, oh, oh 
 Back to nature, just human nature 
 Getting on back to 
 I think I'm done with the sofa 
 I think I'm done with the hall 
 I think I'm done with the kitchen table, baby 
 Let's go outside in the sunshine 
 I know you want to, but you can't say yeah 
 Let's go outside in the moonshine 
 Take me to the places that I love best 
 And yes, I've been bad 
 Doctor, won't you do with me what you can 
 You see I think about it all the time 
 I'd service the community but I already have you see 
 I never really said it before 
 There's nothing here, but flesh and bone 
 There's nothing more, nothing more 
 There's nothing more 
 Let's go outside 
 Dancing on the D-train, baby 
 (You want it, you got it) 
 When the moon is high 
 (You want it, you got it) 
 And the grass is jumpin' 
 Come on, just keep on funkin' 
 (I'm dancing on the D-train) 
 Keep on funkin', just keep on funkin' 
 I'm dancing on the D-train 
 I'm dancing on the D-train..."
40,George Michael,pop,Star People ('97 Single Remix),"(Keep dreaming) 
 Star people 
 Counting your money until you soul turns green 
 Star people 
 Counting the cost of you desire to be seen 
 I do not count myself among you 
 I may have been living in a dream 
 It's just that there seem so many of you 
 Can't help but hope there's a difference between 
 And if I love to be a hundred and one 
 I will never understand what you are. honey? 
 I'm looking for sympathy 
 Just get me on NBC 
 And where the hell's my dumb ass PR? 
 Yeah-a-yeah 
 I said maybe your mama gave you up boy 
 (It's the same old, same old) 
 I said maybe your daddy didn't love you enough girl 
 (How much is enough) 
 Star people 
 Never gorget your secret's safe with me 
 Just look at all the wonderful people 
 Trying to fotget just who and what they have been 
 Oh (oh) it's a dream (it's a dream) 
 With a nightmare stuck in the middle (middle) 
 Are you serious? I'm just curious 
 Without all this attention 
 You'd die 
 I'd die 
 We'd die 
 And if I live to be a hundred and one (wouldn't we baby) 
 I will never understand what you are (ooh, I'm talking to you) 
 You're looking for sympathy from people who work to eat 
 And they don't really seem to mind 
 Yeah-a-yeah 
 Yeah-a-yeah 
 I said maybe your mama gave you up boy 
 (It's the same old, same old) 
 I said maybe (baby) your daddy didn't love you enough 
 (Love you enough) girl 
 How much is enough? 3x 
 Are you serious? I'm just curious 7x 
 Yeah, more glycerine 
 Let's go back to the day 
 Huh DJ (why do you wanna tell me that?) 
 DJ (get yourself some Oprah case) 
 Is that what makes a star? ooh 
 Do you really think you've got it so hard? huh? 
 Do you think it might do you some good to look around you 
 And decide how you night feel 
 If the pain you felt was real 
 Tell me 
 Is that why you're a star? 
 Now nothing comes for nothing baby oh 
 That fame and fortune's heaven sent 
 And who gives a f*** about your problems darling 
 'Cause you can pay the rent 
 You can pay, pay, pay, pay, pay, pay, pay, pay 
 You can pay, is that why you're a star? 
 Cry baby, cry baby 
 Baby you're a star 
 Is that why you're a star? 
 Baby, baby you're a star"
41,George Michael,pop,You Know That I Want To,"Lover don't love too much 
 It's a bad thing, a sad thing 
 And it's heaven to the touch 
 Hey, everybody's got some moment in their life 
 They can't change (don't they, baby?) 
 I know you don't care what's right or wrong 
 All that I know 
 Is that love don't belong here 
 And so it's better to turn the page 
 And watch me walk away, 
 My dear, watch me walk away 
 But you say 
 I can't stop but you know that I want to 
 I can't stop don't you know that I want you 
 I want you baby (more than ever) 
 I can't stop but you know that I want to 
 I can't stop don't you know that I want you 
 But it's never gonna be that easy child 
 Lover don't love too much 
 I'm a bad boy, I'm a sad boy 
 And I'll never give you much 
 Hey, everybody's got some moment in their life 
 They can't change 
 So I do not dare to take you home 
 All that I know 
 Is that something is so wrong with this heat 
 Why do you touch the flame? 
 You know you feel the pain, my dear 
 You always find it here 
 But you say 
 I can't stop but you know that I want to 
 I can't stop don't you know that I want you 
 (Please don't say it) 
 I want you baby (more that ever) 
 I can't stop but you know that I want to 
 I can't stop don't you know that I want you 
 But it's never gonna be that easy child 
 You need a lover 
 And I am just a friend ..."
42,George Michael,pop,Safe,"Sweet thing 
 I know how strong I can appear 
 But your don't know the days 
 Since somebody loved me 
 You came 
 And led me through that door again 
 You say you want to stay 
 But you don't know me (no you don't) 
 You make me feel safe 
 Someday 
 My darkest fears will find their way 
 After all 
 Somebody loves me 
 All day 
 My heart tells strangers how I feel 
 And it's hard not to feel this way 
 When you thought your future was on prescription 
 You make me feel safe"
43,George Michael,pop,Careless Whisper,"Time can never mend 
 The careless whispers of a good friend 
 To the heart and mind 
 Ignorance is kind 
 There's no comfort in the truth 
 Pain is all you find 
 Should have known better, yeah 
 Oh, oh 
 I feel so unsure 
 As I take your hand and lead you to the dance floor 
 As the music dies 
 Something in your eyes 
 Calls to mind a silver screen and all its sad goodbyes 
 I'm never gonna dance again 
 Guilty feet have got no rhythm 
 Though it's easy to pretend 
 I know you're not a fool 
 I should have known better than to cheat a friend 
 And waste a chance that I'd been given 
 So I'm never gonna dance again 
 The way I danced with you, oh 
 Time can never mend 
 The careless whispers of a good friend 
 To the heart and mind 
 Ignorance is kind 
 There's no comfort in the truth 
 Pain is all you find 
 I'm never gonna dance again 
 Guilty feet have got no rhythm 
 Though it's easy to pretend 
 I know you're not a fool 
 I should have known better than to cheat a friend 
 (Should have known better, yeah) 
 And waste a chance that I'd been given 
 So I'm never gonna dance again 
 The way I danced with you, ooh 
 Never without your love 
 Tonight the music seems so loud 
 I wish that we could lose this crowd 
 Maybe it's better this way 
 We'd hurt each other with the things we want to say 
 We could have been so good together 
 We could have lived this dance forever 
 But now who's gonna dance with me? 
 Please stay 
 And I'm never gonna dance again 
 Guilty feet have got no rhythm 
 Though it's easy to pretend 
 I know you're not a fool 
 I should have known better than to cheat a friend 
 And waste a chance that I'd been given 
 So I'm never gonna dance again 
 The way I danced with you, oh 
 (Now that you're gone) Now that you're gone 
 (Now that you're gone) Was what I did so wrong, so wrong 
 That you had to leave me alone?"
44,George Michael,pop,I Can't Make You Love Me,"Turn down the lights, turn down the bed 
 Turn down these voices inside my head 
 Lay down with me, tell me no lies 
 Just hold me close, don't patronize 
 Don't patronize me 
 'Cause I can't make you love me if you don't 
 You can't make your heart feel something it won't 
 Here in the dark, in these final hours 
 I will lay down my heart and I'll feel the power 
 But you won't, no you won't 
 'Cause I can't make you love me if you don't 
 I'll close my eyes, then I won't see 
 The love you don't feel when you're holding me 
 Morning will come and I'll do what's right 
 Just give me 'til then to give up this fight 
 And I will give up this fight 
 'Cause I can't make you love me if you don't 
 You can't make your heart feel something it won't 
 Here in the dark, in these final hours 
 I will lay down my heart and I'll feel the power 
 But you won't, no you won't 
 'Cause I can't make you love me if you don't 
 Ain't no use in you trying 
 If you don't love me 
 Baby 
 Ain't no use in you trying 
 If you don't, if you don't 
 If you don't, if you don't love me 
 Ain't nothing I can do"
45,George Michael,pop,A Moment With You,"(You can't keep holding it in when it's something good) 
 Hey, this won't take much time 
 We won't touch, we'll just wait for signs 
 And nothing was further from my mind 
 Than this moment with you 
 But if you'd only told me baby 
 I would have made some other plans 
 If I'd only seen it sooner 
 But what a way with your hands you had 
 I wanted that moment with you 
 I know that it's wrong 
 But if you need me, I'm here, turns me on 
 I can't help thinking it's a miracle you're here 
 I can't help thinking it's a miracle 
 Say, don't waste much time 
 We don't touch, do we baby? 
 But still my hands are tied 
 For that moment with you 
 But if you'd only told me baby 
 I would have made some other plans 
 If I'd only seen it sooner 
 But what a way with your hands you had 
 I wanted that moment with you 
 You know that I'm strong 
 And I've no reason to fear, am I wrong? 
 I can't help thinking it's a miracle you're here 
 I can't help thinking it's a miracle 
 I can't help thinking it's a miracle 
 I can't help thinking it's a miracle 
 I can't help thinking it's a miracle you're here 
 You can't keep holding it in when it's something good 
 Get up, get up 
 You can't keep holding it in when it's something good 
 Get up, get up 
 And who can you trust? dealing out justice 
 With a minimum of fuss 
 Who baby? 
 Dealing out justice..."
46,George Michael,pop,Desafinado (English),"Unfortunately, we are not licensed to display the full lyrics for this song at the moment. Hopefully we will be able to in the future. Until then... how about a 
 random page 
 ?"
47,George Michael,pop,A Different Corner,"I'd say love was a magical flame 
 I'd say love would keep us from pain 
 Had I been there, had I been there 
 I would promise you all of my life 
 But to lose you would cut like a knife 
 So I don't dare, no I don't dare 
 'Cause I've never come close in all of these years 
 You are the only one to stop my tears 
 And I'm so scared, I'm so scared 
 Take me back in time maybe I can forget 
 Turn a different corner and we never would have met 
 Would you care 
 I don't understand it, for you it's a breeze 
 Little by little you've brought me to my knees 
 Don't you care 
 No I've never come close in all of these years 
 You are the only one to stop my tears 
 I'm so scared of this love 
 And if all that there is, is this fear of being used 
 I should go back to being lonely and confused 
 If I could, I would, I swear 
 Oh, I swear"
48,George Michael,pop,As,"As around the sun the earth knows she's revolving 
 And the rosebuds know to bloom in early May 
 Just as hate knows love's the cure 
 You can rest your mind assure 
 That I'll be loving you always 
 As now can't reveal the mystery of tomorrow 
 But in passing will grow older every day 
 Just as all is born is new 
 Do know what I say is true 
 That I'll be loving you always 
 Until the rainbow burns the stars out in the sky (Always) 
 Until the ocean covers every mountain high (I said, it's gonna be always) 
 Until the day that 8 times 8 times 8 is 4 (You know it's gonna be always) 
 Until the day that is the day that I'm no more 
 Did you know that true love asks for nothing? 
 Her acceptance is the way we pay 
 Did you know that life has given love a guarantee 
 To last through forever and another day? 
 As today I know I'm living 
 But tomorrow could make me the past 
 But that I mustn't fear, 'cause you're here 
 As today I know I'm living but tomorrow 
 Could make me the past but that I mustn't fear 
 For I'll know deep in my mind 
 The love of me I've left behind 
 And I'll be loving you always 
 Until the rainbow burns the stars out in the sky (Loving you) 
 Until the ocean covers every mountain high (I'll be loving you) 
 Until the dolphin flies and parrots live at sea (Loving you) 
 Until we dream of life and life becomes a dream (Now, ain't that loving you?) 
 Until the day is night and night becomes the day (Always) 
 Until the trees and seas just up and fly away (I'll be loving you forever) 
 Until the day that 8 times 8 times 8 is 4 (Always) 
 Until the day that is the day that are no more 
 Did you know that true love asks for nothing? (True love don't want a thing) 
 Her acceptance is the way we pay 
 Did you know that life has given love a guarantee 
 To last through forever and another day? 
 As around the sun the earth knows she's revolving 
 And the rosebuds know to bloom in early May 
 For I'll know deep in my mind 
 The love of me I've left behind 
 And I'll be loving you always 
 Until the rainbow burns the stars out in the sky (I'll be loving you) 
 Until the ocean covers every mountain high (Always) 
 Until the dolphin flies and parrots live at sea (Forever) 
 Until we dream of life and life becomes a dream (Now, ain't that loving you?) 
 Until the day is night and night becomes the day (Now, ain't that loving you?) 
 Until the trees and seas just up and fly away (I'll be loving you forever) 
 Until the day that 8 times 8 times 8 is 4 
 Until the day that is the day that are no more 
 Always, always, always..."
49,George Michael,pop,Too Funky,"Hey, you're just too funky for me 
 I gotta get inside of you 
 And I'll show you heaven 
 If you let me 
 Hey, you're just too funky for me 
 I gotta get inside (I gotta get inside) 
 I gotta get inside of you 
 So when will that be? 
 I watch your fingers working overtime (overtime) 
 I've got to thinking that they should be mine (oh) 
 I'd love to see you naked baby 
 I'd like to think that sometime maybe tonight 
 If that's alright, yeah 
 Hey, you're just too funky for me 
 I gotta get inside of you 
 Won't let you go, I won't let you no no 
 Hey, you're just too funky for me 
 I gotta get inside (I gotta get inside) 
 I gotta get inside of you 
 I'll make you love me 
 I watch you drinking and I take my time (take my time) 
 I watch you sinking all of that cheap red wine (oh) 
 I've got to see you naked baby 
 I'd like to think that sometime maybe tonight 
 My goal's in sight, yeah 
 Baby, baby, baby why do you do this to me? 
 Won't let you go (won't let you go) 
 You're such a... you're such a... 
 Baby, baby, baby, why do you do this to me? 
 I got to know (I got to know) 
 (I'm gonna be the kind of lover that you never had) 
 Hey, you're just too funky 
 (You're never gonna have another lover in your bed) 
 You're just too funky for me 
 (Would you like me to seduce you? 
 Is that what you're trying to tell me?) 
 Everybody wants a lover like that, baby 
 Everybody wants a lover like that 
 Yeah, yeah 
 Everybody wants a lover like that 
 Everybody, everybody 
 Everybody wants a lover like that 
 (Is that what you're trying to tell me?) 
 Everybody wants a lover 
 Everybody wants a lover like that 
 Everybody wants a lover like that 
 Everybody wants a lover like that 
 Everybody wants a lover like that 
 (Would you like me to seduce you?) 
 You're such a... you're such a... 
 (Would you like me to seduce you?) 
 Yeah, yeah 
 (Would you like me to seduce you?) 
 You're such a... you're such a... 
 Yeah, yeah 
 (Would you stop playing with that radio of yours? 
 I'm trying to get to sleep)"
50,George Michael,pop,Killer / Papa Was A Rollin' Stone,"So you want to be free 
 To live your life the way you wanna be 
 Will you give if we cry 
 Will we live or will we die 
 Tainted hearts heal with time 
 Shoot bad love so we can 
 Stop the bleeding 
 Solitary brother, is there still a part of you that 
 Wants to live? 
 Solitary sister, is there still a part of you that 
 Wants to give? 
 Solitary brother, is there still a part of you that 
 Wants to live? 
 Solitary sister, is there still a part of you that 
 Wants to give? 
 If we try to live our lives 
 The way we wanna be 
 Solitary brother, is there still a part of you that 
 Wants to live? 
 Solitary sister, is there still a part of you that 
 Wants to give? 
 Solitary brother, is there still a part of you that 
 Wants to live? 
 Solitary sister, is there still a part of you that 
 Wants to give? 
 Racism in future kings can only lead to no good 
 And besides, all our sons and daughters already 
 Know that feels 
 It was the third of September 
 That day I'll always remember, yes I will 
 'Cause that was the day that my daddy died 
 Never had a chance to see him, no 
 Never heard nothin' but bad things about him 
 Mama, I'm depending on you to tell me the truth 
 Mama just hung her head and said 
 Papa was a rollin' stone 
 Wherever he laid his hat was his home 
 (And when he died) 
 All he left us was alone 
 All he left us was alone 
 Hey, mama, is it true what they say 
 That papa never worked a day in his life 
 Some bad talks going around sayin' 
 Papa had three outside children 
 And another wife 
 That ain't right 
 Heard some talks about papa and his storefront 
 Preachin' 
 Talkin' about saving souls and all the time 
 Leaching 
 And dealing in the dirt 
 Stealin' in the name of the lord 
 But mama she just said 
 Papa was a rollin' stone 
 Wherever he laid his hat was his home 
 (And when he died) 
 All he left us was alone 
 All he left us was alone 
 Say, I heard my papa was a jack of all trades 
 Is that what sent papa to an early grave? 
 Folks say papa would beg, borrow of steal just 
 To pay his bills 
 Hey, mama, folks say papa was ever much on thinkin' 
 Spent most of this time chasin' women and drinkin' 
 But mother, I'm depending on you to tell me the truth 
 But my mama she just said 
 Papa was a rollin' stone 
 Wherever he laid his hat was his home 
 (And when he died) 
 All he left us was alone 
 All he left us was alone 
 Papa was a rollin' stone 
 Wherever he laid his hat was his home 
 (And when he died) 
 All he left us was alone 
 All he left us was alone 
 But my mama she said 
 Papa was a rollin' stone 
 Oh my mama said 
 Wherever he laid his hat was his home 
 And when he died 
 All he left us was alone 
 All he left us was alone 
 All he left us 
 All he left us 
 Can you believe he left us? 
 All alone yeah 
 All alone yeah 
 All alone yeah 
 Yeah"
51,George Michael,pop,Brother Can You Spare A Dime,"Once I built a railroad, made it run 
 Made it race against time 
 Once I built a railroad, now it's done 
 Brother can you spare a dime? 
 Once I built a tower to the sun 
 Brick and rivet and lime 
 Once I built a tower, now it's done 
 Brother can you spare a dime? 
 Once in khaki suits 
 Gee, we looked swell 
 Full of that yankee doodle de dum 
 Half a million boots went slogging through hell 
 I was the kid with the drum 
 Say don't you remember, they called me Al 
 It was Al all the time 
 Say don't you remember, I'm your pal! 
 Buddy can you spare a dime? 
 Once I built a railroad, made it run 
 Made it race against time 
 Once I built a railroad, now it's done 
 Brother can you spare a dime? 
 Once I built a tower to the sun 
 Brick and rivet and lime 
 Once I built a tower, now it's done 
 Brother can you spare a dime? 
 Once in khaki suits 
 Gee, we looked swell 
 Full of that yankee doodle de dum 
 Half a million boots went slogging through hell 
 I was the kid with the drum 
 Say don't you remember, they called me Al 
 It was Al all the time 
 Say don't you remember, I'm your pal! 
 Buddy can you spare a dime?"
52,George Michael,pop,Roxanne,"Roxanne 
 You don't have to put on the red light 
 Those days are over 
 You don't have to sell your body to the night 
 Roxanne 
 You don't have to wear that dress tonight 
 Walk the streets for money 
 You don't care if it's wrong or if it's right 
 Roxanne 
 You don't have to put on the red light 
 I loved you since I knew you 
 I wouldn't talk down to you 
 I have to tell you just how I feel 
 I won't share you with another boy 
 I know my mind is made up 
 So put away your make up 
 Told you once I won't tell you again 
 It's a bad way 
 Roxanne 
 You don't have to put on the red light 
 Roxanne 
 You don't have to put on the red light"
