,0,1,2,3
84,Queen,rock,Need Your Loving Tonight,"No I'll never look back in anger 
 No I'll never find me an answer 
 You promised me you'd keep in touch 
 I read your letter and it hurt me so much 
 I said I'd never never be angry with you 
 I don't wanna feel like a stranger no 
 'Cause I'd rather stay out of danger 
 I read your letter so many times 
 I got your meaning between the lines 
 I said I'd never never be angry with you 
 I must be strong so she won't know how much I miss her 
 I only hope as time goes on I'll forget her 
 My bodies aching can't sleep at night 
 I'm to exhausted to start a fight 
 And if I see her with another guy 
 I'll eat my heart out 'cause I love her 
 Love her love her love her 
 Come on baby let's get together 
 I'll love you baby I'll love you forever 
 I'm trying hard to stay away 
 What made you change? What did I say? 
 Ooh I need your loving tonight 
 Ooh I need your loving 
 Ooh I need your loving 
 Ooh I need your loving babe tonight 
 Hit me 
 Ooh I need your loving tonight 
 No I'll never look back in anger 
 No I'll never find me an answer 
 Can't be no warning how could I guess? 
 I'll have to learn to forgive and forget 
 Ooh I need your loving 
 Ooh I need your loving 
 Ooh I need your loving tonight"
85,Queen,rock,Crazy Little Thing Called Love,"This thing called love, I just can't handle it 
 This thing called love, I must get 'round to it 
 I ain't ready 
 Crazy little thing called love 
 This thing 
 (this thing) 
 called love 
 (called love) 
 It cries 
 (like a baby) 
 in a cradle all night 
 It swings 
 (woo-ooo) 
 , it jives 
 (woo-woo) 
 It shakes all over like a jelly fish 
 I kinda like it 
 Crazy little thing called love 
 There goes my baby 
 She knows how to rock and roll 
 She drives me crazy 
 She gives me hot and cold fever 
 Then she leaves me in a cool, cool sweat 
 I gotta be cool, relax 
 Get hip, get on my tracks 
 Take a back seat, hitchhike 
 And take a long ride on my motor bike 
 Until I'm ready 
 Crazy little thing called love 
 Yeah, I gotta be cool relax 
 Get hip and get on my tracks 
 Take a back seat, hitchhike 
 And take a long ride on my motor bike 
 Until I'm ready 
 (ready Freddie) 
 Crazy little thing called love 
 This thing called love, I just can't handle it 
 This thing called love, I must get round to it 
 I ain't ready 
 (ooh) 
 Crazy little thing called love 
 Crazy little thing called love 
 (yeah, yeah) 
 Crazy little thing called love 
 (yeah, yeah) 
 Crazy little thing called love 
 (yeah, yeah) 
 Crazy little thing called love 
 (yeah, yeah) 
 Crazy little thing called love 
 (yeah, yeah) 
 Crazy little thing called love 
 (yeah, yeah) 
 Crazy little thing called love 
 (yeah, yeah) 
 Crazy little thing called love 
 (yeah, yeah)"
86,Queen,rock,Rock It (Prime Jive),"When I hear that rock and roll 
 It gets down to my soul 
 When it's real rock and roll 
 When I hear that rock and roll 
 It gets down to my soul 
 When it's real rock and roll 
 Oh rock and roll 
 Oh Oh Oh Oh Oh Oh 
 You really think they like to rock in space 
 Well I don't know 
 What do you know? 
 What do you hear 
 On the radio? 
 Coming through the air 
 I said Moma 
 I ain't crazy 
 I'm all right - all right 
 Hey c'mon baby said it's all right 
 To rock'n'roll on a Saturday night 
 I said 'shoot and get your suit and come along with me' 
 I said 'c'mon baby down come and rock with me' I said 
 'Yeah' 
 What do you do? 
 To get to feel alive 
 You go downtown 
 And get some of that prime jive 
 I said Moma 
 I ain't crazy 
 I'm all right - all right 
 Hey c'mon baby said it's all right 
 To rock'n'roll on a Saturday night 
 I said 'shoot and get your suit and come along with me' 
 I said 'c'mon baby down come and rock with me' I said 
 'Yeah' 
 We're gonna rock it 
 Hey c'mon baby said it's all right 
 To rock'n'roll on a Saturday night 
 I said 'shoot and get your suit and come along with me' 
 I said 'c'mon baby down come and rock with me' I said 
 'Yeah' 
 We're gonna rock it... tonight 
 (We want some prime jive) 
 (We want some prime jive)... 
 We're gonna rock it tonight 
 (We want some prime jive)... 
 C'mon honey 
 (We want some prime jive) 
 We're rocking tonight 
 C'mon c'mon c'mon c'mon 
 We're rocking tonight 
 C'mon honey we're rocking tonight 
 Get get get get get 
 Get some of that prime jive 
 Get some of that prime jive 
 C'mon c'mon c'mon c'mon c'mon c'mon honey 
 Get some of that prime jive 
 Get some of that get get down (down) 
 C'mon honey - c'mon honey - we're gonna rock it tonight"
87,Queen,rock,Don't Try Suicide,"A-one two three four one 
 Yeah 
 Okay 
 Don't do it don't you try it baby 
 Don't do that 
 Don't don't don't 
 Don't do that 
 You got a good thing going now 
 Don't do it don't do it 
 Don't 
 Don't try suicide 
 Nobody's worth it 
 Don't try suicide 
 Nobody cares 
 Don't try suicide 
 You're just gonna hate it 
 Don't try suicide 
 Nobody gives a damn 
 So you think it's the easy way out? 
 Think you're gonna slash your wrists 
 This time 
 Baby when you do it all you do is 
 Get on my tits 
 Don't do that try try try baby 
 Don't do that -you got a good thing going now 
 Don't do it don't do it 
 Don't 
 Don't try suicide 
 Nobody's worth it 
 Don't try suicide 
 Nobody cares 
 Don't try suicide 
 You're just gonna hate it 
 Don't try suicide 
 Nobody gives a damn 
 You need help 
 Look at yourself you need help (yeah, yeah) 
 You need life 
 So don't hang yourself 
 It's okay, okay, okay, okay 
 You just can't be a prick teaser all of the time 
 A little bit attention-you got it 
 Need some affection-you got it 
 Suicide suicide suicide bid 
 Suicide suicide suicide bid 
 Suicide 
 Don't do it don't do it don't do it babe (yeah) 
 Don't do it don't do it don't-do it 
 Hey! 
 Hey, yeah! 
 Don't put your neck on the line 
 Don't drown on me babe 
 Blow your brains out - 
 Don't do that (yeah) 
 Don't do that-you got a good thing going baby 
 Don't do it (no) don't do it (no) don't 
 Don't try suicide 
 Nobody's worth it 
 Don't try suicide 
 Nobody cares 
 Don't try suicide 
 You're just gonna hate it 
 Don't try suicide 
 Nobody gives 
 Nobody gives 
 Nobody gives a damn 
 Okay"
88,Queen,rock,Sail Away Sweet Sister,"Hey little babe you're changing 
 Babe are you feeling sore? 
 It ain't no use in pretending 
 You don't wanna play no more 
 It's plain that you ain't no baby 
 What would your mother say? 
 You're all dressed up like a lady 
 How come you behave this way? 
 Sail away sweet sister 
 Sail across the sea 
 Maybe you'll find somebody 
 To love you half as much as me 
 My heart is always with you 
 No matter what you do 
 Sail away sweet sister 
 I'll always be in love with you 
 Forgive me for what I told you 
 My heart makes a fool of me 
 You know that I'll never hold you 
 I know that you gotta be free 
 Sail away sweet sister 
 Sail across the sea 
 Maybe you'll find somebody 
 To love you half as much as me 
 Take it the way you want it 
 But when they let you down my friend 
 Sail away sweet sister 
 Back to my arms again 
 Hot child don't you know you're young 
 You got your whole life ahead of you? 
 And you can throw it away too soon 
 Way too soon 
 Sail away sweet sister 
 Sail across the sea 
 Maybe you'll find somebody's 
 Gonna love you half as much as me 
 My heart is always with you 
 No matter what you do 
 Sail away sweet sister 
 I'll always be in love with you"
89,Queen,rock,Coming Soon,"Oh Oh Oh 
 I get some headaches when I hit the heights 
 Like in the morning after crazy nights 
 Like some mother in law in her nylon tights 
 They're always 
 They're always 
 They're always 
 They're always 
 Coming soon 
 Coming soon on the outside of the tracks 
 You take 'em 
 The same old babies with the same old toys 
 The neighbours screaming when the noise annoys 
 Somebody naggin' you when you're out with the boys 
 They're always 
 They're always 
 They're always 
 They're always 
 Coming soon 
 Coming soon on the outside of the track 
 They're always 
 They're always 
 They're always 
 They're always 
 Coming soon 
 Coming soon on the outside of the track 
 Coming soon 
 Coming soon on the outside of the track 
 Yeah yeah yeah"
90,Queen,rock,Save Me,"It started off so well 
 They said we made a perfect pair 
 I clothed myself in your glory and your love 
 How I loved you 
 How I cried... 
 The years of care and loyalty 
 Were nothing but a sham it seems 
 The years belie we lived a lie 
 I love you till I die 
 Save me save me save me 
 I can't face this life alone 
 Save me save me save me... 
 I'm naked and I'm far from home 
 The slate will soon be clean 
 I'll erase the memories 
 To start again with somebody new 
 Was it all wasted 
 All that love?... 
 I hang my head and I advertise 
 A soul for sale or rent 
 I have no heart I'm cold inside 
 I have no real intent 
 Save me save me save me 
 I can't face this life alone 
 Save me save me save me... 
 I'm naked and I'm far from home 
 Each night I cry I still believe the lie 
 I love you till I die 
 Save me save me save me 
 Don't let me face my life alone 
 Save me save me ooh... 
 I'm naked and I'm far from home"
91,Queen,rock,A Human Body,"Words and music by Roger Taylor 
 They were talking in whispers 
 In bear skins and fur 
 Captain Scott and his heroes to be 
 To have laboured so long 
 To have made it this far 
 Ooh it's been such a long ride 
 Ooh you know it's been a long way 
 For a human human human 
 For a human body you see 
 Can you believe it happens? 
 Now it happens here 
 Do you believe do you believe or really care 
 Can you believe it happens? 
 Now it happens here 
 To a human human 
 With a human body you see 
 There ain't nobody gets out of this moonlight 
 Today is surprisingly fair 
 Oh oh oh oh woo woo 
 We've got problems the Lone Ranger can't fix 
 The invisible man couldn't see 
 It takes a tough guy 
 To learn some new tricks 
 Ooh it takes such a long time 
 Ooh it's been such a long way 
 For a human human human 
 For a human body you see 
 Can you believe it happens? 
 Now it happens here 
 Do you believe do you believe or really care 
 Can you believe it happens? 
 Now it happens here 
 To a human human 
 With a human body you see 
 You know it's been such a long while 
 It's been such a long while 
 Takes such a long time 
 It takes such a long time 
 It's been such a long way 
 Been such a long way 
 It's been such a long while 
 Been such a long while 
 Yeah yeah yeah yeah yeah yeah! 
 It's gonna be a long ride"
92,Queen,rock,It's A Beautiful Day,"It's a beautiful day 
 The sun is shining 
 I feel good 
 And no-one's gonna stop me now, oh yeah 
 It's a beautiful day 
 I feel good, I feel right 
 And no-one, no-one's gonna stop me now, mama 
 Sometimes I feel so sad, so sad, so bad 
 But no-one's gonna stop me now, no-one 
 It's hopeless - so hopeless to even try"
93,Queen,rock,Flash's Theme,"Flash, ah, savior of the universe 
 Flash, ah, he'll save every one of us 
 ""Seemingly there is no reason for these 
 Extraordinary intergalactical upsets"" (ha ha ha) 
 (What's happening Flash?) 
 ""Only Dr. Hans Zarkov, formerly at NASA 
 Has provided any explanation"" 
 Flash, ah, he's a miracle 
 ""This morning's unprecedented solar eclipse 
 Is no cause for alarm"" 
 Flash, ah, king of the impossible 
 He's for every one of us 
 Stand for every one of us 
 He'll save with a mighty hand 
 Every man, every woman, every child 
 With a mighty Flash 
 ""General Kala 
 Flash Gordon approaching"" 
 ""What do you mean 
 'Flash Gordon approaching'? 
 Open fire, all weapons! 
 Dispatch war rocket Ajax 
 To bring back his body!"" 
 Flash, ah 
 ""Gordon's alive!"" 
 Flash, ah, he'll save ev'ry one of us 
 Just a man with a man's courage 
 He knows nothing but a man 
 But he can never fail 
 No one but the pure in heart 
 May find the golden grail oh, oh, oh, oh 
 ""Flash, Flash I love you 
 But we only have fourteen hours 
 To save the Earth!"" 
 Flash"
94,Queen,rock,Football Fight,"Football Fight 
 Track 5. Written by Freddie Mercury. Album Version 1:29 
 Dialogue: 
 Ming: Klytus, are your men on the right pills? Maybe you should execute their trainer? 
 Flash Gordon: 41, 42 
 Dale Arden: Go Flash go, go Flash go, go Flash go, go Flash go"
95,Queen,rock,The Wedding March,"One dance whose steps I never could learn 
 It's called the wedding march 
 The grace that it takes, the grace you deserve, 
 Require a lighter touch 
 I know you love dancing. 
 Oh, I know that you love dancing so much 
 I know you love dancing. 
 Music's a wild thing with mischief to prove 
 I can't adjust to the way that you move 
 Music's a wild thing whatever the groove 
 Some music isn't for dancing 
 One dance whose steps I never could learn 
 It's called the wedding march 
 The grace that it takes, the balance and poise, 
 I still find a mystery 
 I know you love dancing. 
 So, I know that you'd hate dancing with me 
 I know you love dancing. 
 So, I know that you'd hate dancing with me"
96,Queen,rock,Flash's Theme Reprise (Victory Celebrations),"Flash's Theme Reprise (Victory Celebrations) 
 He's for everyone of us 
 Stand for everyone of us 
 He'll save with a mighty hand 
 Every man every woman every child 
 He's the mighty flash 
 No-one but the pure in heart may find the golden grail 
 Oh oh - oh oh 
 Flash"
97,Queen,rock,The Hero,"Words and music by Brian May 
 So you feel that you ain't nobody 
 Always needed to be somebody 
 Put your feet on the ground 
 Put your hand on your heart 
 Lift your head to the stars 
 And the world's for your taking 
 So you feel it's the end of the story 
 Find it all pretty satisfactory 
 Well I tell you my friend 
 This might seem like the end 
 But the continuation 
 Is yours for the making 
 Yes you're a hero"
98,Queen,rock,Staying Power,"Let me show it to you yeah 
 See what I got - I got a hell of a lot 
 Tell me what you feel 
 Is it real is it real? 
 You know I got what it takes 
 And I can take a lot 
 Did you hear the last call baby? 
 You and me got staying power yeah! 
 You and me we got staying power 
 Staying power (I got it I got it) 
 I wonder when we're gonna make it 
 I wonder when we're gonna shake it 
 Rock me baby rock me 
 C'mon you can shock me 
 Let's catch on to the groove 
 Make it move make it move 
 You know how to shake that thing 
 We'll work it work it work it 
 You and I can play ball baby 
 You and me got staying power yeah 
 You and me we got staying power 
 I wonder when we're gonna make it 
 I wonder when we're gonna shake it 
 Fire down below I'm just a regular dynamo 
 Want some smooth company 
 Don't lose control just hang on out with me 
 Got to get to know each other 
 But we got plenty of time 
 Did you hear the last call baby? 
 You and me got staying power yeah 
 You and me we got staying power 
 Power power power... 
 I wonder when we're gonna stick it 
 I wonder when we're gonna trick it 
 Blow baby blow let's get down and go go 
 Get yourself in the mood 
 Got to give a little bit of attitude 
 Baby don't you crash 
 Let just trash trash trash 
 Did you hear the last call baby? 
 You and me got staying power yeah 
 You and me we got staying power 
 (I like it) Staying power 
 Yeah yeah 
 Gotcha"
99,Queen,rock,Dancer,"I'm not invited to the party 
 Been sitting here all night 
 I'm all alone at the party 
 I don't feel all right 
 Ain't got no black coat 
 Ain't got no tie 
 I gotta shape up now 
 Come on baby you gotta know why 
 Take off! 
 Dancer dancer 
 I can't live with it I'm gonna die without it 
 Dancer dancer 
 Ain't no doubt about it 
 Dancer dancer 
 Why don't you kick off your dancing shoes 
 And come and ride with me? Cool 
 You're the life and soul of the funk-tion 
 It took me all night 
 To get hold of the right introduction 
 Blew me out of sight 
 I taste your lipstick 
 I look in your eyes 
 You feel fantastic 
 My body cries 
 Take off 
 Dancer dancer 
 I can't live with it I'm gonna die without it 
 Dancer dancer 
 Ain't no doubt about it 
 Dancer dancer 
 Why don't you kick off your dancing shoes 
 And come and ride with me? 
 Hot space let's go! 
 Yeah - can I see you baby? 
 Dancer dancer 
 I can't believe you're dancing 
 Dancer dancer 
 Can't take you home 
 I can't take you dancing 
 Dancer dancer 
 Bring out the funk and dance the night away 
 Dancer dancer 
 We got bully 
 Dancer dancer 
 Dancer dancer 
 Dancer dancer 
 Dance dance dance dance 
 Dancer dancer"
100,Queen,rock,Back Chat,"Words and music by John Deacon 
 Yeah 
 Get back get back 
 Back chat back chat 
 You burn all my energy 
 Back chat back chat 
 Criticizing all you see 
 Back chat back chat 
 Analysing what I say 
 Back chat back chat 
 And you always get your way 
 Oh yeah! See what you've done to me 
 Back chat back chat 
 It's driving me insane 
 Survival to the end 
 Knock you down you come again 
 Talk back talk back 
 You've got me on the wrack 
 Twisting ev'ry word I say 
 Wind me up and get your way 
 Fat chance I have of making a romance 
 If I'm ever goin' to win 
 Have to get the last word in 
 Take it from there 
 Twisting ev'ry word I say Huh! 
 Wind me up and let me play 
 Back chat back chat 
 You burn all my energy 
 Back chat back chat 
 Criticizing all you see 
 Back chat back chat 
 Analysing what I say 
 Back chat back chat 
 And you always get your way 
 Come on now 
 Wake up stand up 
 And drag yourself on out 
 Get down get ready 
 Scream and shout 
 Back off me be cool 
 And learn to change your ways 
 'Cause you're talking in your sleep 
 And you're walking in a daze 
 Don't push your luck 
 I'm ready to attack 
 'Cause when I'm trying to talk to you 
 All you do is just talk back 
 You stand so tall you don't frighten me at all 
 Don't talk back don't talk back 
 Don't talk back just leave me alone 
 Back chat back chat 
 You burn all my energy 
 Back chat back chat 
 Criticizing all you see 
 Back chat back chat 
 Analysing what I say 
 Back chat back chat 
 And you always get your way 
 Yes you do 
 Yes you do baby 
 Come on back chat back chat 
 Back chat back chat 
 Back chat back chat 
 Go for it go for it go for it baby 
 Back chat back chat 
 You're giving me the runaround 
 Critisizing (oh yeah), analysing (oh yeah) 
 Yeah merci beaucoup 
 Get on down..."
101,Queen,rock,Body Language,"Give me your body 
 Give me your body body 
 Give me your body 
 Don't talk don't talk don't talk don't talk 
 Baby don't talk 
 Body language 
 Body language 
 Body language 
 Give me your body 
 Just give me, yeah, your body 
 Give me, yeah, your body 
 Don't talk 
 Body language huh huh 
 Body language 
 Body language 
 You got red lips snakes in your eyes 
 Long legs great thighs 
 You got the cutest ass I've ever seen 
 Knock me down for a six any time 
 Look at me I gotta case of body language 
 Look at me I gotta case of body language 
 Look at me I gotta case of body language 
 Look at me I gotta case of body language 
 Of body language 
 Of body language 
 Yeah sexy body sexy sexy body 
 I want your body 
 Baby you're hot 
 Body language 
 Body language 
 Body language 
 Body language 
 Body language 
 Body language 
 Body language 
 Body language 
 Body language"
102,Queen,rock,Action This Day,"Words and music by Roger Taylor 
 Action 
 This street honey is a mean street 
 Living in this street honey needs a mean streak 
 We've got criminals living in this street 
 But there's a heart beat pulse 
 That keeps on pumping 
 Like a juke box playing the same dead record 
 Or a radio in the corner keeps blaring 
 I got a feeling this world is using me 
 This town honey is a dead town 
 Living in this town honey is a let down 
 Coming to this town honey is a show down 
 But there's a heart beat pulse 
 That keeps on pumping some sunshine ray 
 Through a crack in the shutter 
 Or a sight of a light at the end of a tunnel 
 Still there's a feeling this world is using me 
 Action this day action this night 
 Oh we've gotta learn to love to live 
 You can't say it ain't right 
 Action this day action this night 
 Oh you've got the power you've got the power 
 You've got the power to love to live 
 You can't say it ain't right 
 Your mind honey is a bleak place 
 Living in your minds living in a blank space 
 Your mind is coming from a rat race 
 But there's a heart beat pulse 
 That keeps on pumping 
 Like a juke box playing the same dead record 
 Or a radio in the corner keeps blaring 
 I got a feeling that just won't quit 
 This world is using me 
 Action this day action this night 
 Oh we've gotta learn to love to live 
 We can't say it ain't right 
 Action this day action this night 
 Oh you've got the power you've got the power 
 You've got the power to love to live 
 You can't say it ain't right 
 Action action this day 
 Action this day 
 Action action this day 
 Action this day 
 Living in the street... 
 Action..."
103,Queen,rock,Put Out The Fire,"Words and music by Brian May 
 They called him a hero 
 In the land of the free 
 But he wouldn't shake my hand boy 
 He disappointed me 
 So I got my hand gun 
 And I blew him away 
 That critter was a bad guy 
 And I had to make him pay 
 You might fear for my reason 
 I don't care what they say 
 Look out baby it's the season 
 For the mad masquerade 
 Put out the fire put out the fire put out the fire 
 Oh you need a bullet like a hole in the head 
 Put out the fire put out the fire put out the fire 
 Don't believe what your grand-daddy said 
 She was my lover 
 It was a shame that she died 
 But the constitution's right on my side 
 'Cause I caught my lover in the neighbours bed 
 I got retribution 
 Filled 'em all full of lead 
 I've been told it's the fashion 
 To let me on the streets again 
 It's nothing but a crime of passion 
 And I'm not to blame 
 Put out the fire put out the fire put out the fire 
 You need a weapon like a hole in the head 
 Put out the fire put out the fire baby put out the fire 
 And let your sons and daughters sleep sound in their beds 
 You know a gun never killed nobody 
 You can ask anyone 
 People get shot by people 
 People with guns 
 Put out the fire put out the fire put out the fire 
 You need a gun like a hole in the head 
 Put out the fire put out the fire put out the fire 
 Just tell me that old fashioned gun law is dead 
 Shoot shoot..."
104,Queen,rock,Life Is Real (Song For Lennon),"Words and music by Freddie Mercury 
 Guilt stains on my pillow 
 Blood on my terraces 
 Torsos in my closet 
 Shadows from my past 
 Life is real life is real 
 Life is real so real 
 Sleeping is my leisure 
 Waking up in a minefield 
 Dream in just a pleasure dome 
 Love is a roulette wheel 
 Life is real life is real 
 Life is real oh yeah 
 Success is my breathing space 
 I brought it on myself 
 I will price it I will cash it 
 I can take it or leave it 
 Loneliness is my hiding place 
 Breast feeding myself 
 What more can I say? 
 I have swallowed the bitter pill 
 I can taste it I can taste it 
 Life is real life is real 
 Life is real 
 Music will be my mistress 
 Loving like a whore 
 Lennon is a genius 
 Living in ev'ry pore 
 Life is real life is real 
 Life is real so real 
 Life is cruel life is a bitch 
 Life is real so real 
 Life is real life is real yeah 
 Life is real"
105,Queen,rock,Calling All Girls,"Words and music by Roger Taylor 
 Calling all boys calling all girls 
 Calling all people on streets 
 Around the world 
 Take this message a message for you 
 This message is old yeah 
 This message is true this message is 
 This message is this message is this message is 
 Love take a message of love 
 Far and near 
 Take a message of love for all to hear 
 For all to hear 
 Some sleepless nights in wait for you 
 Some foreign presence you feel 
 Comes creeping through 
 Some stream of hope 
 The whole world through 
 Spread like some silent disease 
 You'll get yours too 
 This message is this message is 
 This message is this message is 
 Love take a message of love 
 Far and near 
 Take a message of love for all to hear 
 For all to hear 
 Love take a message of love 
 Far and near 
 Take a message of love for all to hear 
 For all to hear 
 Calling all boys calling all girls 
 Calling all boys calling all girls 
 Calling all girls"
106,Queen,rock,Las Palabras De Amor (The Words Of Love),"Don't touch me now 
 Don't hold me now 
 Don't break the spell darling 
 Now you are near 
 Look in my eyes and speak to me 
 The special promises I long to hear 
 Las palabras de amor 
 Let me hear the words of love 
 Despacito mi amor 
 Love me slow and gently 
 One foolish world so many souls 
 Senselessly hurled through 
 The never ending cold 
 And all for fear and all for greed 
 Speak any tongue 
 But for God's sake we need 
 Las palabras de amor 
 Let me hear the words of love 
 Despacito mi amor 
 Let me know this night and evermore 
 This room is bare 
 This night is cold 
 We're far apart and I'm growing old 
 But while we live 
 We'll meet again 
 So then my love 
 We may whisper once more 
 It's you I adore 
 Las palabras de amor 
 Let me hear the words of love 
 Despacito mi amor 
 Touch me now 
 Las palabras de amor 
 Let us share the words of love 
 For evermore evermore 
 For evermore"
