,0,1,2,3
0,Queen,rock,Keep Yourself Alive,"Take off 
 I was told a million times of all the troubles in my way 
 ""Mind you grow a little wiser, little better every day"" 
 But if I crossed a million rivers and I rode a million miles 
 Then I'd still be where I started, bread and butter for a smile 
 Well, I sold a million mirrors in a shop in an alleyway 
 But I never saw my face in any window any day 
 Now they say your folks are telling you ""Be a superstar"" 
 But I tell you just be satisfied, stay right where you are 
 Keep yourself alive, yeah 
 Keep yourself alive 
 It'll take you all your time and money 
 Honey, you'll survive 
 Well, I've loved a million women in a belladonnic haze 
 And I ate a million dinners brought to me on silver trays 
 Give me everything I need to feed my body and my soul 
 And I'll grow a little bigger, maybe that can be my goal 
 I was told a million times of all the people in my way 
 How I had to keep on trying and get better every day 
 But if I crossed a million rivers and I rode a million miles 
 Then I'd still be where I started, same as when I started 
 Keep yourself alive, come on 
 Keep yourself alive 
 It'll take you all your time and money 
 Honey, you'll survive, shake 
 Keep yourself alive, wow 
 Keep yourself alive 
 It'll take you all your time and money 
 To keep me satisfied 
 Do you think you're better every day 
 No, I just think I'm two steps nearer to my grave 
 Keep yourself alive, come on 
 Keep yourself alive 
 You take your time and take my money 
 Keep yourself alive 
 Keep yourself alive, come on 
 Keep yourself alive 
 All you people 
 Keep yourself alive 
 Keep yourself alive, come on, come on 
 Keep yourself alive 
 It'll take you all your time and a money 
 To keep me satisfied 
 Keep yourself alive 
 Keep yourself alive 
 All you people 
 Keep yourself alive 
 Take you all your time and money, honey 
 You will survive 
 Keep yourself alive 
 Keep yourself alive"
1,Queen,rock,Doing All Right,"Yesterday my life was in ruin 
 Now today I know what I'm doing 
 Got a feeling I should be doing all right 
 Doing all right 
 Where will I be this time tomorrow? 
 Jumped in joy or sinking in sorrow 
 Anyway I should be doing all right 
 Doing all right 
 Should be waiting for the sun 
 Looking round to find the words to say 
 Should be waiting for the skies to clear 
 There ain't time in all the world 
 Should be waiting for the sun 
 And anyway I've got to hide away 
 Yesterday my life was in ruin 
 Now today God knows what I'm doing 
 Anyway I should be doing all right 
 Doing all right 
 Doing all right"
2,Queen,rock,Great King Rat,"Great King Rat died today 
 Born on the twenty first of May 
 Died syphillis forty four on his birthday 
 Every second word he swore 
 Yes he was the son of a whore 
 Always wanted by the law 
 Wouldn't you like to know? 
 Wouldn't you like to know people? 
 Great King Rat was a dirty old man 
 And a dirty old man was he 
 Now what did I tell you 
 Would you like to see? 
 Where will I be tomorrow? 
 Will I beg or will I borrow? 
 I don't care I don't care anyway 
 Come on come on the time is right 
 The man is evil and that is right 
 I told you ah yes I told you 
 And that's no lie oh no no no 
 Wouldn't you like to know? 
 Wouldn't you like to know? 
 Wouldn't you like to know? 
 Great King Rat was a dirty old man 
 And a dirty old man was he 
 Now what did I tell you? 
 Would you like to see? 
 (Show me) 
 Wouldn't you like to know? 
 Wouldn't you like to know people? 
 Great King Rat was a dirty old man 
 And a dirty old man was he 
 Now what did I tell you? 
 Would you like to see? 
 Now listen all you people 
 Put out the good and keep the bad 
 Don't believe all you read in the Bible 
 You sinners get in line 
 Saints you leave far behind 
 Very soon you're gonna be his disciple 
 Don't listen to what mama says 
 Not a word not a word mama says 
 Or else you'll find yourself being the rival 
 The great Lord before He died 
 Knelt sinners by his side 
 And said, ""you're gonna realise tomorrow"" 
 No I'm not gonna tell you 
 What you already know 
 'Cause time and time again 
 The old man said it all a long time ago 
 Come come on the time is right 
 This evil man will fight 
 I told you once before 
 Wouldn't you like to know? 
 Wouldn't you like to know? 
 Just like I said before 
 Great King Rat was a dirty old man 
 And a dirty old man was he 
 The last time I tell you? 
 Would you like to see?"
3,Queen,rock,My Fairy King,"In the land where horses born with eagle wings 
 And honey bees have lost their stings 
 There's singing forever 
 Lions den with fallow deer 
 And rivers made from wine so clear 
 Flow on and on forever 
 Dragons fly like sparrows through the air 
 And baby lambs where Samson dares 
 To go on on on on on on 
 My fairy king can see things 
 He rules the air and turns the tides 
 That are not there for you and me 
 Ooh yeah he guides the winds 
 My fairy king can do right and nothing wrong 
 Then came man to savage in the night 
 To run like thieves and to kill like knives 
 To take away the power from the magic hand 
 To bring about the ruin to the promised land 
 They turn the milk into sour 
 Like the blue in the blood of my veins 
 Why can't you see it 
 Fire burnin' in hell with the cry of screaming pain 
 Son of heaven set me free and let me go 
 Sea turn dry no salt from sand 
 Seasons fly no helping hand 
 Teeth don't shine like pearls for the poor man's eyes 
 Someone someone has drained the colour from my wings 
 Broken my fairy circle ring 
 And shamed the king in all his pride 
 Changed the winds and wronged the tides 
 Mother Mercury Mercury 
 Look what they've done to me 
 I cannot run I cannot hide"
4,Queen,rock,Liar,"I have sinned dear Father 
 Father I have sinned 
 Try and help me Father 
 Won't you let me in? 
 Liar 
 Oh nobody believes me 
 Liar 
 Why don't they leave me alone? 
 Sire I have stolen 
 Stolen many times 
 Raised my voice in anger 
 When I know I never should 
 Liar 
 Oh ev'rybody deceives me 
 Liar 
 Why don't you leave me alone? 
 Liar I have sailed the seas 
 Liar from Mars to Mercury 
 Liar I have drunk the wine 
 Liar time after time 
 Liar you're lying to me 
 Liar you're lying to me 
 Father please forgive me 
 You know you'll never leave me 
 Please will you direct me in the right way 
 Liar liar liar liar 
 Liar that's what they keep calling me 
 Liar liar liar 
 Listen are you gonna listen 
 Mama I'm gonna be your slave 
 All day long 
 Mama I'm gonna try behave 
 All day long 
 Mama I'm gonna be your slave 
 All day long 
 I'm gonna serve you till your dying day 
 All day long 
 I'm gonna keep you till your dying day 
 All day long 
 I'm gonna kneel down by your side and pray 
 All day long and pray 
 All day long and pray 
 All day long and pray 
 All day long all day long all day long 
 All day long all day long all day long 
 All day long all day long all day long 
 Liar liar they never ever let you win 
 Liar liar everything you do is sin 
 Liar nobody believes you 
 Liar they bring you down before you begin 
 Now let me tell you this 
 Now you know you could be dead before they let you"
5,Queen,rock,The Night Comes Down,"When I was young it came to me 
 And I could see the sun breakin' 
 Lucy was high and so was I dazzling 
 Holding the world inside 
 Once I believed in ev'ryone 
 Ev'ryone and anyone can see 
 Oh oh the night comes down 
 And I get afraid of losing my way 
 Oh oh the night comes down 
 Ooh and it's dark again 
 Once I could laugh with ev'ryone 
 Once I could see the good in me 
 The black and the white distinctively colouring 
 Holding the world inside 
 Now all the world is grey to me 
 Nobody can see you gotta believe it 
 Oh oh the night comes down 
 And I get afraid of losing my way 
 Oh oh the night comes down 
 Ooh and it's dark again 
 And it's dark again 
 And it's dark again"
6,Queen,rock,Modern Times Rock 'N' Roll,"Had to make do with a worn out rock and roll scene 
 The old bop is gettin' tired need a rest 
 Well you know what I mean 
 Fifty eight that was great 
 But it's over now and that's all 
 Somethin' harder's coming up 
 Gonna really knock a hole in the wall 
 Gonna hit ya grab you hard 
 Make you feel ten feet tall 
 Well I hope that big new baby's gonna come along soon 
 You don't know it could happen any ol' rainy afternoon 
 With the temp'rature down 
 And the juke box blowin' no fuse 
 And my musical life's feelin' 
 Like a long Sunday School cruise 
 And you know there's one thing 
 Every single body could use 
 Yeah listen to me baby 
 Let me tell you what it's all about 
 Modern times rock and roll 
 Modern times rock and roll 
 Get your high heeled guitar boots and some groovy clothes 
 Get a hair piece on your chest 
 And a ring through your nose 
 Find a nice little man who says 
 He's gonna make you a real big star 
 Stars in your eyes ants in your pants 
 Think you should go far 
 Everybody in this bum sucking world's 
 Gonna know just who you are 
 Look out 
 Modern times rock and roll"
7,Queen,rock,Son And Daughter,"I want you 
 To be a woman 
 Tried to be a son and daughter rolled into one 
 You said you'd equal any man for having your fun 
 Now didn't you feel surprised to find 
 The cap just didn't fit 
 The world expects a man 
 To buckle down and to shovel shit 
 What'll you do for loving 
 When it's only just begun? 
 I want you to be a woman 
 Tried to be a teacher and a fisher of men 
 An equal people preacher 
 Will you lead us all the same? 
 Well I travelled all round the world 
 A brand new word for day 
 Watching the time mustn't linger behind 
 Pardon me I have to get away 
 What'll you think of heaven 
 If it's back from where you came? 
 I want you to be a woman 
 I want you to be a woman yeah"
8,Queen,rock,Jesus,"And then I saw Him in the crowd 
 A lot of people had gathered round Him 
 The beggars shouted the lepers called Him 
 The old man said nothing 
 He just stared about him 
 All going down to see the Lord Jesus 
 All going down to see the Lord Jesus 
 All going down 
 Then came a man before His feet he fell 
 Unclean said the leper and rang his bell 
 Felt the palm of a hand touch his head 
 Go now go now you're a new man instead 
 All going down to see the Lord Jesus 
 All going down to see the Lord Jesus 
 All going down 
 It all began with the three wise men 
 Followed a star took them to Bethlehem 
 And made it heard throughout the land 
 Born was a leader of man 
 All going down to see the Lord Jesus 
 All going down to see the Lord Jesus 
 All going down 
 It all began with the three wise men 
 Followed a star took them to Bethlehem 
 And made it heard throughout the land 
 Born was a leader of man 
 All going down to see the Lord Jesus 
 All going down to see the Lord Jesus 
 All going down"
9,Queen,rock,Mad The Swine,"Been here before a long time ago 
 But this time I wear no sandals 
 Ages past I gave all you people 
 Food and water 
 Three feet tall so very small I'm no trouble 
 I bring thunder lightning sun and the rain 
 For all the people in the land 
 A message of love 
 I bring you from up above 
 All good children gather around 
 Come join your hands and sing along 
 They call me mad the swine 
 I guess I'm mad the swine 
 I've come to save you save you 
 Mad the swine 
 Mad the swine 
 So all you people gather around 
 Hold out your hands and praise the Lord 
 I woke up on the water just as before 
 I'll help the meek and the mild and believers and the blind 
 And all the creatures great and small 
 Let me take you to the river without a ford 
 Oh and then one day you realise 
 You're all the same within his eyes 
 All I've come to say just like before 
 They call me mad the swine 
 I'm mad the swine 
 I've come to save you save you 
 Mad the swine 
 Mad the swine 
 So all you people gather around 
 Hold out your hands and praise the Lord 
 Ooh 
 Oh now 
 So all you people gather around 
 Hold out your hands and praise the Lord 
 Don't ever fail me 
 Mad the swine 
 Mad the swine 
 I've come to save you save you 
 Oh now 
 Mad the swine 
 Mad the swine 
 So all you people gather around 
 Hold out your hands and praise the Lord 
 Hands and praise the Lord 
 Praise the Lord 
 I'll get down on my knees and praise the Lord"
10,Queen,rock,Father To Son,"A word in your ear 
 From father to son 
 Hear the word that I say 
 I fought with you 
 Fought on your side 
 Long before you were born 
 Joyful the sound 
 The word goes around 
 From father to son to son 
 And the voice is so clear 
 Time after time it keeps 
 Calling you, calling you on 
 Don't destroy what you see 
 Your country to be 
 Just keep building on the ground that's been won 
 Kings will be crowned 
 The word goes around 
 From father to son to son 
 Won't you hear us sing 
 Our family song? 
 Now we hand it on 
 But I've heard it all before 
 Take this letter that I give you 
 Take it sonny, hold it high 
 You won't understand a word that's in it 
 But you'll write it all again before you die 
 A word in your ear 
 From father to son 
 Funny you don't hear a single word that I say 
 But my letter to you 
 Will stay by your side through the years 
 Till the loneliness is gone 
 Sing if you will 
 But the air you breathe 
 I live to give you 
 Father to son father to son 
 Father to son father to son 
 Joyful the sound 
 Word goes around 
 Father to son to son 
 Kings will be crowned 
 Earth goes around 
 Father to son to son 
 Joyful the sound 
 Word goes around 
 Father to son to son 
 Kings will be crowned 
 Earth goes around 
 Father to son to son"
11,Queen,rock,White Queen (As It Began),"So sad her eyes 
 Smiling dark eyes 
 So sad her eyes 
 As it began 
 On such a breathless night as this 
 Upon my brow the lightest kiss 
 I walked alone 
 And all around the air did say 
 My lady soon will stir this way 
 In sorrow known 
 The white queen walks 
 And the night grows pale 
 Stars of lovingness in her hair 
 Heeding unheard 
 Pleading one word 
 So sad her eyes 
 She cannot see 
 How did thee fare what have thee seen 
 The mother of the willow green 
 I call her name 
 And 'neath her window have I stayed 
 I loved the footsteps that she made 
 And when she came 
 White queen how my heart did ache 
 And dry my lips no words could make 
 So still I wait 
 My goddess hear my darkest fear 
 I speak too late 
 It's forevermore that I wait 
 Dear friend goodbye 
 No tears in my eyes 
 So sad it ends as it began"
12,Queen,rock,Some Day One Day,"You never heard my song before 
 The music was too loud 
 But now I think you hear me well 
 For now we both know how 
 No star can light our way 
 In this cloud of dark and fear 
 But some day, one day... 
 Funny how the pages turn 
 And hold us in between 
 A misty castle waits for you 
 And you shall be a queen 
 Today the cloud it hangs 
 Over us and all is grey 
 But some day, one day... 
 When I was you and you were me 
 And we were very young 
 Together took us nearly there 
 The rest may not be sung 
 So still the cloud it hangs 
 Over us and we're alone 
 But some day, one day... 
 We'll come home"
13,Queen,rock,The Loser In The End,"Mama's got a problem 
 She don't know what to say 
 Her little baby boy 
 Has just left home today 
 She's got to be the loser in the end 
 She's got to be the loser in the end 
 Misuse her and you'll lose her as a friend 
 She's ma on whom you can always depend ooh 
 She washed and fed and clothed and cared 
 For nearly twenty years 
 And all she gets is Goodbye Ma 
 And the night times for her tears 
 She's got to be the loser in the end 
 She's got to be the loser in the end 
 Misuse her and you'll lose her as a friend 
 She's ma on whom you can always depend ooh 
 So listen mothers ev'rywhere 
 To just one mothers son 
 You'll get forgotten on the way 
 If you don't let them have their fun 
 Forget regrets and just remember 
 It's not so long since you were young 
 You're bound to be the loser in the end 
 You're bound to be the loser in the end 
 They'll chose their new shoes 
 That's not far to bend 
 You're ma on whom they can always depend ooh ooh"
14,Queen,rock,Ogre Battle,"Now once upon a time 
 An old man told me a fable 
 When the piper is gone 
 And the soup is cold on the table 
 And if the black crow flies 
 To find a new destination 
 That is the sign 
 Come tonight 
 Come to the ogre site 
 Come to the ogre battle fight 
 He gives a great big cry 
 And he can swallow up the ocean 
 With a mighty tongue he catches flies 
 And the palm of his hand incredible size 
 One great big eye has to focus in your direction 
 Now the battle is on 
 Yeah yeah yeah! 
 Come tonight 
 Come to the ogre site 
 Come to the ogre battle fight 
 Ah ah ah ah ah 
 The ogre men are still inside 
 The two way mirror mountain 
 You gotta keep down 
 Right out of sight 
 You can't see in but they can see out 
 Keep a look out 
 The ogre men are coming out 
 From the two way mirror mountain 
 They're running up behind 
 And they're coming all about 
 Can't go east 'cause you gotta go south 
 Ogre men are going home 
 The great big fight is over 
 Bugle blow let trumpet cry 
 Ogre battle lives for ever more 
 You can come along 
 You can come along 
 Come to ogre battle"
15,Queen,rock,The Fairy Feller's Master-Stroke,"He's a fairy feller 
 Ah ah the fairy folk have gathered 
 Round the new moon's shine 
 To see the feller crack a nut 
 At night's noon time 
 To swing his axe he swears 
 As he climbs he dares 
 To deliver the master stroke 
 Ploughman wagoner will' and types 
 Politician with senatorial pipe 
 He's a dilly dally oh 
 Pedagogue squinting wears a frown 
 And a satyr peers under lady's gown 
 He's a dirty fellow 
 What a dirty laddie-oh 
 Tatterdemalion and the junketer 
 There's a thief and a dragonfly trumpeter 
 He's my hero ah 
 Fairy dandy tickling the fancy 
 Of his lady friend 
 The nymph in yellow (can we see the master stroke) 
 What a quaere fellow 
 Ah ah ah ah ah ah 
 Ah ah ah ah ah ah 
 Soldier sailor tinker tailor ploughboy 
 Waiting to hear the sound 
 And the arch magician presides 
 He is the leader 
 Oberon and Titania watched by a harridan 
 Mab is the queen and there's a good apothecary man 
 Come to say hello 
 Fairy dandy tickling the fancy 
 Of his lady friend 
 The nymph in yellow 
 What a quaere fellow 
 The ostler stares with hands on his knees 
 Come on mister feller 
 Crack it open of you please"
16,Queen,rock,Nevermore,"There's no living in my life anymore 
 The seas have gone dry and the rain stopped falling 
 Please don't you cry anymore 
 Can't you see? 
 Listen to the breeze, whisper to me please 
 Don't send me to the path of nevermore 
 Even the valleys below, 
 Where the rays of the sun were so warm and tender, 
 Now haven't anything to grow 
 Can't you see? 
 (Nevermore nevermore) 
 Why did you have to leave me? 
 (Nevermore nevermore) 
 Why did you deceive me? 
 You send me to the path of nevermore 
 When you say you didn't love me anymore 
 (Ah ah) 
 Nevermore, ah 
 Nevermore"
17,Queen,rock,March Of The Black Queen,"Do you mean it, do you mean it, do you mean it? 
 Why don't you mean it? 
 Why do I follow you, and where do you go? 
 Ah ah ah... 
 You've never seen nothing like it 
 No never in your life 
 Like going up to heaven 
 And then coming back alive 
 Let me tell you all about it 
 If the world will so allow it 
 Ooh give me a little time to choose 
 Water babies singing in a lily pool delight 
 Blue powder monkeys praying in the dead of night 
 Here comes the Black Queen poking in the pile 
 Fi fo the Black Queen marching single file 
 Take this take that bring them down to size 
 March to the Black Queen 
 Put them in the cellar with the naughty boys 
 Little nigger sugar then a rub-a-dub-a-baby oil 
 Black on black on every finger nail and toe 
 We've only begun begun 
 Make this make that keep making all that noise 
 Ooh march to the Black Queen 
 Now I've got a belly full 
 You can be my sugar baby 
 You can be my honey chile 
 A voice from behind me reminds me 
 Spread out your wings you are an angel 
 Remember to deliver with the speed of light 
 A little bit of love and joy 
 Everything you do bears a will 
 And a why and a wherefore 
 A little bit of love and joy 
 In each and every soul lies a man 
 And very soon he'll deceive and discover 
 But even to the end of his life 
 He'll bring a little love 
 Ah ah ah... 
 I reign with my left hand I rule with my right 
 I'm lord of all darkness I'm queen of the night 
 I've got the power 
 Now do the march of the Black Queen 
 My life is in your hands I'll fo and I'll fie 
 I'll be what you make me I'll do what you like 
 I'll be a bad boy I'll be your bad boy 
 I'll do the march of the Black Queen 
 Ah ah ah... 
 Walking true to style she's vulgar abuse and vile 
 Fi fo The Black Queen tattoos all her pies 
 She boils and she bakes 
 And she never dots her I's 
 La la la... 
 So forget your sing a-longs and your lullabies 
 Surrender to the singing of the fireflies 
 Dance to the devil in beat with the band 
 To hell with all of you hand in hand 
 But now it's time to be gone 
 La la la la forever forever 
 La la la..."
18,Queen,rock,Funny How Love Is,"Funny how love is everywhere just look and see 
 Funny how love is anywhere you're bound to be 
 Funny how love is every song in every key 
 Funny how love is coming home in time for tea 
 Funny funny funny oh 
 Funny how love is the end of the lies when the truth begins 
 Tomorrow comes, tomorrow brings 
 Tomorrow brings love in the shape of things 
 That's what love is, that's what love is 
 Funny how love can break your heart so suddenly 
 Funny how love came tumbling down with Adam and Eve 
 Funny how love is running wild feeling free 
 Funny how love is coming home in time for tea 
 Funny funny funny oh 
 From the earth below to the heavens above 
 That's how far and funny is love 
 At any time, anywhere 
 If you gotta make love do it everywhere 
 That's what love is, that's what love is 
 Funny how love is everywhere just look and see 
 Funny how love is anywhere you're bound to be 
 Funny how love is every song in every key 
 Funny how love is when you gotta hurry 'cause you're late for tea 
 Funny funny funny oh 
 Tomorrow comes tomorrow brings 
 Tomorrow brings love in the shape of things 
 At any time, anywhere 
 If you gotta make love do it everywhere 
 That's what love is that's what love is"
19,Queen,rock,Seven Seas Of Rhye,"Fear me, you lords and lady preachers 
 I descend upon your earth from the skies 
 I command your very souls, you unbelievers 
 Bring before me what is mine 
 The seven seas of Rhye 
 Can you hear me, you peers and privy councilors 
 I stand before you naked to the eyes 
 I will destroy any man who dares abuse my trust 
 I swear that you'll be mine 
 The seven seas of Rhye 
 (Sister) I live and lie for you 
 (Mister) do and I'll die 
 You are mine, I possess you 
 Belong to you forever (Ever, ever, ah) 
 Storm the master marathon, I'll fly through 
 By flash and thunder fire and I'll survive 
 (I'll survive, I'll survive, I'll survive) 
 And I'll defy the laws of nature 
 And come out alive 
 (Then I'll get you) 
 Begone with you you shod and shady senators 
 Give out the good, leave out the bad evil cries 
 I challenge the mighty Titan and his troubadours 
 And with a smile 
 I'll take you to the seven seas of Rhye 
 Oh I do like to be beside the seaside 
 Oh I do like to be beside the sea 
 Oh I do like to stroll along the prom prom prom 
 Where the brass bands play tiddley om pom pom 
 I do like to be beside the seaside 
 I do like to be beside the sea 
 When I'm down beside the sea I'm beside myself with glee 
 Beside the seaside 
 Beside the sea"
20,Queen,rock,See What A Fool I've Been,"Words and music by Brian May 
 Well she's gone dear gone this morning 
 See what a fool I've been 
 Oh Lord what a fool I've been 
 Yes I did - too much 
 Didn't leave didn't leave no letter 
 Didn't leave no warning (you naughty thing you) 
 I guess I'm all to blame oh Lord 
 I guess I'm all to blame (see you later... right now you) - 
 Take it 
 My little dog ain't too hungry no no he just kept on barking 
 Viciously 
 Just don't seem the same oh no no 
 It just don't seem the same (oh see you later) 
 Now hit it - like that 
 Coming on strong 
 Well I got so lonely 
 Went and told my neighbour 
 She said mm mm mm mm mm 
 Oh Lord what a fool I've been 
 And she told me what to do 
 She said go home 
 Well she's gone gone this morning 
 See what a fool I've been oh Lord 
 What a fo-ooh-ooh-ool I've been"
21,Queen,rock,Seven Seas Of Rhye (Remix),"Fear me you lords and lady preachers 
 I descend upon your earth from the skies 
 I command your very souls you unbelievers 
 Bring before me what is mine 
 The seven seas of rhye 
 Can you hear me you peers and privvy counselors 
 I stand before you naked to the eyes 
 I will destroy any man who dares abuse my trust 
 I swear that you'll be mine 
 The seven seas of rhye 
 Sister - I live and lie for you 
 Mister - do and I'll die 
 You are mine I possess you 
 I belong to you forever 
 Storm the master-marathon I'll fly through 
 By flash and thunder-fire I'll survive 
 Then I'll defy the laws of nature and come out alive 
 Then I'll get you 
 Be gone with you - you shod and shady senators 
 Give out the good, leave out the bad evil cries 
 I challenge the mighty titan and his troubadours 
 And with a smile 
 I'll take you to the seven seas of rhye"
