,0,1,2,3
126,Queen,rock,Who Wants To Live Forever,"There's no time for us 
 There's no place for us 
 What is this thing that builds our dreams 
 Yet slips away from us 
 Who wants to live forever? 
 Who wants to live forever? 
 Ooooooo 
 There's no chance for us 
 It's all decided for us 
 This world has only one sweet moment 
 Set aside for us 
 Who wants to live forever? 
 Who wants to live forever? 
 Ooooooo 
 Who dares to love forever?  (Oh, whoa!) 
 When love must die 
 But touch my tears with your lips 
 Touch my world with your fingertips 
 And we can have forever 
 And we can love forever 
 Forever is our today 
 Who wants to live forever? 
 Who wants to live forever? 
 Forever is our today 
 Who waits forever anyway?"
127,Queen,rock,Gimme The Prize (Kurgan's Theme),"..Garage and water from the sprinklers. It also left a man's decapitated body lying on the floor next to his own severed head... a head which at this time has no name. 
 I know his name. 
 Here I am! 
 I'm the master of your destiny (Ha-ha!) 
 I am the one, the only one 
 I am the god of Kingdom Come 
 Gimme the prize! 
 Just gimme the prize! 
 Give me your kings, 
 Let me squeeze them in my hands 
 Your puny princes, 
 Your so-called leaders of your land 
 I'll eat them whole before I'm done 
 The battle's fought and the game is won 
 I am the one, the only one 
 I am the god of Kingdom Come 
 Gimme the prize! 
 Just gimme the prize! (The prize.) 
 Now you die 
 I have something to say... it's better to burn out than to fade away! 
 There can be only one! 
 Move over! 
 I said move over! 
 Hey, hey, hey! Clear the way 
 There's no escape from my authority (Didn't I tell you?) 
 I am the one, the only one 
 I am the god of Kingdom Come 
 Gimme the prize just gimme the prize 
 I am the one, the only one 
 I am the god of Kingdom Come 
 Just gimme the prize 
 There can be only one."
128,Queen,rock,Don't Lose Your Head,"Don't lose your head 
 Don't lose your head 
 Don't lose your head 
 Don't lose your head 
 No don't lose you head 
 Don't lose you head 
 Hear what I say 
 Don't lose your way - yeah 
 Remember love's stronger 
 Remember love walks tall 
 Don't lose your heart 
 Don't lose your heart 
 No don't lose your heart 
 Don't lose your heart 
 Hear what I say 
 Hear what I say - yeah 
 Don't lose your way 
 Don't lose your way - yeah 
 Remember love's stronger 
 Remember love walks through walls 
 Don't drink and drive my car 
 Don't get breathalised 
 Don't lose your head 
 If you make it to the top and you wanna stay alive 
 Don't lose your head 
 Don't lose your head 
 Don't lose your head 
 Don't lose your head 
 No don't lose your head 
 Don't lose your head 
 Hear what I say 
 Hear what I say - yeah 
 Don't lose your way 
 Hey don't lose your way 
 Remember love's stronger 
 Remember love conquers all 
 Don't lose your head 
 Don't lose your head 
 Don't lose your head 
 Don't lose your head 
 Don't lose your head 
 Don't lose your head"
129,Queen,rock,Princes Of The Universe,"Here we are - born to be kings 
 We're the princes of the universe 
 Here we belong - fighting to survive 
 In a world with the darkest powers 
 And here we are -  we're the princes of the universe 
 Here we belong - fighting for survival 
 We've come to be the rulers of your world 
 I am immortal, I have inside me blood of kings 
 I have no rival, no man can be my equal 
 Take me to the future of your world 
 Born to be kings, princes of the universe 
 Fighting and free, got your world in my hand 
 I'm here for your love and I'll make my stand 
 We were born to be princes of the universe 
 No man could understand, my power is in my own hand 
 Ooh Ooh Ooh Ooh 
 People talk about you, people say you've had your day 
 I'm a man that will go far, fly to moon and reach for the stars 
 With my sword and head held high 
 Got to pass the test first time, yeah 
 I know that people talk about me I hear it every day 
 But I can prove you wrong 'cause I'm right first time 
 Yeah Yeah 
 Alright let's go, let's go 
 Watch this man fly 
 Bring on the girls 
 Here we are - born to be kings 
 We're the princes of the universe 
 Here we belong 
 Born to be kings, princes of the universe 
 Fighting and free, got your world in my hand 
 I'm here for your love and I'll make my stand 
 We were born to be princes of the 
 Universe..."
130,Queen,rock,A Kind Of Vision,"One man, one soul 
 One vision, one goal 
 One golden glance 
 Of what should be 
 One flash of light 
 Oh, happy day 
 One man, one vision 
 That showed the way 
 The bell that rings 
 Inside your mind 
 It shouts, it sings 
 Of changing times 
 The waiting seems eternity 
 The day will dawn of sanity 
 One man, one soul, one vision 
 One race, one goal, one vision 
 One rage that lasts a thousand years 
 One man, one soul, one vision 
 One flash of light 
 Oh, happy day 
 One man, one vision 
 That showed the way 
 The bell that rings 
 Inside your mind 
 It shouts, it sings 
 Of changing times 
 The waiting seems eternity 
 The day will dawn of sanity, yeah 
 One man, one soul, one vision 
 One race, one goal, one vision 
 One rage that lasts a thousand years 
 One man, one soul, one vision 
 Yeah, one vision 
 One soul"
131,Queen,rock,Party,"We had a good night jamming away 
 There was a full moon showing 
 And we started to play 
 But in the cold light of day next morning 
 Party was over (huh huh) 
 The party was over 
 We got love and we got style 
 And we got sex and I know, 
 I know we got what it takes 
 Whoa whoa whoa whoa whoa - whoa whoa whoa! 
 Why don't you come back and play 
 Come back and play (hey hey) 
 Come back and play 
 We got all night, all day 
 Everybody's gone away 
 Why don't you come back and play (hey hey) 
 Come back and play 
 Come back and play 
 Come back and play it 
 Play it, play it, play it 
 Go get 'em boy (Let's party!) 
 Yeah! 
 Give it, give it! 
 We had a food fight in somebody's face 
 We were up all night singing (singing) 
 And giving a chase 
 But in the cold light of day next morning 
 Everybody was hung over 
 Hey, come back and play 
 Come back and play 
 Come back and play 
 We got all night, all day 
 Everybody's gone away 
 Why don't you come back and play (and play) 
 Come back and play 
 We got all night 
 We got all day 
 We got all night and day 
 Come back, come back, come back, come back, 
 Back and play 
 Hey hey hey! 
 Goodbye, goodbye, goodbye, goodbye, the party is over!"
132,Queen,rock,Khashoggi's Ship,"Who said my party was all over, huh, huh, 
 I'm in pretty good shape, 
 The best years of my life are like a supernova, 
 Huh, huh, perpetual craze, I said that 
 Everybody drank my wine - you get my drift, 
 And then we took a holiday on khashoggi's Ship - well, 
 We really had a good good time they was all so sexy 
 We was bad, we was blitzed, 
 All in all it was a pretty good trip, 
 This big bad sucker with a fist as big as your head, 
 Wanted to get me, I said go away 
 I said kiss my ass honey, 
 He pulled out a gun, wanted to arrest me, 
 I said uh, uh, babe, 
 Now listen no one stops my party, 
 No one stops my party, 
 No one, no one, no one stops my party, 
 Just like I said, 
 We were phased, we was pissed, 
 Just having a total eclipse, 
 Bup bup, badabup, badibup bup bup bedabup bedadee hey 
 That's good 
 Ooh 
 Wooh wooh wooh wooh wooh wooh (<--background screaching) 
 Hah 
 This one's on me so let us do it just right 
 This here one party don't get started till midnight, 
 Yeah (p) 
 Hey! 
 Hah! 
 Everybody's 
 Party to the left 
 Party to the right 
 Lay mine in the middle 
 Do it all night, All right All right 
 Hey 
 Two within the middle with you (sounds like=widdu) 
 We're goin' budy 
 Heyuh 
 Hey huh 
 (V. faintly in the background) 'righty' 
 Hey 
 Left - right 
 Left right 
 No one stops my... Aaaaaaahhhhhhhhhhrrrggghhhhhh"
133,Queen,rock,The Miracle,"Every drop of rain that falls 
 In Sahara Desert says it all, 
 It's a miracle 
 All God's creations great and small, 
 The Golden Gate and the Taj Mahal, 
 That's a miracle 
 Test tube babies being born, 
 Mothers, fathers dead and gone, 
 It's a miracle 
 We're having a miracle on earth, 
 Mother nature does it all for us, 
 The wonders of this world go on, 
 The hanging Gardens of Babylon 
 Captain Cook and Cain and Abel, 
 Jimi Hendrix to the Tower of Babel 
 It's a miracle, it's a miracle, it's a miracle 
 It's a miracle 
 The one thing we're all waiting for, 
 Is peace on earth - and an end to war 
 It's a miracle we need - the miracle, 
 The miracle we're all waiting for today 
 If every leaf on every tree, 
 Could tell a story that would be 
 A miracle 
 If every child on every street, 
 Had clothes to wear and food to eat, 
 That's a miracle 
 If all God's people could be free, 
 To live in perfect harmony, 
 It's a miracle 
 We're having a miracle on earth 
 Mother nature does it all for us 
 Open hearts and surgery (Wonders of this world go on) 
 Sunday mornings with a cup of tea 
 Super powers always fighting 
 But Mona Lisa just keeps on smiling 
 It's a miracle, it's a miracle, it's a miracle 
 (Wonders of this world go on) 
 Well, it's a miracle, it's a miracle, it's a miracle 
 It's a miracle 
 The one thing (the one thing) 
 We're all waiting for (we're all waiting for) 
 Is peace on earth (peace on earth) 
 And an end to war (an end to war) 
 It's a miracle we need - the miracle 
 The miracle 
 Peace on earth and end to war today 
 That time will come 
 One day you'll see 
 When we can all be friends 
 That time will come 
 One day you'll see 
 When we can all be friends 
 That time will come 
 One day you'll see 
 When we can all be friends 
 That time will come 
 One day you'll see 
 When we can all be friends"
134,Queen,rock,I Want It All,"Adventure seeker 
 On an empty street 
 Just an alley creeper 
 Light on his feet 
 A young fighter screaming 
 With no time for doubt 
 With the pain and anger 
 Can't see a way out 
 It ain't much I'm asking 
 I heard him say 
 Gotta find me a future 
 Move out of my way 
 I want it all 
 I want it all 
 I want it all 
 And I want it now! 
 I want it all 
 I want it all 
 I want it all 
 And I want it now! 
 Listen all you people 
 Come gather 'round 
 I gotta get me a game plan 
 Gotta shake you to the ground 
 Just give me 
 What I know is mine 
 People do you hear me? 
 Just give me the sign 
 It ain't much I'm asking 
 If you want the truth 
 Here's to the future 
 For the dreams of youth... 
 I want it all (give it all) 
 I want it all 
 I want it all 
 And I want it now! 
 I want it all (yes I want it all) 
 I want it all (hey) 
 I want it all 
 And I want it... 
 Now... 
 I'm a man with a one track mind 
 So much to do in one life time 
 Not a man for compromise 
 And where's and why's and living lies 
 So I'm living it all (yes I'm living it all) 
 And I'm giving it all (and I'm giving it all) 
 Yeah yeah 
 Yeah yeah yeah yeah 
 I want it all all all all 
 It ain't much I'm asking 
 If you want the truth 
 Here's to the future 
 Hear the cry... hear the cry... hear the cry of youth 
 I want it all 
 I want it all 
 I want it all 
 And I want it now! 
 I want it all (yeah yeah yeah) 
 I want it all 
 I want it all 
 And I want it now 
 I want it... 
 Now! 
 I want it... I want it..."
135,Queen,rock,The Invisible Man,"I'm the invisible man 
 I'm the invisible man 
 Incredible how you can... 
 See right through me 
 Freddie Mercury! 
 When you hear a sound 
 That you just can't place 
 Feel somethin' move 
 That you just can't trace 
 When something sits 
 On the end of your bed 
 Don't turn around 
 When you hear me tread 
 I'm the invisible man 
 I'm the invisible man 
 Incredible how you can... 
 See right through me 
 I'm the invisible man 
 I'm the invisible man 
 It's criminal how I can... 
 See right through you 
 John Deacon! 
 Now I'm in your room 
 And I'm in your bed 
 And I'm in your life 
 And I'm in your head 
 Like the CIA 
 Or the FBI 
 You'll never get close 
 Never take me alive 
 I'm the invisible man 
 I'm the invisible man 
 Incredible how you can... 
 See right through me 
 I'm the invisible man 
 I'm the invisible man 
 It's criminal how I can... 
 See right through you 
 Hah hah hah - hello 
 Hah hah hah - OK 
 Hah hah hah hello hello hello hello 
 Never had a real good friend - 
 Not a boy or a girl 
 No one knows what I've been through - 
 Let my flag unfurl 
 So I make my mark 
 From the edge of the world 
 From the edge of the world 
 From the edge of the world 
 Brian May! Brian May! 
 Now I'm on your track 
 And I'm in your mind 
 And I'm on your back 
 But don't look behind 
 I'm your meanest thought 
 I'm your darkest fear 
 But I'll never get caught 
 You can't shake me, shake me, dear 
 I'm the invisible man 
 I'm the invisible man 
 Incredible how you can... 
 See right through me 
 Watch me now! 
 I'm the invisible man 
 I'm the invisible man 
 It's criminal how I can... 
 See right through you 
 Look at me, look at me! 
 Roger Taylor! 
 Shake you, shake you, shake you, dear"
136,Queen,rock,Breakthru,"When love breaks up 
 When the dawn light wakes up 
 A new life is born - ooh 
 Somehow I have to make this final breakthrough... now! 
 Ha ha ha ha ha ha ha 
 I wake up 
 Feel just fine 
 Your face 
 Fills my mind 
 I get religion quick 
 'Cause you're looking divine 
 Honey you're touching something, you're touchin' me 
 I'm under your thumb, under your spell, can't you see? 
 If I could only reach you 
 If I could make you smile 
 If I could only reach you 
 That would really be a breakthrough - oh yeah 
 Breakthrough, these barriers of pain 
 Breakthrough, yeah, to the sunshine from the rain 
 Make my feelings known towards you 
 Turn my heart inside and out for you now 
 Somehow I have to make this final breakthrough 
 Now! (now now now) 
 Oh yeah 
 Ha ha ha ha ha ha ha 
 Your smile 
 Speaks books to me 
 I break up 
 With each and every one of your looks at me 
 Honey you're starting something deep inside of me 
 Honey you're sparking something, this fire in me 
 I'm outta control, I wanna rush headlong into this ecstasy 
 If I could only reach you 
 If I could make you smile 
 If I could only reach you - ooh ooh ooh ooh 
 That would really be a breakthrough 
 If I could only reach you 
 If I could make you smile 
 If I could only reach you 
 That would really be a breakthrough 
 Oh yeah 
 Breakthrough, breakthrough 
 Break, hey 
 If I could only reach you 
 If I could make you smile 
 If I could only reach you - ooh ooh ooh ooh 
 That would really be a breakthrough 
 If I could only reach you 
 If I could make you smile 
 If I could only reach you 
 That would really be a breakthrough 
 Ha ha ha ha ha ha ha ha ha ha ha 
 Breakthrough"
137,Queen,rock,Rain Must Fall,"I can see it in your stars 
 Life is so exciting 
 Acting so bizarre 
 Your world is so inviting 
 Playing really cool 
 And looking so mysterious honey 
 Your every day is full of sunshine 
 But into every life a little rain must fall 
 No problem 
 Uh 
 Be cool now 
 Anyone who imagines 
 They can blind you with science 
 Bully you all over 
 With property and finance 
 But you have the position 
 To call the shots and name the price honey 
 You found success and recognition 
 But into every life a little rain must fall 
 Flo Jo 
 You lead a fairy tale existence 
 But into every life a little rain must fall 
 Be cool 
 Hah 
 Kiss kiss 
 Others seem to think 
 You are over dramatising 
 Problems at work 
 So it's hardly surprising 
 There's little you can do 
 To alter their opinions honey 
 You want a clean reputation 
 But now you're facing complications 
 'Cause into every life a little rain must fall 
 Be cool 
 Get serious 
 All right 
 Play it nice and cool 
 Play it nice and cool 
 That's good 
 One more time 
 Aha 
 I like it"
138,Queen,rock,Scandal,"Scandal - now you've left me all the world's gonna know 
 Scandal - they're gonna turn our lives into a freak show 
 They'll see the heart ache, they'll see the love break 
 They'll hear me pleading, We'll say for God's sake 
 Over and over and over again 
 Scandal - now you've left me there's no healing the wounds 
 Hey scandal - and all the world can make us out to be fools 
 Here come the bad news, open the flood gates 
 They'll leave us bleeding, we'll say you cheapskates 
 Over and over and over again 
 So let them know when they start it's just a private affair 
 They'll have us hung in the air and tell me what do they care 
 It's only a life to be twisted and broken 
 They'll see the heart ache, they'll see our love break - yeah 
 They'll hear me pleading, I'll say for God's sake 
 Over and over and over and over again 
 Scandal scandal 
 Scandal 
 Scandal yes you're breaking my heart again 
 Scandal yes you're loving on out again 
 Today the headlines tomorrow hard times 
 And no one ever really knows the truth from the lies 
 And in the end the story deeper must hide 
 Deeper and deeper and deeper inside 
 Scandal scandal 
 Scandal scandal"
139,Queen,rock,My Baby Does Me,"(Turn it up a bit please.) 
 My baby 
 Baby does 
 My baby does me good 
 My baby does 
 My baby does me 
 My baby does me good 
 My lady 
 Understands 
 Understands me right 
 She understands me 
 She understands me 
 Understands me right 
 My baby cares 
 She really cares 
 She knows what's really right for me 
 Does me good then she hurts me so 
 She winds me up and then lets me go 
 Turns me on and then tells me no 
 She's just a pussy cat 
 My baby loves me 
 My baby loves me 
 My baby cuffs me 
 One day she tells me that she cares 
 Another day she tells me she don't love me 
 She really really does me 
 Ooh 
 Now people do you believe this? 
 Do you? 
 Ooh! Ah. 
 She really really really really really really 
 Does me"
140,Queen,rock,Was It All Worth It,"What is there left for me to do in this life 
 Did I achieve what I had set in my sights 
 Am I a happy man or is this sinking sand 
 Was it all worth it was it all worth it 
 Yeah now hear my story let me tell you about it 
 We bought a drum kit blew my own trumpet 
 Played the circuit thought we were perfect 
 Was it all worth it 
 Giving all my heart and soul and staying up all night 
 Was it all worth it 
 Living breathing rock'n'roll a godforsaken life 
 Was it all worth it was it all worth it all these years 
 Put down our money without counting the cost 
 It didn't matter if we won if we lost 
 Yes we were vicious yes we could kill 
 Yes we were hungry yes we were brill 
 We served a purpose like a bloody circus 
 We were so dandy we love you madly 
 Was it all worth it 
 Living breathing rock'n'roll this godforsaken life 
 Was it all worth it was it all worth it 
 When the hurly burly's done 
 We went to Bali saw God and Dali 
 So mystic surrealistic 
 Was it all worth it yeah yeah 
 Giving all my heart and soul staying up all night 
 Was it all worth it 
 Living breathing rock'n'roll this never ending fight 
 Was it all worth it was it all worth it 
 Yes it was a worthwhile experience 
 It was worth it"
141,Queen,rock,Hang On In There,"Don't let go 
 Don't lose your mystique 
 Wait a little longer 
 Tomorrow brings another feast 
 Don't let go 
 Don't lose your reputation 
 Thank God you're still alive 
 You're still in one piece 
 Hang on in there 
 Don't lose your appetite 
 Hang on in there 
 Forget the danger signs 
 Pray for that magical moment (straight ahead) and it will appear 
 Don't fight for lost emotions 
 Wait for the sunrise 
 And everything will seem so clear 
 (Look straight ahead, look straight ahead) 
 Hang on in there (hang on in there) 
 Hang on in there (hang on in there) 
 Your wish will be granted 
 All your problems will disappear 
 Don't be a fool 
 You haven't reached your peak 
 You got a fast car racing up inside you 
 Your life is incomplete 
 Hang on in there 
 Hang on in there 
 Pray for that magical moment and it will appear 
 (Wait for that moment) 
 Wait for the sunrise 
 Just wait and see and it will seem so clear 
 Hey, let's go, let's go! 
 (Okay, now do the change now.) 
 Yeah, hang on in there 
 Hang on in there 
 Yeah, yeah, yeah, yeah. 
 Yeah!"
142,Queen,rock,Hijack My Heart,"Words and music by Queen 
 Just walking down the street one cloudless sunny day 
 Just minding my business thinking my thoughts 
 Nothing much to say 
 When suddenly I got hit 
 Imagine my surprise 
 Your smile came up and zapped me right between the eyes 
 I'd never seen anything to compare with your smile 
 I'd never seen anything that came within miles 
 My heart got hijacked by you 
 Stuck in the traffic 
 Stuck at the lights what do I see 
 Some stupid bimbo in a fast car next to me 
 She takes off 
 Imagine my disgust 
 Like a bat out of hell 
 I get to eat her dust 
 I never had known anything to compare with her laugh 
 I'd never known anything that counted by half 
 My heart got hijacked by you 
 Hijack my heart 
 Hijack my heart 
 Steals my heart 
 Hijack my heart 
 Hijack my heart 
 Look at the cities 
 Look at the streets what do you see 
 Look at the faces look at the people they all want to be 
 Suddenly hit by something they don't get to choose 
 It comes out of nowhere 
 Right out of the blue 
 I'd never seen anything to compare with your smile 
 I'd never seen anything that came within miles 
 My heart got hijacked by you 
 Hijack my heart 
 Now you really got a hold on me 
 You hijacked my heart 
 Don't you know you won't let me be 
 Stole my heart 
 Threw away the key 
 Oooee baby what's become of me 
 You hijacked my heart 
 Now you really got a hold on me 
 Hijack my heart"
143,Queen,rock,Stealin',"That's the way I am 
 Does everybody want to know 
 This is the way I lead my life - you know 
 Wheelin' and dealin' 
 And a little bit of stealin' 
 You know that's the way I grew up 
 That's the only life I know 
 That's the way my mother taught me 
 There you go 
 Stealin' 
 I gave you the key to my home 
 I left you alone in charge of my heart 
 Hey stealin' 
 You got me wheelin' and dealin' 
 You play with my feelin' 
 Right from the start 
 Can't afford to pay my rent 
 I had to use my common sense 
 To get some money I owe - oho 
 This guy said look in my head 
 Make some easy bread 
 Stealin' is the only way that I know 
 Stealin' yeah only way that I know 
 Yeah I like stealin' baby stealin' 
 I gave you both my own on my own 
 Left you alone 
 Now you'll be stealin' stealin' stealin' 
 All my heart 
 You're my baby's heart 
 Uh uh 
 Baby let 'em bleed 
 You're in charge of my heart 
 You are in charge of my heart 
 You are in charge 
 You are in charge 
 Da da da da da da 
 Da da da da da da 
 Da da da da da da 
 Yes you are in charge of my heart 
 I gave you the key 
 And turned on the bed 
 I gave you the key 
 Come on I said what have I got 
 What have I got 
 Yes 
 I, I got the key out of my heart 
 Now get that key out of my heart 
 I said the key, hey, of my heart 
 Come on"
144,Queen,rock,Innuendo,"While the sun hangs in the sky and the desert has sand 
 While the waves crash in the sea and meet the land 
 While there's a wind and the stars and the rainbow 
 Till the mountains crumble into the plain 
 Oh yes we'll keep on tryin' 
 Tread that fine line 
 Oh we'll keep on tryin' - yeah 
 Just passing our time 
 While we live according to race, colour or creed 
 While we rule by blind madness and pure greed 
 Our lives dictated by tradition, superstition, false religion 
 Through the eons, and on and on 
 Oh yes we'll keep on tryin' 
 We'll tread that fine line 
 Oh oh we'll keep on tryin' 
 Till the end of time 
 Till the end of time 
 Through the sorrow all through our splendour 
 Don't take offence at my innuendo 
 You can be anything you want to be 
 Just turn yourself into anything you think that you could ever be 
 Be free with your tempo be free be free 
 Surrender your ego - be free be free to yourself 
 Ooh, ooh - 
 If there's a God or any kind of justice under the sky 
 If there's a point, if there's a reason to live or die 
 If there's an answer to the questions we feel bound to ask 
 Show yourself - destroy our fears - release your mask 
 Oh yes we'll keep on trying 
 Hey tread that fine line 
 Yeah we'll keep on smiling yeah (yeah yeah yeah) 
 And whatever will be - will be 
 We'll just keep on trying 
 We'll just keep on trying 
 Till the end of time 
 Till the end of time 
 Till the end of time"
145,Queen,rock,I'm Going Slightly Mad,"When the outside temperature rises 
 And the meaning is oh so clear 
 One thousand and one yellow daffodils 
 Begin to dance in front of you - oh dear 
 Are they trying to tell you something? 
 You're missing that one final screw 
 You're simply not in the pink my dear 
 To be honest you haven't got a clue 
 I'm going slightly mad 
 I'm going slightly mad 
 It finally happened - happened 
 It finally happened - ooh oh 
 It finally happened - I'm slightly mad 
 Oh dear! 
 I'm one card short of a full deck 
 I'm not quite the shilling 
 One wave short of a shipwreck 
 I'm not my usual top billing 
 I'm coming down with a fever 
 I'm really out to sea 
 This kettle is boiling over 
 I think I'm a banana tree 
 Oh dear! 
 I'm going slightly mad 
 I'm going slightly mad 
 It finally happened - happened 
 It finally happened - uh huh 
 It finally happened - I'm slightly mad 
 Oh dear! 
 I'm knitting with only one needle 
 Unravelling fast it's true 
 I'm driving only three wheels these days 
 But my dear how about you? 
 I'm going slightly mad 
 I'm going slightly mad 
 It finally happened 
 It finally happened - oh yes 
 It finally happened 
 I'm slightly mad! 
 Just very slightly mad! 
 And there you have it!"
