,0,1,2,3
165,Red Hot Chili Peppers,rock,Turn It Again,"Some of us get a little and some a lot 
 We've got to make due with what ever we got 
 We get it hot, we cool it down and then we pass it around 
 You can dance for the sake of a golden day 
 Take a chance on getting rid of whatever's in your way 
 Next stop, big hop, it's turning night into day 
 Sometimes when I'm lying there all alone 
 I think of every little nothing that we could own 
 To overthrow all of you who have overgrown 
 All my friends 
 Like to spend 
 Days on end 
 On the mend 
 I turn to you, I turn into and then I turn it again 
 Here we go 
 All we know 
 Heavy load 
 Start to float 
 Without a doubt we turn it out and then we turn it again 
 I've come to learn whatever time I can find to spend 
 Taking flight into whatever light we bend 
 Out in the street I get a beat and then I turn it to ten 
 Lace boots and the ladies of Kazakhstan 
 Kick 'em high to the sky 
 All of this just because we can 
 I turn to Cuba then Aruba then the Dominican 
 All my friends 
 Like to spend 
 Days on end 
 On the mend 
 I turn to you, I turn into and then I turn it again 
 Here we go 
 All we know 
 Heavy load 
 Start to float 
 Without a doubt we turn it out and then we turn it again 
 (Two things I want to say now 
 You make it all okay now 
 I need to know that you are there) 
 We've got to move it if we want to do our best 
 We've got to shake it if we want to keep it fresh 
 I'm turning down all the heavy psychology 
 To cut a rug and I make no apology 
 I turn a cheek, I turn a key and then I turn it for free 
 We've got to move it just a little to hit the spot 
 A whirling dervish in a flurry, a fox to trot 
 Come clown around, a robot doing the astronaut 
 All my friends 
 Like to spend 
 Days on end 
 On the mend 
 I turn to you, I turn into and then I turn it again 
 Here we go 
 All we know 
 Heavy load 
 Start to float 
 Without a doubt we turn it out and then we turn it again 
 (Two things I want to say now 
 You make it all okay now 
 I need to know that you are there)"
166,Red Hot Chili Peppers,rock,Death Of A Martian,"Bear paws and rascal power 
 Watching us in your garage 
 Big girl, you ate the neighbor 
 The nova is over 
 Wake up and play 
 By the radio 
 Make room for Clara's bare feet 
 The lover, a Martian 
 Tick tock, they're waiting for the meteor 
 This clock is opening another door 
 Lots of love, just keep it comin' 
 Making something out of nothin' 
 These are the best that I 
 I don't know how to say 
 Look at what I love today 
 These are the best that I 
 Lots of love, just keep it comin' 
 Making something out of nothin' 
 These are the best that I 
 I don't know what to say 
 Look at what I lost today 
 These are the things that I 
 Blood flowers in the kitchen 
 Signing off and winding down 
 This Martian ends her mission 
 The nova is over 
 She caught the ball 
 By the mission bell 
 Chase lizards, bark at donkeys 
 The lover, a Martian 
 Let's bow our heads 
 And let the trumpets blow 
 Our girl is gone 
 God bless her little soul 
 Lots of love, just keep it comin' 
 Making something out of nothin' 
 These are the best that I 
 I don't know how to say 
 Losin' what I love today 
 These are the best that I 
 Lots of love, just keep it comin' 
 Making something out of nothin' 
 These are the best that I 
 I don't know what to say 
 Look at what I lost today 
 These are the things that I 
 She's got sword in case 
 Though this is not her lord in case 
 The one who can't afford to face her image is restored to grace 
 Disappeared, no trace 
 Musky tear, suitcase 
 The downturn, brave little burn cub 
 Bear careless, turnip snare rampages 
 Pitch color pages 
 Down and out, but not in Vegas 
 Disembarks and disengages 
 No loft 
 Sweet pink canary cages 
 Plummet pop, dew skin, fortitude for the sniffing black noses 
 That snort and allude to dangling trinkets 
 That mimic the dirt cough go drink it's 
 It's for you 
 Blue battered naval down slip kisses 
 Delivered by duck muscles and bottle-nosed grifters 
 Arrive in time to catch the late show 
 It's a beehive barrel race 
 A she-hive stare and chase 
 Wasted feature who tried and failed to reach her 
 Embossed beneath a box in the closet that's lost 
 The kind that you find when you mind your own business 
 Shiv sister to the quickness before it blisters 
 Into the new morning milk blanket 
 Your ilk is funny to the turnstyle touch bunny 
 Whose bouquet set a course for bloom without decay 
 Get your broom and sweep echoes of yesterday's fallen freckles away"
167,Red Hot Chili Peppers,rock,Havana Affair,"PT boat on the way to Havana 
 I used to make a living, man, picking the banana 
 Now I'm a guide for the CIA 
 Hooray for the USA 
 Baby, baby, make me a loco 
 Baby, baby, make me a mambo 
 Sent to spy on a Cuban talent show 
 First stop: Havana au go-go 
 I used to make a living, man, picking the banana 
 Hooray for Havana 
 Baby, baby, make me a loco 
 Baby, baby, make me a mambo"
168,Red Hot Chili Peppers,rock,A Certain Someone,"When will it come around 
 The wind that will inspire 
 When will it make a sound 
 The sound I desire 
 'Cause we all need something to do 
 A certain something, that's true 
 Floating upstream I've seen 
 The spider and the snake 
 A trip without pause when 
 I saw my mistake 
 'Cause we all need something to do 
 A certain something, that's true 
 All my life I have known who I am 
 A troubled man, but I stand 
 All my life I have seen what it means 
 To be myself in this dream 
 'Cause we all need something to do 
 A certain someone... that's you"
169,Red Hot Chili Peppers,rock,Mercy Mercy,"Oh mercy, mercy, mercy me 
 I look around I need another remedy 
 The ""I don't know"" is philosophy 
 Better yet, I'll let you get ahead of me 
 Oh mercy, mercy, mercy me 
 Come around I need another enemy 
 Anyone could clearly see 
 A summer breeze is part of my anatomy 
 When it's written in Britain 
 We get a little smitten 
 Like a kitten, a cuddle is where I'm benefitin' 
 Any higher the fire would have to petrify her 
 Upon the wire the flayer is gonna satisfy her 
 My love is forever 
 My love it can feel this 
 My breathless defender 
 Step froward and steal this 
 Mercy, mercy, mercy me 
 Comin' down I gotta catch the gravity 
 Even though we disagree 
 Give a kiss 'cause life could be the death of me 
 Acrobatic the static is getting to dramatic 
 Comin' down with the system 
 We'll get it systematic 
 Fascilitatin' the maiden my love is circulating 
 Rejuvenating the fading but never dilating 
 My love is forever 
 My love it can feel this 
 My breathless defender 
 Step froward and steal this 
 Mercy, mercy, mercy me 
 Lovin' on the color of an Emily 
 Easy as a guarantee 
 Better yet, I'll show you what you wanna see 
 My love is forever 
 I want you to feel this 
 My breathless defender 
 Step froward and steal this 
 We aim to forever, I want you to feel this 
 My gentle defender 
 Step froward and steal this"
170,Red Hot Chili Peppers,rock,Funny Face,"It must have been your funny face 
 It must have been your love 
 Must have been your paper chase 
 That wasn't quite enough 
 Must have been your tiny dance that 
 Made me laugh out loud 
 Must have been your angel dust that 
 Put me on your cloud 
 You're the reason why 
 You're the reason I 
 It must have been your love 
 It must have been your love... I said 
 It must have been your love... in a little bit 
 It must have been your love 
 It must have been your poppy eyes 
 That made me step outside 
 It must have been the sight of tears that 
 Let me know I cried 
 It must have been your bunny shake 
 It must have been your love 
 A lot of girls won't come around they 
 Treat me like a wolf 
 It must have been your love 
 It must have been your love... I said 
 It must have been your love... I gotta give it that 
 It must have been your love 
 You're my angel, baby 
 You're my darling 
 You're my star 
 Lo-lo-lo-lolita 
 Let her see me deep in love 
 You're the reason why 
 You're the reason I 
 It must have been your love 
 It must have been your love 
 It must have been your love 
 It must have been your love 
 You're my angel baby 
 You're my darling 
 You're my star 
 Lo-lo-lo-lolita 
 Let her see me deep in love 
 Lopsided eyes and a crooked frown 
 Make more of life, just settle down 
 Every single little princess needs a crown 
 Make more of life, just settle down 
 It must have been your love 
 It must have been your love 
 It must have been your love 
 It must have been your love"
171,Red Hot Chili Peppers,rock,I'll Be Your Domino,"Bang on my window if 
 You want to get your look out 
 I felt the wind blow when 
 She took her little book out 
 I'm steady loving on the 
 Lady of these pages 
 Another chapter if you will 
 So advantageous 
 Down on the river tonight 
 Take off your glasses and fight 
 Under the hula moon I'm 
 Going to pop the culture 
 Blue cherry dress on you 
 Is looking like a sculpture 
 This recreation is amusing 
 And confusing 
 You never knew that it 
 Could feel so good while losing 
 What you lose? 
 Your virginity 
 Down on the river tonight 
 Take off your glasses and fight 
 I'll be your domino 
 Sit back and watch it flow 
 Get so emotional 
 I got a notion for 
 And when a star gets bent 
 I'll be your parliament 
 I'll be your domino 
 Sit back and watch it flow 
 My intuition was a 
 Poppin' and a shakin' 
 The very thought of it was 
 All too much to take in 
 Curl up with lover we 
 Could lie out on the blanket 
 This canopy above I'll 
 Take the time to thank it 
 Down on the river tonight 
 Take off your panties and fight 
 I'll be your domino 
 Sit back and watch it flow 
 Get so emotional 
 I got a notion for 
 And when a star gets bent 
 I'll be your parliament 
 I'll be your domino 
 Sit back and watch it flow 
 I want to bury my face 
 Deep in your aroma 
 Her name is Lisa 
 But they call her Desdemona 
 Come out and see me for 
 Some street communication 
 I think it's sweet of you 
 To be my motivation 
 I'll be your domino 
 Sit back and watch it flow 
 Get so emotional 
 I got a notion for 
 And when a star gets bent 
 I'll be your parliament 
 I'll be your domino 
 Sit back and watch it flow"
172,Red Hot Chili Peppers,rock,Joe,"Burning up your hometown streets could set a fire for the world to catch 
 Burn it up, no need to reconcile 
 Come and see me, I'm your west end perfect stranger, in America 
 Lady on that state's so full of style 
 Stand up, turn around, beat it out 
 You gotta sound, Joe 
 Swing low and now I know 
 It's hard to let a brother go, Joe 
 The many boots that you have laced could tell a story, comin' night and day (?) 
 No one said that you would need a crowd 
 The many lands that you have graced could make a case that there is no better make 
 And now I only see your face in clouds 
 Stand up, turn around, beat it out 
 You gotta sound, Joe 
 Swing low and now I know 
 It's hard to let a brother go, Joe 
 Stand up, turn around, beat it out 
 You gotta sound, Joe 
 Swing low and now I know 
 It's hard to let a brother go, Joe 
 Tell me so (?) 
 Do you know 
 Does it show 
 When I'm low 
 And then again, when I feel your love from far away, I think of yesterday 
 I see a family we know how to smile 
 There comes a time when you must rock another world and we will get along 
 There comes a time when we will walk that mile 
 Stand up, turn around, beat it out 
 You gotta sound, Joe 
 Swing low and now I know 
 It's hard to let a brother go, Joe 
 Stand up, turn around, beat it out 
 You gotta sound, Joe 
 Swing low and now I know 
 It's hard to let a brother go, Joe"
173,Red Hot Chili Peppers,rock,Save This Lady,"I got more love than anything else 
 But a Jezebel spirit gonna steal my health 
 Struck by the notion that there just might be 
 A method to the madness that I cannot see 
 Something for the freedom of a roughed-up soul 
 Forty-two years young is a little bit old 
 Boy named Sue sing a Tennessee tune 
 Got buffalo love living on the moon 
 Save this lady for me [x4] 
 Call me Alabama I'm a Seminole prize 
 Got Times Square hair and a bedroom eyes 
 Keystone Kops and the billy bob chops 
 Gonna scare my kids gonna share my crops 
 Vampire blood and a baseball glove 
 Are just a little bit of what the girl is made of 
 National crash into the big lampoon 
 With a creature coming up from the black lagoon 
 Losing ground true sounds of liberty 
 The forest of the north might hold the key 
 Rocking to the rhythm of a ragtime band 
 Black flag wave on on my truck my man 
 Basketball Jones and the great unknowns 
 Got cheap cologne seventy-six trombones 
 Looking for the lady that won't be afraid 
 When heady needs a hammer gonna get things made 
 I got more love than anything else 
 But a Jezebel spirit gonna steal my health"
174,Red Hot Chili Peppers,rock,Monarchy Of Roses,"The crimson tide is flowing through 
 Your fingers as you sleep 
 The promise of a clean regime 
 Are promises we keep 
 Do you like it rough I ask 
 And are you up to task 
 The calicos of Pettibon 
 Where cultures come to clash 
 Several of my best friends wear 
 The colors of the crown 
 And Mary wants to build it up 
 And Sherri wants to tear it all back down girl 
 The savior of your light 
 The monarchy of roses 
 The monarchy of roses tonight 
 The cross between my former queen 
 Her legendary stare 
 The holy tears of Ireland 
 A lovely cross to bear 
 Several of my best friends know 
 The secrets of this town 
 And Mary wants to raise it up 
 And Sherri wants to spin it all around girl 
 The sailors of the night 
 The monarchy of roses 
 The monarchy of roses tonight 
 Several of my best friends wear 
 The colors of the crown 
 And Mary wants to build it up 
 And Sherri wants to tear it all back down girl 
 The savior of your light 
 The monarchy of roses 
 The monarchy of roses 
 Hey 
 We all want the rose you know 
 I said, hey 
 Show us love before you go 
 Say I will then say I want to 
 The story knows that I will never taunt you 
 Hey 
 We all want the rose you know 
 I said, hey 
 Show us love before you go 
 Say I will then say I want to 
 The story knows that I will always haunt you 
 Hey"
175,Red Hot Chili Peppers,rock,Factory Of Faith,"All my life I was swinging for the fence 
 I was looking for the triple 
 Never playing good defense 
 Gunnin' for the glitter 
 Every hot and heavy hitter 
 She was never really there so I couldn't really get her 
 I said 
 Factually I, I'm just a piece of it 
 Factually I, the very least of it 
 Piece of work, I was really quite a jerk 
 Keeping score is such a bore, a busy mind could go berserk 
 Oh 
 Feast on this, I was fishing for a hook 
 So I took a little trip and I opened up the book 
 I said 
 Factually I, I'm just a piece of it 
 Factually I, the very least of it 
 Factually I, it's just a medicine 
 Make you wanna cry, why don't they let us in? 
 Be my wife, I think you're right that we should mate 
 Tell your friends, I got a factory of faith 
 Late last night, I had a dream that it was great 
 Tell your friends, I got a factory of faith 
 I got a factory of... 
 Crack your whip, she's confessing from the hip 
 She was good at getting there, but not as much for round-trip 
 Oh, all this time, I was searching for a dream 
 I was living in and out of every other sex machine 
 I said 
 Factually I, I'm just a piece of it 
 Factually I, the very least of it 
 Factually I, it's just a medicine 
 Makes you wanna cry, why don't they let us in? 
 Be my wife, I think you're right that we should mate 
 Tell your friends, I got a factory of faith 
 Late last night, I had a dream that it was great 
 Tell your friends, I got a factory of faith 
 I got a factory of... 
 Be my wife, I think you're right that we should mate 
 Tell your friends, I got a factory of faith 
 Late last night, I had a dream that it was great 
 Tell your friends, I got a factory of faith 
 I got a factory of... 
 Faith 
 And love 
 And luh-ooh-uh-ooh-uh-ooh-uh-ooh-ove"
176,Red Hot Chili Peppers,rock,Brendan's Death Song,"If I die before I get it done, will you decide? 
 Take my words and turn them into signs that will survive 
 Because a long time ago I knew not to deprive 
 It's safe out there and now you're everywhere, just like the skies 
 You are love, you are the love supreme, you are the rise 
 And when you hear this, you know it's your jam, it's your goodbye 
 Like I said, you know I'm almost dead, you know I'm almost gone 
 And when the drummer drums, he's gonna play my song to carry me along 
 Like I said, you know I'm almost dead, you know I'm almost gone 
 And when the boatman comes to ferry me away to where we all belong 
 We all crossed when we were feeling lost, it's just the tide 
 Katari cried the day her lover died, she recognized 
 Because he gave her a life of real love, it's no surprise 
 The nights are long but the years are short when you're alive 
 Way back when would never be again, it was a time 
 It's gonna catch you, so glad I met you, to walk the line 
 Like I said, you know I'm almost dead, you know I'm almost gone 
 And when the drummer drums he's gonna play my song to carry me along 
 Like I said, you know I'm almost dead, you know I'm almost gone 
 And when the boatman comes to ferry me away to where we all belong 
 Come get me! 
 Hey! Hey! 
 Yeah! Yeah! Yeah! 
 Like I said, you know I'm almost dead, you know I'm almost gone 
 And when the drummer drums he's gonna play my song to carry me along 
 Like I said, you know I'm almost dead, you know I'm almost gone 
 And when the boatman comes to ferry me away to where we all belong 
 Let me live 
 So when it's time to die 
 Even the reaper cries 
 Let me die 
 So when it's time to leave 
 Another son will rise 
 I said yeah! Yeah, yeah! Yeah, yeah! 
 I said yeah! Yeah, yeah! Yeah, yeah! 
 (I said yeah! Yeah, yeah! Yeah, yeah!) 
 Like I said, you know I'm almost dead, you know I'm almost gone 
 (I said yeah! Yeah, yeah! Yeah, yeah!) 
 And when the drummer drums, he's gonna play my song to carry me along 
 (I said yeah! Yeah, yeah! Yeah, yeah!) 
 Like I said, you know I'm almost dead, you know I'm almost gone 
 And when the boatman comes to ferry me away to where we all belong 
 Like I said, you know I'm almost dead, you know I'm almost gone 
 Like I said, you know I'm almost dead, you know I'm almost gone 
 Like I said, you know I'm almost dead, you know I'm almost gone"
177,Red Hot Chili Peppers,rock,Ethiopia,"E I O I E I A 
 When you give your love away 
 You get a feeling for... 
 E I O I E I A 
 Live to love another day 
 Even when you feel unsure 
 More and more, I wanna raise 
 Raise my bar and raise your stakes 
 E I O I E I A 
 When I lay there, wide awake 
 For my son I'll make 
 Tell my boy I love him so 
 Tell him so he knows 
 Lost in Ethiopia 
 Walk out in that road 
 E I O I E I A 
 Something good gonna come your way 
 Just look out your door 
 E I O I E I A 
 Tell 'em what you wanna say 
 No matter what you might incur 
 Tell my boy I love him so 
 Tell him so he knows 
 Lost in Ethiopia 
 Walk out in that road 
 E I O I E I A 
 Steal my heart to give away 
 Make me wanna say 
 E I O I E I A 
 You and I are sewn the same 
 More and more, and more each day 
 Tell my boy I love him so 
 Tell him so he knows 
 Lost in Ethiopia 
 Walk out in that road"
178,Red Hot Chili Peppers,rock,Annie Wants A Baby,"Lucy Rebar 
 She's a friend of mine 
 Later she'll go 
 Back and redefine the line 
 It's getting longer all the time 
 Oh yeah 
 Drinkin' sunshine 
 She likes the taste of it 
 She had a gold mine 
 But then she wasted it away 
 You should have seen her yesterday 
 Oh yeah 
 Send along the way 
 Nothing stops the ache 
 Sugar daddy 
 Loves her madly 
 Cosma Shiva 
 Got off 
 Made you a believer 
 I don't need to 
 Tender 
 Why do I believe you? 
 Annie wants a baby now 
 Annie wants a baby any way she can 
 Missing pieces 
 She's got a lot of 'em 
 Time decreases 
 I wish I thought of 'em before 
 Before it's time 
 To close the store 
 Oh yeah 
 Distillation 
 A lonely sycophant 
 Some liberation 
 The only seed 
 We ever plant 
 I wanna help you 
 But I can't 
 No, no 
 Send along the way 
 Nothing stops the ache 
 Sugar daddy 
 Loves her madly 
 Love 'er, leave 'er 
 God off 
 Made you a believer 
 Neon soldiers 
 Left her 
 Now you've gotten older 
 Annie wants a baby now 
 Annie wants a baby any way she can 
 It's getting longer all the time 
 It's time to redesign the sign 
 Oh yeah 
 Sings along the way"
179,Red Hot Chili Peppers,rock,Look Around,"Whoo! 
 Stiff club 
 It's my nature 
 Custom love 
 Is the nomenclature 
 Turn down 
 Mass confusion 
 Hit the road 'cause we just keep cruising 
 Double my fun 
 Double my vision 
 Long hard look at my last decision 
 Hustle here 
 Hustle there 
 Hustle me bitch and you best beware 
 It's emotional 
 And I told you so 
 But you had to know 
 So I told you 
 Soft walk 
 To horizon 
 One big crash that no one dies in 
 This is for the folks in Fayetteville 
 It'll come true if you say it will 
 Look around, look around, look around 
 All around, all around, all around 
 Look around, look around, look around 
 All around, all around, all around 
 It's emotional 
 And I told you so 
 But you had to know 
 So I told you 
 Please don't 
 Look right through me 
 It hurts my heart 
 When you do that to me 
 Street life 
 Out my window 
 City may breeze gonna stroke my skin though 
 Just a lot of words 
 On an old brick wall 
 Rob a lot of banks, got a pedigree straw 
 Put my peg 
 Into your square 
 Run around like we just don't care 
 Look around, look around, look around 
 All around, all around, all around 
 Look around, look around, look around 
 All around, oh yeah 
 Move it, I gotta get ya, wanna getcha 
 Move it, I gotta get ya, wanna getcha 
 Move it, I gotta get ya, wanna getcha 
 Move it, I gotta get ya, wanna getcha 
 Move it, I gotta get ya, wanna getcha 
 Move it, I gotta get ya, wanna getcha 
 Move it, I gotta get ya, wanna getcha 
 Move it, I gotta get ya, wanna getcha 
 Look around, look around, look around 
 All around, all around, all around 
 Look around, look around, look around 
 All around, oh yeah 
 When I'm feeling small and I'm hitting a wall 
 Wanna feel it all around 
 When I'm feeling small and I'm hitting a wall 
 Wanna feel it all around"
180,Red Hot Chili Peppers,rock,The Adventures Of Rain Dance Maggie,"Lipstick junkie 
 Debunk the all-in-one 
 She came back wearing a smile 
 Lookin' like someone drugged me 
 That wanted to unplug me 
 No one in here is on trial 
 It's just a turn-around 
 And we go 
 Oh 
 Well and we go 
 Oh oh oh oh 
 Tick-tock, I want to 
 Rock you like the 80s 
 Cock-blocking isn't allowed 
 Tugboat Sheila 
 Is into memorabilia 
 Who said three is a crowd? 
 We better get it on the go 
 Hey, now 
 We've gotta make it rain somehow 
 She told me too 
 And show me what to do 
 Our Maggie makes it in a cloud 
 I said hey now 
 We gotta make it rain somehow 
 She told me to 
 And showed me what to do 
 She knows how to make it loud 
 Rain dance Maggie 
 Advances to the final 
 Who knew that she had the goods? 
 Little did I know her body 
 Was warm delicious vinyl 
 To your neck of the woods 
 I want to lick a little bit 
 Hey now 
 We've gotta make it rain somehow 
 She told me to 
 And showed me what to do 
 Our Maggie makes it in a cloud 
 You got the wrong girl 
 But not for long, girl 
 It's in the song, girl 
 'Cause I'll be gone, girl 
 Hey now 
 We've gotta make it rain somehow 
 She told me to 
 And showed me what to do 
 Our Maggie makes it in a cloud 
 I said hey now 
 I want to rock this rowdy crowd 
 She told me to 
 And showed me what to do 
 She knows how to make it loud 
 But not for long girl 
 It's in a song girl 
 'Cause I'll be gone, bye bye bye yeah 
 Bye bye bye girl 
 Bye bye bye girl"
181,Red Hot Chili Peppers,rock,Did I Let You Know,"I'm coming for ya 'cause 
 'Cause I adore ya and 
 I like to get inside your mass production 
 This indecision has 
 Has got me cringing, well 
 I can't resist the smell of your seduction 
 Did I let you know? 
 Would you like to go? 
 Unwrap the package without much persuasion 
 Did I let you know? 
 Would you like to go? 
 I wanna dance to everyday's occasion 
 This I know! Yeah, this I know! 
 (Take me home, well take me home) 
 This I know, we're not alone 
 (Take me home, take me home) 
 When we envision a lack of division and 
 The planet does another revolution 
 The day I blew on ya 
 You said I grew on ya 
 Turns out that we are all the one solution, go! 
 I'm coming at you, well 
 You are the cat too and 
 I like the sound of your articulations 
 Want to arouse her and 
 Maybe espouse her, well 
 She showed me love without the stipulations 
 This I know! Yeah, this I know! 
 (Take me home, well take me home) 
 This I know, we're not alone 
 (Take me home, take me home) 
 I wanna lean on ya 
 Get Jan and Dean on ya 
 It's time to sway a little mass perception 
 I like you cheeky, well 
 So Mozambique-y and 
 I think the world could use a clear connection 
 This I know! Yeah, this I know! 
 (Take me home, well take me home) 
 This I know, we're not alone 
 (Take me home, take me home) 
 This I know! Hey, this I know! 
 (Take me home, well take me home) 
 This I know, we're not alone 
 (Take me home, take me home) 
 Did I let you know? 
 Would you like to go? 
 Did I let you know? 
 Would you like to go? 
 Did I let you know? 
 Would you like to go?"
