,0,1,2,3
0,Red Hot Chili Peppers,rock,True Men Don't Kill Coyotes,"Hoo, Lord! 
 Well, I'm gonna ride a sabertooth horse 
 Through the Hollywood hills 
 The farther west, the farther out 
 Yeah, that's the way I feel 
 Well, I dig the dirt an' I dig the dust 
 I barbecue my meals 
 Ridin' wild on a paisley dragon 
 Through the Hollywood hills, yeah... 
 Huh, Hollywood hills 
 Well, I'm gonna ride a sabertooth horse 
 Through the Hollywood hills 
 Just don't show me anything 
 'Cause that's the way I feel 
 Well, I dig the dirt an' I dig the dust 
 I barbecue my meals 
 Ridin' wild on a paisley dragon 
 Through the Hollywood hills, yeah... 
 Huh, Hollywood hills 
 Passion dripping from the coyote's eyes 
 He can taste his blood 
 An' blood never lies 
 Pale face die 
 True men don't kill coyotes 
 True men don't kill coyotes 
 Well, I'm gonna ride a sabertooth horse 
 Through the Hollywood hills 
 The farther west, the farther out 
 Yeah, that's the way I feel 
 Well, I dig the dirt an' I dig the dust 
 I barbecue my meals 
 Ridin' wild on a paisley dragon 
 Through the Hollywood hills, yeah... 
 Huh, Hollywood hills 
 Passion dripping from the coyote's eyes 
 He can taste his blood 
 An' blood never lies 
 Pale face die 
 True men don't kill coyotes 
 True men don't... 
 Well, I'm gonna ride a sabertooth horse 
 Through the Hollywood hills 
 Just don't tell me anything 
 'Cause that's the way I feel 
 Well, I dig the dirt an' I dig the dust 
 I barbecue my meals 
 Ridin' wild on a paisley dragon 
 Through the Hollywood hills, yeah... 
 Huh, Hollywood hills 
 Passion dripping from the coyote's eyes 
 He can taste his blood 
 An' blood never lies 
 Pale face die 
 True men don't kill coyotes 
 True men don't... 
 True men don't kill coyotes 
 True men don't... 
 True men don't kill coyotes 
 True men don't..."
1,Red Hot Chili Peppers,rock,Baby Appeal,"On the city streets, I got the tunes in my box 
 I play the Chili Peppers so the public can rock 
 Excuse me mister, won't you hear my thoughts? 
 I play in a band, yeah, we're called the Red Hots 
 While I'm away, boy, I'm afraid not 
 I've got no time to think and talk 
 But his baby rocked out on the spot 
 She was a shakin' and a kickin', that itty bitty tot 
 Her pop said no, but she just couldn't stop 
 The kid had a case of toddler rock 
 But here's a funky fact that I know is real, 
 The Red Hots have baby appeal 
 They dig a funky spiel, they'll make some spiel 
 I say the Peppers have baby appeal 
 The funk mobile is the one we wheel 
 I'm overjoyed, we have baby appeal 
 We serve those tots in the funk mobile 
 I'm overjoyed, we have baby appeal 
 We stop the fire, we quench the heat 
 We groove the buttocks walking out in the street 
 'Cause that's when in the store when who do we meet? 
 On a hop skip jump up a baby beat 
 She was a shakin' and a kickin' those itty bitty feet 
 The next thing you know was she got out of her bleat 
 Five thousand babies walkin' out in the street 
 Well, that's a serious sight for me and golly gee whiz! 
 I just can't tell ya how much we did 
 Rockin' right out for those itty bitty girls, right out 
 But here's a funky fact that I know is real, 
 The Red Hots have baby appeal 
 They dig a funky spiel, that makes some spiel 
 I say the Peppers have baby appeal 
 The funk mobile is the one we wheel 
 I'm overjoyed, we have baby appeal 
 We serve those tots in the funk mobile 
 I'm overjoyed, we have baby appeal, so get down! 
 Got the tunes in my box... 
 Baby appeal... 
 Rock out!... 
 Play the chili, play the chili, play the chili... 
 Yes, we're called the Red... Hots... 
 On the city streets, I got the tunes in my box 
 I play the Chili Peppers so the public can rock 
 Excuse me mister, won't you hear my thoughts? 
 I play in a band, yeah, we're called the Red Hots 
 While I'm away, boy, I'm afraid not 
 I've got no time to think and talk 
 But this baby rocked out on the spot 
 She was a shakin' and a kickin' that itty bitty tot 
 Her pop said no, but she just couldn't stop 
 The kid had a case of toddler rock 
 But here's a funky fact that I know is real, 
 The Red Hots have baby appeal 
 They dig a funky spiel, they'll make some spiel 
 I say the Peppers have baby appeal 
 The funk mobile is the one we wheel 
 I'm overjoyed, we have baby appeal 
 We serve those tots in the funk mobile 
 I'm overjoyed, we have baby appeal"
2,Red Hot Chili Peppers,rock,Buckle Down,"Hah! 
 On the ice 
 No holdin' 
 My soul 
 I want men 
 Not mice 
 No stoppin' 
 My throw 
 Hah! 
 Get this! 
 Red star 
 Black fist 
 Work 
 Or play ball 
 Or just turn me loose 
 I know what's right, in life, you better buckle down 
 Don't give up your fight, in life, you better buckle down 
 Two days with might, in life, you better buckle down 
 Leave dreams tonight, in life, you better buckle down 
 'Cause I know what's right! 
 Hah! 
 On the ice 
 No holdin' 
 My soul 
 I want men 
 Not mice 
 No stoppin' 
 My throw 
 Hah! 
 Get this! 
 Reds are 
 Back bills 
 Work 
 Or play ball 
 Or just turn me loose 
 I know what's right, in life, you better buckle down 
 Don't give up your fight, in life, you better buckle down 
 Two days with might, in life, you better buckle down 
 Leave dreams tonight, in life, you better buckle down 
 'Cause I know what's right! 
 I know, I know, I know what's right! 
 I know, I know, I know what's right! 
 I know, I know, I know what's right! 
 I know, I know, I know what's right!"
3,Red Hot Chili Peppers,rock,Get Up And Jump,"Get up and jump, get up and jump, get up, get up, get up and jump 
 Jump on up 
 Jump on down 
 Just jump a jump a jump a jump a jump around 
 Jump the day away 
 Jump all over town 
 'Cause jumpin' is okay in a jumpin' kinda way, hey hey 
 Jump a boy 
 Jump a girl 
 Jump a rope 
 Jump for joy 
 Just don't stop jumpin' 
 Keep your heart muscle pumpin' 
 Hillel be jumpin' on that little baby frumpkin 
 Say what, You got a pumpkin in your pants? 
 When you're just standing or sitting still 
 Think about the frogs gettin' a thrill 
 Take a little lesson from the kangaroos 
 Don't you know they're jumpin' foos, jump you! 
 Jump a nun 
 Jump a Jack 
 Jump for fun 
 Jump back 
 How's about us jumpin' in the sack? 
 And now, it's time for a jump attack 
 Get up and jump 
 Get up and jump 
 Get up and jump 
 Get up and jump 
 Get up and jump 
 Get up and jump 
 Get up and jump 
 Get up and jump 
 Jam Bob, Jim Bob, Slim Bob Boogie 
 To the tune of slima Billy 
 Lookin' like you're mighty silly 
 Say what, You got a pumpkin in your pants? 
 Say what, You got a pumpkin in your pants? 
 Mister Mexican jumpin' bean knows 
 His fun is squeaky clean 
 Christ, how'd ya think that he got so clean? 
 Not from sittin' on his goddamn spleen. Get up! 
 Oh, I be jumpin' I be jumpin' I be jumpin' alone 
 I be jumpin' for the phone 
 I be jumpin' Mrs. Jones 
 I really wanna jump on Kinski's bones 
 Get up and jump 
 Get up and jump 
 Get up and jump 
 Get up and jump 
 Get up and jump 
 Get up and jump 
 Get up and jump 
 Get up and jump 
 Get up and hump 
 Get up and hump 
 Get up and hump 
 Get up and bump 
 Get up and bump 
 Get up and bump 
 Get up and stump 
 Get up and plump 
 Jam Bob, Jim Bob, Slim Bob Boogie 
 To the tune of slima Billy 
 Lookin' like you're mighty silly 
 Say what, you got a pumpkin in your pants? 
 Say what, you got a pumpkin in your pants?"
4,Red Hot Chili Peppers,rock,Why Don't You Love Me,"Why don't you love me like you used to do? 
 How come you treat me like a worn out shoe 
 My hair's still curly and my eyes are still blue 
 So why don't you love me like you used to do? 
 Why don't you spot me like you used to do? 
 When you whisper sweet nothings like you used to do 
 I'm the same old trouble that you've always been through 
 So why don't you love me like you used to do? 
 Why don't you be the way you used to be? 
 How come you fight so many fights with me 
 Somebody changed, so lemme give you a clue 
 Why don't you love me like you used to do? 
 Why don't you say the things you used to say? 
 How come you treat me like a piece of clay 
 My hair's still curly and my eyes are still blue 
 So why don't you love me like you used to do? 
 You can't keep a lovin' and a huggin' and a kissin' and I don't know why... 
 We don't get near or further closer land of country mouths 
 I don't love like a huggin' and a kissin' and I don't know why... 
 We don't get near or further closer land of country mouths 
 Take the ball... 
 Why don't you love me like you used to do? 
 How come you treat me like a worn out shoe 
 My hair's still curly and my eyes are still blue 
 So why don't you love me like you used to do? 
 Why don't you spot me like you used to do? 
 When you whisper sweet nothings like you used to do 
 I'm the same old trouble that you've always been through 
 So why don't you love me like you used to do? 
 Why don't you be the way you used to be? 
 How come you fight so many fights with me 
 Somebody changed, so lemme give you a clue 
 Why don't you love me like you used to do? 
 Why don't you say the things you used to say? 
 How come you treat me like a piece of clay 
 My hair's still curly and my eyes are still blue 
 So why don't you love me like you used to do? 
 You can't keep a lovin' and a huggin' and a kissin' and I don't know why... 
 We don't get near or further closer land of country mouths 
 I don't love like a huggin' and a kissin' and I don't know why... 
 We don't get near or further closer land of country mouths"
5,Red Hot Chili Peppers,rock,Green Heaven,"About this planet, there is something I know 
 There's a very big difference between above and below 
 A friend foe, or bro, leave your body on the floor 
 Let your spirit fly away like the soul of a crow 
 Here, above land, man has laid his plan 
 And yes, it does include the Ku Klux Klan 
 We got a government so twisted and bent 
 Bombs, tanks and guns is how our money is spent 
 We got V.D., heroin, greed and prostitution 
 Tension, aggravation, L. Ron Hubbard solution 
 Not to mention hard-core chemical pollution 
 If you think you're just away, you're in a mental institution 
 And that's a heart felt shame 
 'Cause everyone's crazy, everyone's the same 
 So, why should only Larry, Curly and Moe be to blame? 
 Time now to take you to a different place 
 Where peace lovin' whales flow through liquid outer space 
 A groovin' and a gliddin' as graceful as lace 
 A never losing touch with the ocean's embrace 
 Diviner than the dolphin, that there is none 
 'Cause dolphins just-a like to have a lot of fun 
 No one tells 'em how their life is run 
 And no one points at them with a gun 
 They have a lot of love for every living creature 
 The smile of a dolphin is a built in feature 
 They be movin' in schools but everyone's the teacher 
 Someday mister dolphin, I know I'm going to meet you 
 Back to the land of the policeman 
 Where he does whatever he says he can 
 Including hating you because you're a Jew 
 Or beating black ass, that's nothing new 
 Trigger happy cops, they just like to brawl 
 They use guns, clubs, gas, but that's not all 
 They got puke-ridden prisons and sex-sick jails 
 Fuck the poor, if you're rich you pay the bail 
 So support your police, support your local wars 
 That's the way to open economic doors 
 Why do we do it? 'Cause the president's a whore 
 We assume the position to sell the ammunition 
 What the fuck? It's the American tradition 
 Along with going fishin' apple pies in the kitchen 
 Isn't it bitchin' seeing dead men in ditches?"
6,Red Hot Chili Peppers,rock,Mommy Where's Daddy,"Mummy, where's daddy? 
 Mummy, where's daddy? 
 Right here, girl... 
 Sweet thing, you look so sad 
 Cheer up, don't you know your dad is bad 
 Give daddy a kiss, girl 
 Oh, dad 
 There ain't no problem I can't face 
 Your daddy's got a bigger pair of tricks 
 Give daddy a kiss, girl 
 Oh, dad 
 Mummy, where's daddy? 
 Mummy, where's daddy? 
 Come on, sit on your daddy's lap 'cause 
 I'm the one who pats your back 
 Give daddy a kiss, girl 
 Oh, dad 
 Lemme see now where to begin 
 Lemme start by tuckin' you in 
 Give daddy a kiss, girl 
 Oh, dad 
 Mummy, where's daddy?"
7,Red Hot Chili Peppers,rock,Out In L.A.,"We're all a bunch of brothers livin' in a cool way 
 Along with six million others in this place called L.A. 
 L.A. is the place, sets my mind ablaze 
 For me, it's a race through a cotton pickin' maze 
 The town makes me jump, it's got a bunch of bad chicks 
 Well sure, it's got some chumps but I still get my kicks 
 My body loves to scrump when I lick the ripe pick 
 Like a come on a thumb 
 Poppin' hump, hump, hump, pop out 
 The action never stops, I'm as wild as can be 
 'Cause I'm shooting for the top and my best friend is Flea 
 Oom Chucka Willy knew the balls to pop 
 But he never met the Tree so he never be-bopped out hop! 
 Antwan the Swan, from the pretty fish pond 
 Was a bad mother jumper, you could tell he was strong 
 He war a cold paisley jacket and a hellified hat 
 And between his legs was a sweat young lass 
 He threw a hundred women up against the wall 
 And he swore to fear that he'd love 'em all 
 By the time he got to ninety nine, he had to stop 
 Because that's when he thought that he heard a phone 
 Last night and the night before, I heard a 
 Fop outside, then I came in doors 
 Freak out! 
 Now that I told you a little something about the Flea 
 A little something about the Tree, a little something about me 
 I can't leave you hangin' but my man Shermzy, he swings the yang, he bangs the 
 Yang 
 And now, it's time to hear him do his playin', you better be burning Sherman! 
 We're all a bunch of brothers livin' in a cool way 
 Along with six million others in this place called L.A. 
 Step out!"
8,Red Hot Chili Peppers,rock,Police Helicopter,"Ow! 
 Police helicopter shot the sky 
 Police helicopter landin' on my eye 
 Yeah! 
 Police helicopter takes a nose-dive 
 Police helicopter, he ain't shy 
 Yeah! 
 Police helicopter shot the sky 
 Police helicopter landin' on my eye 
 Unh! 
 Police helicopter takes a nose-dive 
 Police helicopter, he ain't shy 
 Yeah! 
 Aww!"
9,Red Hot Chili Peppers,rock,You Always Sing,"You always loser 
 You always fruit 
 You always suck my dick 
 You always sing 
 You always sing the 
 You always sing the same 
 You always sing 
 You always sing the 
 You always sing the same 
 You always sing 
 You always sing the 
 You always eat your friends out 
 You always sing 
 You always sing the 
 You always sing the same 
 You always sit and laught at me 
 You always sing the stupid song 
 You always slap me 
 You always sing 
 You always sing the 
 You always suck my dick"
10,Red Hot Chili Peppers,rock,What It Is,"Give it up to this time full of strife 
 Get down, you might be fucking with the song of life 
 Extend your deeper senses, there will be no fight 
 At the never ending ocean of perfect insights 
 'Round your molecule beam with a halo of light 
 The animated aura will give delight 
 Soon, your every single worry will be out of sight 
 With the power of It, we are about to astound 
 All your preconceptions, they will come unbound 
 Listen very close, my inner voice expounds 
 We are the human race and we groove to the sound 
 Yes, we deliver the truth to our musical birth 
 A soul shocking sound with electrify the earth 
 People have to know that it's not about money 
 Cash is not the way to make your life sunny 
 There is no need if you got the soul seed 
 Love, life and peace, it can only begin 
 When you know in your heart that the change is within 
 Love all your brothers and love all your sisters 
 Love all the missus and love all the misses 
 And don't be shy when you're sharing your kisses 
 Greed, jealousy gets boos and hisses 
 What it is, what it is, so much to be found 
 What it is, what it is, groove down to the sounds 
 What it is, what it is, what it is in a song 
 What it is, what it is, you can do no wrong 
 Balance your life with the right kind of foods 
 To eat a sad cow is to eat another you 
 Well, that's an unfair rap, it's unforgivably rude 
 It'll put your karma in the worst of moods 
 Someone's drinking booze and taking too many ludes 
 'Cause when you cop, don't you cop an attitude 
 And that's an ugly thing, it's not the real you 
 So please y'all, take some sound advice 
 Be yourself, clear your mind, make a sacrifice 
 The always sober you is especially nice 
 Don't loot, don't shout, give comet the boot 
 I love it kickin' back and playin' my bamboo flute 
 Refuse to fight wars for political whores 
 Unsurpassed peace lines the salt water shores 
 It is my notion that the perfect peace potion 
 Can be found in the wake of the green sea ocean 
 The long rocky swells of the mighty blue ocean 
 Is the cradle of peace, it's the perfect peace potion 
 There you will find it, with sweet sea creatures 
 The smile of a dolphin is a built-in feature 
 We will learn much peace will the whale as your teacher 
 Good morning class, how very nice to meet you 
 What it is, what it is, so much to be found 
 What it is, what it is, groove down to the sounds 
 What it is, what it is, what it is in a song 
 What it is, what it is, you can do no wrong 
 Open up your hearts to the planets; to the stars 
 With your spirit take a trip from Venus to Mars 
 You know, Einstein did while Hitler hid 
 Now, Albert lives forever in every single kid 
 But, with Adolph Hitler, we are permanently rid 
 Picasso, Mister Dali and my man, Jimi Hendrix 
 These cool brothers make the world go 'round 
 Yeah, they do it with art, and Jimi did it with sound 
 But, by all these men, it was found 
 Each and every person can be just as renowned 
 Don't let the world's racist creeds give your pretty face a frown 
 Stand up for equal rights, I mean buckle down 
 Go spread the word from town to town 
 We are the human race and we groove to the sounds 
 Now that you've heard what it is in a song 
 From here on in, you can do no wrong"
11,Red Hot Chili Peppers,rock,Jungle Man,"Deep inside the soul hole 
 Of Mother Earth 
 Father Time came 
 With a supersonic supersonic burst 
 His soul monkey sperm tribes 
 Racing to be first 
 Her ruby fruit jungle 
 Givin' bush baby, bush baby birth 
 The baby was a boy 
 But I think what stunned her 
 Is that this bare breasted baby 
 Was a baby boy, boy, boy, boy wonder 
 Crackin' from his thumb bone 
 Came thelonious thunder 
 Fill the sky with hellfire 
 From way down, down, down under 
 I am a jungle man 
 I am a jungle man 
 I am a jungle man 
 I get all the bush I can 
 Erupting from the ground 
 In Hollywood he glowed 
 His jungle turned to concrete 
 His funk bone, bone, bone, bone to stone 
 Like a full blown volcano 
 I must let it be known 
 That through this boy's vein 
 Atomic lava blood flows and flows 
 His soul shocking sounds 
 They make the mountains moan 
 This boy's become a man 
 It's time to take, take, take 
 Take the throne 
 I am a jungle man 
 I am a jungle man 
 I am a jungle man 
 I get all the bush I can"
12,Red Hot Chili Peppers,rock,Hollywood (Africa),"Take me back 
 Hold my hand 
 All the way back 
 To the brotherland 
 Take me back 
 I want to go back 
 Take me back 
 And my funky ass band 
 All the way back 
 To the broherland 
 Take me back 
 I want to go 
 As fast as I can 
 Slidin' on back 
 To the brotherland 
 Now children 
 Hollywood... 
 I want to get up and go 
 With my funky ass jams 
 All the way back 
 To the broherland 
 Take me back 
 I want to go back 
 Hollywood... 
 Where the women 
 Is the women 
 And the man 
 Is the man 
 I want to go 
 As fast as I can 
 Slidin' on back 
 To the brotherland 
 Now children"
13,Red Hot Chili Peppers,rock,American Ghost Dance,"Oh give me a home 
 Where the buffalo roam 
 And the death of a race is a game 
 Where seldom is heard 
 A peacable word 
 From the white trash 
 Who killed as they came 
 Though these words dig deep 
 They offer no relief 
 God save the queen 
 I am an Indian chief 
 There is a secret I keep 
 It's called the talking leaf 
 And you better believe 
 That he speaks his beliefs 
 Like a rock that bleeds 
 A sea of grief 
 My talking leaf speaks of 
 A wounded knee creek 
 American ghost dance... 
 A new man who is with old ways 
 He walks the streets of life 
 But he's in chains 
 I'm alive he cried 
 I can feel the flame 
 Burning red inside 
 I am an Indian brave 
 There is a memory 
 That lives in my blood 
 Of the brand you laid 
 On all you touched 
 But the burning flame 
 Turns to burning pain 
 Genuine genocide 
 And that's truly insane 
 So like a wild hurricane 
 I will dance on the grave 
 Of my race that died 
 When it should have been saved 
 American ghost dance..."
14,Red Hot Chili Peppers,rock,If You Want Me To Stay,"If you want me to stay 
 I'll be around today 
 To be available for you to see 
 I'm about to go there 
 Then you'll know 
 For me to stay here 
 I've got to be me 
 You'll never be in doubt 
 That's what it's all about 
 You can't take me for granted and smile 
 Count the days I'm gone 
 Forget reachin' me by phone 
 'Cause I promise 
 I'll be gone for a while 
 And when you see me again 
 I hope that you have been 
 The kind of person 
 That you really are now 
 You got to get it straight 
 How could I ever be late 
 When you're my woman 
 Taking up my time 
 Oh how could I ever allow 
 I guess I wonder how 
 I could get out a pocket for fun 
 When you know that 
 You're never number two 
 Number one's gonna be number one 
 I'll be good 
 I wish I could 
 Get this message over to you now 
 When you see me again 
 I hope that you have been 
 The kind of person 
 That you really are now 
 I'll be so good 
 I wish I could 
 Get this message over to you now 
 Get this message over to you now 
 I'll be so good 
 I wish I could"
15,Red Hot Chili Peppers,rock,Nevermind,"Nevermind the Pac Jam 
 Nevermind the Gap Band 
 Nevermind the Zap Band 
 Nevermind the Funk Scam 
 'Cause we're 
 The Red Hot Chili Peppers 
 Nevermind the English bands 
 Nevermind the Synth Funk bands 
 Nevermind the Wham Wham band 
 Nevermind Duran Duran 
 'Cause we're 
 The Red Hot Chili Peppers 
 Nevermind the Soft Cell shit 
 That's strictly for the twits 
 Nevermind the Men At Work 
 Those tunes are for the jerks 
 'Cause we're 
 The Red Hot Chili Peppers 
 Nevermind Hall and Oates 
 Those guys are a couple of goats 
 Nevermind the Culture Club 
 That jive's just one big flub 
 'Cause we're 
 The Red Hot Chili Peppers"
16,Red Hot Chili Peppers,rock,Freaky Styley,"Say it loud 
 I'm freaky styley 
 And I'm proud! 
 [repeat many times]"
17,Red Hot Chili Peppers,rock,Blackeyed Blonde,"Pumping the blood through the heart of New Orleans 
 She's the mystic heat of the Bourbon street dream 
 She's just made out of flesh and bones 
 But let me tell you little boy, you better leave her alone 
 Leroy Brown thought he was bad too 
 Till she left him floating in the old bayou 
 She's the kind of girl, she's built like a bomb 
 She's the black-eyed, black-eyed, black-eyed blonde, get down 
 That black-eyed beauty with the golden crotch 
 French electric sex-a-cock shocking swamp fox 
 Heaten queen of sleaze, she's hot to box 
 But let me tell you little boy, she'll clean your clock 
 A slick and sly spy, stuck in the muck of the moat 
 Blew his mind to find a diamond in the boat 
 Double-o-dooms day for Mr James Bond 
 She's the black-eyed, black-eyed, black-eyed blonde, get down"
18,Red Hot Chili Peppers,rock,The Brothers Cup,"Give it up to this planet full of strife 
 We're the brothers cup cuttin' sharp as a knife 
 With the pop of a snap and the flip of a flap 
 The cups went up like a natural fact 
 It was our shoulder space 
 That made the perfect place 
 For the magic of the cup 
 To style out with grace 
 With a tight turn twist 
 And a slight swerve swank 
 The brothers cup kissed 
 With a kick ass clank 
 We are the brothers cup 
 We like to get it up 
 We are the brothers cup 
 We like to get it up 
 Give it up to this planet full of strife 
 We're the brothers cup cuttin' sharp as a knife 
 With the pop of a snap and the flip of a flap 
 The cups went up like a natural fact 
 So love all your brothers 
 And love all your sisters 
 Love all the misses 
 And love all the misters 
 Don't be shy when you're sharin' your kisses 
 The brothers cup kiss 
 And we ain't sissies 
 It is our notion that the perfect peace potion 
 Can be found in the wake of the green sea's motion 
 The long rocking swell of the mighty blue ocean 
 Is the cradle of peace it's the perfect peace motion 
 Give it up to this planet full of strife 
 We're the brothers cup cuttin' sharp as a knife 
 With the power of the cup we are about to astound 
 All your preconceptions they will come unbound 
 We are the brothers cup coming to your town 
 Bringing tubs of love we're going to spread it around"
19,Red Hot Chili Peppers,rock,Battle Ship,"Three miles off the coast of Beirut 
 New Jersey's guns get ready to shoot 
 Take a walk down the firing room 
 Fire one it's shakedown cruise 
 Battle ship, battle ship 
 See the sailor boys dressed in blue 
 Cheer the change to make the news 
 Send the shell down the spiral groove 
 Bombs away, it's a shakedown cruise, yeah 
 Battle ship, battle ship"
20,Red Hot Chili Peppers,rock,Lovin' And Touchin',"Loving and touching and 
 Laughing and Squeezing and 
 Walking and Joking and 
 Smiling and Teasing 
 Loving and kissing and 
 Rubbing and scrubbing and 
 Styling and slumming and 
 Rolling and cumming 
 I'll hold you a lifetime 
 I'll love you forever 
 I'll make you my wife and 
 I'll never forget you 
 I'll give you my smile 
 On the face of your child 
 I will give you my love 
 I will give you my love 
 Loving and touching and 
 Loving and touching and 
 Loving and touching and 
 Loving and touching and 
 Love"
