,0,1,2,3
102,Red Hot Chili Peppers,rock,Purple Stain,"To finger paint is not a sin 
 I put my middle finger in 
 Your monthly blood is what I win 
 I'm in your house now let me spin 
 Python power straight from Monty 
 Celluloid love got a John Frusciante 
 Spread your head and spread the blanket 
 She's too free I'm the patient 
 Black and white red and blue 
 Things that look good on you 
 And if I scream don't let me go 
 A purple stain - I know 
 Knock on wood we all stay good 
 'Cause we all live in Hollywood 
 With Dracula and Darla Hood 
 Unspoken words were understood 
 Up to my ass in alligators 
 Let's get it on with alligator haters 
 Did what you did - did what you said 
 What's the point yo what's the spread 
 Black and white red and blue 
 Things that look good on you 
 And if I scream don't let me go 
 A purple stain - I know 
 And if I call for you to stay 
 Come hit the funk on your way 
 It's the way out there but I don't care 
 'Cause this is where I go 
 Knock on wood we all stay good 
 'Cause we all live in Hollywood 
 With Dracula and Darla Hood 
 Unspoken words were understood 
 It's way out there 
 But I don't care 
 'Cause this is what 
 I want to wear 
 Knock on wood we all stay good 
 'Cause we all live in Hollywood 
 To finger paint is not a sin 
 I put my middle finger in 
 Your monthly blood is what I win 
 I'm in your house now let me spin 
 Feather light but you can't move this 
 Farley is and angel and I can prove this 
 Purple is the stain upon my pillow 
 Let's sleep weeping willow 
 Black and white red and blue 
 Things that look good on you 
 And if I scream don't let me go 
 A purple stain - I know 
 And if I call for you to stay 
 Come hit the funk on your way 
 It's way out there but I don't care 
 'Cause this is where - I go 
 Knock on wood we all stay good 
 'Cause we all live in Hollywood 
 With Dracula and Darla Hood 
 Unspoken words were understood 
 It's way out there 
 But I don't care 
 'Cause this is what 
 I want to wear 
 Knock on wood we all stay good 
 'Cause we all live in Hollywood"
103,Red Hot Chili Peppers,rock,Right On Time,"One shot all I need 
 I've got rhythm when I bleed 
 'Til death do us part 
 Break my heart so I can start 
 Supercalifragilistic 
 Kiss me in the futuristic 
 Twisted but I must insist 
 It's time to get on top of this 
 (It's right on time, it's right on time) 
 It's right on time, it's right on time, it's right on time, it's right on time 
 (It's right on time, it's right on time) 
 Looking fine, you're looking fine and get on 1999 
 Discard to bombard 
 Calling all you shooting stars 
 Holy cow, bow-wow-wow 
 Now I'm here, I'm nowhere now 
 Joan of Arc, reincarnated 
 Maybe we could be related 
 So much blood to circulate 
 And so much space to decorate 
 (It's right on time, it's right on time) 
 It's right on time, it's right on time, it's right on time, it's right on time 
 (It's right on time, it's right on time) 
 Looking fine, you're looking fine and get on 1999 
 (It's right on time, it's right on time) 
 (It's right on time, it's right on time) 
 Plain and simple pain 
 I want to but I can't complain 
 Death row, let us go 
 It's time to blow up for the show 
 All the world, reverberated 
 Coming through, we motorcaded 
 Vibrate when we operated 
 Turning up in solid-stated 
 Oh Lord"
104,Red Hot Chili Peppers,rock,Road Trippin',"Road trippin' with my two favorite allies 
 Fully loaded, we got snacks and supplies 
 It's time to leave this town, it's time to steal away 
 Let's go get lost, anywhere in the U.S.A 
 Let's go get lost, let's go get lost 
 Blue, you sit so pretty, west of the one 
 Sparkle light with yellow icing, just a mirror for the sun 
 Just a mirror for the sun 
 Just a mirror for the sun 
 These smiling eyes are just a mirror for 
 So much has come before those battles, lost and won 
 This life is shining more, forever in the sun 
 Now, let us check our heads and let us check the surf 
 Staying high and dry's more trouble than its worth in the sun 
 Just a mirror for the sun 
 Just a mirror for the sun 
 These smiling eyes are just a mirror for 
 In Big Sur, we take some time to linger on 
 We three hunky dorys got our snakefinger on 
 Now let us drink the stars, it's time to steal away 
 Let's go get lost, right here in the U.S.A 
 Let's go get lost, let's go get lost 
 Blue, you sit so pretty, west of the one 
 Sparkles light with yellow icing, just a mirror for the sun 
 Just a mirror for the sun 
 Just a mirror for the sun 
 These smiling eyes are just a mirror for 
 These smiling eyes are just a mirror for 
 Your smiling eyes are just a mirror for"
105,Red Hot Chili Peppers,rock,Quixoticelixer,"Kick back a little just to watch and see 
 Getting sicker by the minute with debauchery 
 Whatever your pleasure I'm your punk 
 On the brink of sinking baby but not yet sunk 
 How I listened, lo when you told me 
 That I was all you had to hold 
 How I wish it was so when you told me 
 That you were solid gold 
 Gravity free, is she, look at her 
 Highness on a mattress full of anti-matter 
 You never left a very mellow impression 
 Your smell or your go-to-hell expression 
 Quixoticelixer might 
 But it probably will not fix your bite 
 Tell me now, tell me how did I get 
 Your lipstick on my kite 
 I love this weather it's a perfect storm 
 Just keep it coming in its perfect form 
 I love this weather 'cause it keep me warm 
 Just keep it coming in its perfect form 
 Everyday depression in a beautiful dress 
 Oh, lady made a beautiful mess I guess 
 Dedicated mind in a medicated state 
 Is a highly overrated fate 
 Terrible, is it so what you told me 
 That there is such a thing 
 Do you know that you glow when you go 
 From winter into spring? 
 I love this weather it's a perfect storm 
 Just keep it coming in its perfect form 
 I love this weather 'cause it keep me warm 
 Just keep it coming in its perfect form 
 The madder the boy, the sadder the song 
 That's a wicked fate but the sick get strong 
 Mad boy, sad song 
 Wicked fate but the sick get strong 
 Nobody's right and everyone's wrong 
 I refuse to punt on fourth and long 
 Mad boy, sad song 
 Wicked fate but the sick get 
 Kick back a little just to watch and see 
 Getting sicker by the minute with debauchery 
 Whatever your pleasure I'm your punk 
 On the brink of sinking baby but not yet sunk 
 How I listened low when you told me 
 That I was all you had to hold 
 I wish it was so when you told me 
 That you were solid gold 
 I swear to God I could not hurt you 
 I've got to be inside your virtue 
 I can't contain my urge to search you 
 I stand before this night, no curfew 
 I long to be inside your virtue 
 My heart is swollen when I search you 
 I swear to God I could not hurt you 
 My heart is swollen when I search you 
 I swear to God I could not hurt you 
 I swear to God I could not hurt you 
 I've got to be inside your virtue 
 I can't contain my urge to search you 
 Woo woo, woo woo, woo woo, oh 
 Woo woo, woo woo, woo woo, oh 
 Woo woo, woo woo, woo woo, oh"
106,Red Hot Chili Peppers,rock,Over Funk,"Please start dirty 
 It's 7:30 
 Loss of mind and 
 Cat alertly 
 My best, your rest 
 Send your call 
 And then I nest 
 Perversity in features 
 Adversity that teaches 
 Some call love more 
 Soon I'll call the rhythm song 
 It's over 
 It's over now 
 So long to doo-doo-ra 
 It's over 
 It's over now 
 I dare not get a look 
 Be yourself 
 Some let her call 
 Never fall 
 See yourself 
 Sit alone and wait 
 To my own call 
 Go ballistic 
 Anarchistic 
 Smack my mouth and 
 Then you kissed it 
 So long, my gun 
 Simple run and 
 Letter bum 
 Things are looking good on paper 
 Once when I was in your favor 
 This kiss from a mess 
 Send my girl riddle less 
 It's over 
 It's over now 
 So long to riddle songs 
 It's over 
 It's over now 
 I dare not read a song 
 See yourself 
 Sad, alone and wait 
 To my own brawl 
 Free yourself 
 There's an only count 
 This stands for all of them 
 Just play at any tempo 
 Going mad and going mental 
 All balm, said no 
 Just to let him put it wrong 
 It's over 
 It's over now 
 It's time to get along 
 It's over 
 It's over now 
 It's over 
 It's over now"
107,Red Hot Chili Peppers,rock,Fat Dance,"Do a phfat dance 
 Do a phfat dance 
 Do a do a do a phfat dance 
 Do a phfat dance 
 Do a phfat dance 
 Do a do a do a phfat dance 
 Do a phfat dance 
 Do a phfat dance 
 Do a do a do a phfat dance 
 Do a phfat dance 
 Do a phfat dance 
 Do a do a do a phfat dance 
 One reason why I got you for 
 A-woman is that you can do the moveable 
 Kitchen or bedroom or bathroom floor 
 Keep it moving 'cause I need the hardcore 
 Do a phfat dance 
 Do a phfat dance 
 Do a do a do a phfat dance 
 Do a phfat dance 
 Do a phfat dance 
 Do a do a do a phfat dance 
 Soft, she's off and left, now I'm a-coming 
 I'm feeling in the ghetto 'cause that's my trouble 
 Do a phfat dance 
 Do a phfat dance 
 Do a do a do a phfat dance 
 Do a phfat dance 
 Do a phfat dance 
 Do a do a do a phfat dance 
 Do a phfat dance 
 Do a phfat dance 
 Do a do a do a phfat dance 
 Do a phfat dance 
 Do a phfat dance 
 Do a do a do a phfat dance 
 Another reason why I love your ass 
 You're dancing like everyday could be your last 
 Do ya do ya do ya wanna dance 
 Let's get it on like black trash 
 Do a phfat dance 
 Do a phfat dance 
 Do a do a do a phfat dance 
 Do a phfat dance 
 Do a phfat dance 
 Do a do a do a phfat dance 
 Soft, she's off and left, now I'm a-coming 
 I'm feeling in the ghetto 'cause that's my trouble 
 I met her on the school yard and 
 She was such a cool card 
 She took me for a fool 
 Because I acted like a bodyguard 
 Oh Yohanna love, my Yohanna love 
 She was just the cutest thing 
 My god that I have ever seen 
 Tearin' up my seratonin 
 Messing with my dopamine 
 Oh Yohanna love, my Yohanna love 
 Just about the time 
 That I was feeling fine again 
 She walked into the room 
 Wearing nothing but a cardigan 
 Oh Yohanna love, my Yohanna love 
 She knew what she was doin' 
 When she told me no she would 
 Never let the perfect message 
 In and get the perfect screwin' 
 Oh Yohanna love oh oh 
 Do a phfat dance 
 Do a phfat dance 
 Do a do a do a phfat dance 
 Do a phfat dance 
 Do a phfat dance 
 Do a do a do a phfat dance 
 Number three reasons why I'm in your house 
 Hot butter melts across your mouth 
 Dancing and a-dancing, and a dancing machine 
 Somebody move, somebody scream 
 Yeah 
 One reason why I got you floored 
 A-woman is that you can do the move amore 
 Kitchen or bedroom or bathroom floor 
 Keep it moving 'cause I need the hardcore 
 I need the hardcore 
 I need the hardcore 
 I need the hardcore 
 Hardcore"
108,Red Hot Chili Peppers,rock,Gong Li,"Some people say you hate me 
 I don't believe it's true 
 Things that you're going through 
 Some people say you hate me 
 I don't believe it's you 
 Things that you're going through 
 Some people say to pray for 
 The one you want to live 
 The eyes that once were his 
 Some people say to pray for 
 The way you want to live 
 The eyes you want to give 
 Some people say you played me 
 I don't care if it's true 
 I'm waiting here for you 
 Some people say you made it 
 I'm not afraid to know 
 When things are getting low 
 Some people say you hate me 
 I don't believe it's true 
 Things that you're going through 
 Some people say you hate me 
 I don't believe it's you 
 Things that you're going through"
109,Red Hot Chili Peppers,rock,How Strong,"How strong is my love? Oh 
 How strong is my love? Oh 
 How strong is my love? Oh 
 How wrong could it be? 
 I'll walk a water mile 
 Rest a while to kiss your smile 
 Laugh and roll and after a while 
 I'll begin to like your style 
 How strong is my love? Oh 
 How wrong could it be? 
 She turned me down this time she 
 (She turned me down) 
 Lord, I can't believe she 
 (She turned me down) 
 She turned me inside out 
 (She turned me down) 
 All I ask of you 
 Is turn me up this time 
 How strong is my love? Oh 
 How strong is my love? Oh 
 How strong is my love? Oh 
 How wrong could it be? 
 Come on over, show me your 
 Your glow soul I do adore 
 I'll be sure to drop my guard 
 Give it up, it's not that hard 
 How strong is my love? Oh 
 How wrong could it be? 
 She turned me down this time she 
 (She turned me down) 
 Lord, I can't believe she 
 (She turned me down) 
 She turned me inside out she 
 (She turned me down) 
 All I ask of you 
 Is turn me up this time 
 How strong is my love? Oh 
 How strong is my love? Oh 
 How strong is my love? Oh 
 How wrong could it be? 
 Tested life but that's all right 
 Darker than the darkest night 
 Living hell and pollocks at you 
 Getting new down your back 
 How strong is my love? Oh 
 How wrong could it be?"
110,Red Hot Chili Peppers,rock,By The Way,"Standing in line 
 To see the show tonight 
 And there's a light on 
 Heavy glow 
 By the way I tried to say 
 I'd be there, waiting for 
 Dani the girl 
 Is singing songs to me 
 Beneath the marquee, overload 
 Steak knife card shark 
 Con job boot cut 
 Skin that flick 
 She's such a little DJ 
 Get there quick 
 By street but not the freeway 
 Turn that trick 
 To make a little leeway 
 Beat that nic 
 But not the way that we play 
 Dog town blood bath 
 Rib cage soft tail 
 Standing in line 
 To see the show tonight 
 And there's a light on 
 Heavy glow 
 By the way I tried to say 
 I'd be there, waiting for 
 Black jack dope dick 
 Pawn shop quick pick 
 Kiss that dyke 
 I know you want to hold one 
 Not on strike 
 But I'm about to bowl one 
 Bite that mic 
 I know you never stole one 
 Girls that like 
 A story, so I told one 
 Song bird, main line 
 Cash back, hard top 
 Standing in line to 
 See the show tonight 
 And there's a light on 
 Heavy glow 
 By the way I tried to say 
 I'd be there waiting for 
 Dani the girl is 
 Singing songs to me 
 Beneath the marquee 
 Oversold 
 By the way I tried to say 
 I'd be there waiting for 
 Ooh, ah, guess you never meant it 
 Ooh, ah, guess you never meant it 
 Ooh, ah, guess you never meant it 
 Ooh, ah, guess you never meant it 
 Ooh, ah, guess you never meant it 
 Ooh, ah, guess you never meant it 
 Ooh, ah, guess you never meant it 
 Ooh, ah 
 Standing in line to 
 See the show tonight 
 And there's a light on 
 Heavy glow 
 By the way I tried to say 
 I'd be there waiting for 
 Dani the girl 
 Is singing songs to me 
 Beneath the marquee 
 Of her soul 
 By the way I tried to say 
 I know you 
 From before 
 Standing in line to 
 See the show tonight 
 And there's a light on 
 Heavy glow 
 By the way I tried to say 
 I'd be there waiting for"
111,Red Hot Chili Peppers,rock,Universally Speaking,"I saw your face 
 Elegant and tired 
 Cut up from the chase 
 Still, I so admired 
 Bloodshot, your smile 
 Delicate and wild 
 Give me she-wolf style 
 Rip right through me 
 Silveretta, the jets of a lifetime 
 Go and get her, I've got her on my mind 
 Nothing better, the feeling is so fine 
 Simply put, I saw your love stream flow 
 Come on baby, 'cause there's no name for 
 Give it up and I got what I came for 
 Universally speaking 
 I take it back and you make me nervous 
 Nothing better than love and service 
 Universally speaking 
 I win in the long run 
 I saw your crime 
 Dying to get high 
 Two of a kind 
 Beats all hands tonight 
 Silvretta, the jets of a lifetime 
 Go and get her, I've got her on my mind 
 Nothing better the feeling is so fine 
 Simply put, I saw your love stream flow 
 Come on baby, 'cause there's no name for 
 Give it up and I got what I came for 
 Universally speaking 
 I take it back and you make me nervous 
 Nothing better than love and service 
 Universally speaking 
 I win in the long run 
 Silvretta, the jets of a lifetime 
 Go and get her, I've got her on my mind 
 Nothing better, the feeling is so fine 
 Simply put, I saw your love stream flow 
 Simply put, I saw your love stream flow 
 Let's go"
112,Red Hot Chili Peppers,rock,This Is The Place,"This is the place where all the junkies go 
 When time gets fast but everything gets slow 
 Can I get some vaseline? 
 Step into a modern scene 
 Take a chance on that which seems to be the making of a dream 
 I don't wanna do it like my daddy did 
 I don't wanna give it to my baby's kid 
 This is my calling 
 I said my darling 
 Shocking appalling 
 All I can do to you 
 Hammers are falling 
 I said my darling 
 Shocking appalling 
 All I can do to you 
 This is the place where all the devils plead 
 Their case to take from you what they need 
 Can I isolate your gene? 
 Can I kiss your dopamine? 
 In a way I wonder if she's living in a magazine 
 I don't wanna say it if it isn't so 
 I don't wanna weigh it but I've gotta know 
 This is my calling 
 I said my darling 
 Shocking appalling 
 All I can do to you 
 Hammers are falling 
 I said my darling 
 Shocking appalling 
 All I can do to you 
 I saw you out there yesterday 
 What did you want to say 
 A perfect piece of DNA 
 Caught in a flashing ray 
 I caught you out there in the fray 
 What did you want to say 
 A masterpiece of DNA 
 Caught in a flashing ray 
 Can I smell your gasoline? 
 Can I pet your wolverine? 
 On the day my best friend died I could not get my carpet clean 
 I don't wanna take it up with little Joe 
 I don't wanna fake it but I've gotta know 
 This is my calling 
 I said my darling 
 Shocking appalling 
 All I can do to you 
 Hammers are falling 
 I said my darling 
 Shocking appalling 
 All I can do to you 
 I am a misfit 
 I'm born with all of it 
 The fucking ultimate of love inside the atom split 
 I'm in a flash ray 
 A mash of DNA 
 Another poppin' Jay who thinks he's got something to say"
113,Red Hot Chili Peppers,rock,Dosed,"I got dosed by you (and) 
 Closer than most to you (and) 
 What am I s'posed to do 
 Take it away I never had it anyway 
 Take it away and everything will be okay 
 In you a star is born (and) 
 You cut a perfect form (and) 
 Someone forever warm 
 Lay on Lay on Lay on Lay on 
 Lay on Lay on Lay on Lay on 
 Way up on the mountain where she died 
 All I ever wanted was your life 
 Deep inside the canyon I can't hide 
 All I ever wanted was your life 
 Show love with no remorse (and) 
 Climb onto your sea horse (and) 
 This ride is right on course 
 This is the way I wanted it to be with you 
 This is the way I knew that it would be with you 
 Lay on Lay on Lay on Lay on 
 Lay on Lay on Lay on Lay on 
 Way up on the mountain where she died 
 All I ever wanted was your life 
 Deep inside the canyon I can't hide 
 All I ever wanted was your life 
 I got dosed by you (and) 
 Closer than most to you (and) 
 What am I s'posed to do 
 Take it away I never had it anyway 
 Take it away and everything will be ok 
 Way up on the mountain where she died 
 All I ever wanted was your life 
 Deep inside the canyon I can't hide 
 All I ever wanted was your life"
114,Red Hot Chili Peppers,rock,Don't Forget Me,"I'm an ocean 
 In your bedroom 
 Make you feel warm, make you want to re-assume 
 Now we know it all for sure 
 I'm a dance hall 
 Dirty breakbeat 
 Make the snow fall up from underneath your feet 
 Not alone, I'll be there 
 Tell me when you want to go 
 I'm a meth lab 
 First rehab 
 Take it all off and step inside the running cab 
 There's a love that knows the way 
 I'm the rainbow 
 In your jail cell 
 All the memories of everything you've ever smelled 
 Not alone 
 I'll be there, tell me when you wanna go 
 So (sideways falling) 
 (More will be revealed my friend) 
 (Sideways falling) Don't forget me, I can't hide it 
 (More will be revealed my friend) Come again, get me excited 
 I'm an inbred 
 And a pothead 
 Two legs that you spread inside the tool shed 
 Now we know it all for sure 
 I could show you 
 To the free field 
 Overcome and more will always be revealed 
 Not alone 
 I'll be there, tell me when you wanna go 
 So (sideways falling) 
 (More will be revealed my friend) 
 (Sideways falling) Don't forget me, I can't hide it 
 (More will be revealed my friend) Come again, get me excited 
 So (sideways falling) 
 (More will be revealed, my friend) 
 (Sideways falling) Don't forget me, I can't hide it 
 (More will be revealed, my friend) 
 There's a match, now let me light it 
 I'm the bloodstain 
 On your shirt sleeve 
 Coming down and more are coming to believe 
 Now we know it all for sure 
 Make the hair stand 
 Up on your arm 
 Teach you how to dance inside the funny farm 
 Not alone 
 I'll be there, tell me when you wanna go 
 I'll be there, tell me when you wanna go 
 Come again and tell me when you wanna go 
 More will be revealed my friend"
115,Red Hot Chili Peppers,rock,The Zephyr Song,"Can I get your hand to write on? 
 Just a piece of leg to bite on 
 What a night to fly my kite on 
 Do you want to flash your light on? 
 Take a look it's on display for you 
 Coming down? No, not today 
 Did you meet your fortune teller? 
 Get it off with no propeller 
 Do it up, it's on with Stella 
 What a way to finally smell her 
 Picking up but not too strong for you 
 Take a piece and pass it on 
 Fly away on my Zephyr 
 I feel it more than ever 
 And in this perfect weather 
 We'll find a place together 
 Fly on my wind 
 Rebel and a liberator 
 Find a way to be a skater 
 Rev it up to levitate her 
 Super-friendly aviator 
 Take a look it's on display for you 
 Coming down? No, not today 
 Fly away on my Zephyr 
 I feel it more than ever 
 And in this perfect weather 
 We'll find a place together 
 In the water where I center my emotion 
 All the world can pass me by 
 Fly away on my Zephyr 
 We'll find a place together 
 Whoa, whoa, whoa, whoa, whoa, whoa 
 Do you? 
 Yeah, yeah, yeah, yeah, yeah, yeah 
 Whoa, whoa, whoa, whoa, whoa, whoa 
 Won't you? 
 Yeah, yeah, yeah, yeah, yeah, yeah 
 Fly away on my Zephyr 
 I feel it more than ever 
 And in this perfect weather 
 We'll find a place together 
 In the water where I center my emotion 
 All the world can pass me by 
 Fly away on my Zephyr 
 We're gonna live forever 
 Forever"
116,Red Hot Chili Peppers,rock,Can't Stop,"Can't stop, addicted to the shindig 
 Chop top, he says I'm gonna win big 
 Choose not a life of imitation 
 Distant cousin to the reservation 
 Defunkt, the pistol that you pay for 
 This punk, the feeling that you stay for 
 In time, I want to be your best friend 
 Eastside love is living on the West End 
 Knocked out but boy you better come to 
 Don't die, you know, the truth is, some do 
 Go write your message on the pavement 
 Burn so bright, I wonder what the wave meant 
 White heat is screaming in the jungle 
 Complete the motion if you stumble 
 Go ask the dust for any answers 
 Come back strong with fifty belly dancers 
 The world I love, the tears I've dropped 
 To be part of the wave, can't stop 
 Ever wonder if it's all for you? 
 The world I love, the trains I hop 
 To be part of the wave, can't stop 
 Come and tell me when it's time to 
 Sweetheart is bleeding in the snow cone 
 So smart, she's leading me to ozone 
 Music, the great communicator 
 Use two sticks to make it in the nature 
 I'll get you into penetration 
 The gender of a generation 
 The birth of every other nation 
 Worth your weight, the gold of meditation 
 This chapter's going to be a close one 
 Smoke rings, I know you're going to blow one 
 All on a spaceship, persevering 
 Use my hands for everything but steering 
 Can't stop the spirits when they need you 
 Moptops are happy when they feed you 
 J. Butterfly is in the treetop 
 Birds that blow the meaning into bebop 
 The world I love, the tears I've dropped 
 To be part of the wave can't stop 
 Ever wonder if it's all for you? 
 The world I love, the trains I hop 
 To be part of the wave can't stop 
 Come and tell me when it's time to 
 Wait a minute, I'm passing out, win or lose 
 Just like you 
 Far more shocking than anything I ever knew 
 How about you? 
 Ten more reasons why I need somebody new 
 Just like you 
 Far more shocking than anything I ever knew 
 Right on cue 
 Can't stop, addicted to the shindig 
 Chop top, he says I'm gonna win big 
 Choose not, a life of imitation 
 Distant cousin to the reservation 
 Defunct, the pistol that you pay for 
 This punk, the feeling that you stay for 
 In time I want to be your best friend 
 Eastside love is living on the West End 
 Knocked out but boy you better come to 
 Don't die, you know, the truth is, some do 
 Go write your message on the pavement 
 Burn so bright, I wonder what the wave meant 
 Kick start the golden generator 
 Sweet talk but don't intimidate her 
 Can't stop the gods from engineering 
 Feel no need for any interfering 
 Your image in the dictionary 
 This life is more than ordinary 
 Can I get two, maybe even three, of these? 
 Coming from space to teach you of the Pleiades 
 Can't stop the spirits when they need you 
 This life is more than just a read through"
