,0,1,2,3
53,Red Hot Chili Peppers,rock,Castles Made Of Sand,"Down the street you can hear her scream, ""You're a disgrace"" 
 As she slams the door in his drunken face 
 And now he stands outside 
 And all the neighbours start to gossip and drool 
 He cries, ""Oh girl, you must be mad 
 What happened to the sweet love you and me had?"" 
 Against the door he leans and starts a scene 
 And his tears fall and burn the garden green 
 And so castles made of sand 
 Fall in the sea eventually 
 There's a little Indian brave who before he was ten 
 Played war games in the woods with his Indian friends 
 And he built a dream that when he grew up 
 He would be a fearless warrior Indian chief 
 Many moons passed and the dream grew strong until tomorrow 
 He would sing his first war song 
 And fight his first battle but something went wrong 
 Surprise attack killed him in his sleep that night 
 And so castles made of sand 
 Melts into the sea eventually 
 There was a young girl whose heart was a frown 
 Because she was crippled for life and couldn't speak a sound 
 And she wished and prayed she would stop living 
 So she decided to die 
 She drew her wheelchair to the edge of the shore 
 And to her legs she smiled, ""You won't hurt me no more"" 
 But then a sight she'd never seen made her jump and say 
 ""Look, a golden winged ship is passing my way"" 
 And it really didn't have to stop 
 It just kept on going 
 And so castles made of sand 
 Slips into the sea eventually"
54,Red Hot Chili Peppers,rock,Crosstown Traffic,"You jump in front of my car when you 
 You know all the time that 
 Ninety miles an hour, girl, is the speed I drive 
 You tell me it's all right, you don't mind a little pain 
 You say you just want me to take you for a ride 
 You're just like crosstown traffic 
 So hard to get through to you 
 Crosstown traffic 
 I don't need to run over you 
 Crosstown traffic 
 All you do is slow me down 
 And I'm tryin' to get on the other side of town 
 I'm not the only soul who's accused of hit and run 
 Tire tracks all across your back 
 I can see you had your fun 
 But darlin', can't you see my signals turn from green to red 
 And with you I can see a traffic jam straight up ahead 
 You're just like crosstown traffic 
 So hard to get through to you 
 Crosstown traffic 
 I don't need to run over you 
 Crosstown traffic 
 All you do is slow me down 
 And I got better things on the other side of town"
55,Red Hot Chili Peppers,rock,The Power Of Equality,"Swing! 
 I've got a soul that cannot sleep 
 At night when something just ain't right, yo 
 Blood red but without sight 
 Exploding egos in the night 
 Mix like sticks of dynamite 
 Red, black or white, this is my fight 
 Come on, courage, let's be heard 
 Turn feelings into words 
 American equality has always been sour 
 An attitude I would like to devour 
 My name is peace, this is my hour 
 Can I get just a little bit of power? 
 The power of equality 
 Is not yet what it ought to be 
 (ought to be) 
 It fills me up like a hollow tree 
 (hollow tree) 
 The power of equality 
 Right or wrong, my song is strong 
 You don't like it, get along 
 Say what I want, do what I can 
 Death to the message of the Ku Klux Klan 
 I don't buy supremacy 
 A media chief, you menace me 
 The people, you say, cause all the crime 
 Wake up, motherfucker, and smell the slime 
 Blackest anger, whitest fear 
 Can you hear me? Am I clear? 
 My name is peace, this is my hour 
 Can I get just a little bit of power? 
 The power of equality 
 Is not yet what it ought to be 
 (ought to be) 
 It fills me up like a hollow tree 
 (hollow tree) 
 The power of equality 
 I've got tapes, I've got CDs 
 I've got my 
 Public Enemy 
 My lily-white ass is tickled pink 
 When I listen to the music that makes me think 
 Not another motherfucking politician 
 Doing nothing but something for his own ambition 
 Never touch the sound we make 
 Soul-sacred love, vows that we take 
 To create straight what is true 
 Yo, he's with me and what I do 
 My name is peace, this is my hour 
 Can I get just a little bit of power? 
 The power of equality 
 Is not yet what it ought to be 
 (ought to be) 
 It fills me up like a hollow tree 
 (hollow tree) 
 The power of equality 
 Madder than a motherfucker, lick my finger 
 Can't forget 'cause the memory lingers 
 Count 'em off quick, little piccadilly sickness 
 Take me to the hick, oh, eat my thickness 
 I've got a welt from the Bible belt 
 Dealing with the hand that I've been dealt 
 Sitting in the grip of a killing fist 
 Giving up blood just to exist 
 Rub me wrong and I get pissed 
 No, I cannot get to this 
 People in pain, I do not dig it 
 Change of brain for Mr. Bigot 
 Little brother, do you hear me? 
 Have a heart, oh, come get near me 
 Misery is not my friend 
 But I'll break before I bend 
 What I see is insanity 
 Whatever happened to humanity? 
 Whatever happened to humanity? 
 Whatever happened to humanity?"
56,Red Hot Chili Peppers,rock,If You Have To Ask,"A wannabe gangster, thinking he's a wise guy 
 Rob another bank, he's a sock-'em-in-the-eye guy 
 Tank head, Mr. Bonnie and Clyde guy 
 Look him in the eye, he's not my kinda guy 
 Never wanna be confusion proof 
 Pudding's sweet but too aloof 
 Orange-eye girl with a backslide dew said 
 ""Yo homie, who you talking to?"" 
 A backed up paddywagon, mackin' on a cat's ass 
 One uppercut to the cold, upper middle class 
 Born to storm on boredom's face 
 And a little lust to the funky-ass Flea bass 
 Most in the race just lose their grace 
 The blackest hole in all of space 
 Crooked as a hooker, now suck my thumb 
 Anybody wanna come get some? 
 If you have to ask, you'll never know 
 Funky motherfuckers will not be told to go 
 If you have to ask, you'll never know 
 Funky motherfuckers will not be told to go (oh woh woh) 
 Don't ask me why I'm flying so high 
 Mr. Bubble meets Superfly in my third eye 
 Searching for a soul bride, she's my freakette 
 Soak it up inside, deeper than a secret 
 Much more than meets the eye 
 To the funk, I fall into my new ride 
 My hand, my hand 
 Magic on the one is a medicine man 
 Thinking of a few taboos that I ought to kill 
 Dancing on their face like a stage in vaudeville 
 I feel so good, can't be understood 
 Booty of a hoodlum, rocking my red hood 
 If you have to ask, you'll never know 
 Funky motherfuckers will not be told to go 
 If you have to ask, you'll never know 
 Funky motherfuckers will not be told to go (oh woh woh)"
57,Red Hot Chili Peppers,rock,Breaking The Girl,"I am a man cut from the know 
 Rarely do friends come and then go 
 She was a girl, soft but estranged 
 We were the two, our lives rearranged 
 Feeling so good that day 
 A feeling of love that day 
 Twisting and turning, your feelings are burning 
 You're breaking the girl 
 She meant you no harm 
 Think you're so clever but now you must sever 
 You're breaking the girl 
 He loves no one else 
 Raised by my dad, girl of the day 
 He was my man, that was the way 
 She was the girl left alone 
 Feeling the need to make me her home 
 I don't know what, when or why 
 The twilight of love had arrived 
 Twisting and turning, your feelings are burning 
 You're breaking the girl 
 She meant you no harm 
 Think you're so clever but now you must sever 
 You're breaking the girl 
 He loves no one else 
 Twisting and turning, your feelings are burning 
 You're breaking the girl 
 She meant you no harm 
 Think you're so clever but now you must sever 
 You're breaking the girl 
 He loves no one else"
58,Red Hot Chili Peppers,rock,Funky Monks,"There are no monks in my band (There are no monks in my band) 
 There are no saints in this land (There are no saints in this land) 
 I'll be doing all I can, yeah-yeah 
 If I die an honest man (If I die an honest man) 
 Confusion is my middle name (Confusion is my middle name) 
 Ask me again, I'll tell you the same (Ask me again I'll tell you the same) 
 Persuaded by one sexy dame, yeah-yeah 
 No, I do not feel no shame 
 You are all alone 
 Can I get a little loving from you? 
 Can I get a little bit of that done did do? 
 You are on the road 
 Tell me now, girl, that you need me too, oh 
 Tell me now, girl, 'cause I've got a feeling for you 
 Every man has certain needs (Every man has certain needs) 
 Talking 'bout them dirty deeds (Talking 'bout them dirty deeds) 
 To these needs I must concede, yeah-yeah 
 Living by my lowly creed (Living by my lowly creed) 
 Woman, please know that I'm good (Woman, please know that I'm good) 
 Know that I did all I could (Know that I did all I could) 
 But yes, it's truly likelihood, yeah-yeah 
 Of being great is not so good 
 You are all alone 
 Can I get a little loving from you? 
 Can I get a little bit of that done did do? 
 You are on the road 
 Tell me now, girl, that you need me too, oh 
 Tell me now, girl, 'cause I've got a feeling for you 
 There are no monks in my band (There are no monks in my band) 
 There are no saints in this land (There are no saints in this land) 
 I'll be doing all I can, yeah-yeah 
 If I die an honest man (If I die an honest man) 
 Virtue slipped into my shoe (Virtue slipped into my shoe) 
 No, I will not misconstrue (No, I will not misconstrue) 
 More rocking, more rocking now doobley-doo, yeah-yeah 
 Dancing down your avenue 
 You are all alone 
 Can I get a little loving from you? 
 Can I get a little bit of that done did do? 
 You are on the road 
 Tell me now, girl, that you need me too, oh 
 Tell me now, girl, 'cause I've got a feeling for you"
59,Red Hot Chili Peppers,rock,Suck My Kiss,"Well, I'm sailing 
 Yeah, oh yeah 
 Yeah, oh yeah 
 Hit me 
 Should'a been, could'a been, would'a been dead 
 If I didn't get the message going to my head 
 I am what I am 
 Most motherfuckers don't give a damn 
 Oh baby, think you can? 
 Be my girl, I'll be your man 
 Someone full of fun, do me till I'm well done 
 Little Bo-Peep, coming from my stun gun 
 Beware, take care 
 Most motherfuckers have a cold-ass stare 
 Oh baby, please be there 
 Suck my kiss, cut me my share 
 Hit me, you can't hurt me, suck my kiss 
 Kiss me, please pervert me, stick with this 
 Is she talking dirty? 
 Give to me, sweet, sacred bliss 
 Your mouth was made to suck my kiss 
 Look at me, can't you see? All I really want to be 
 Is free from a world that hurts me 
 I need relief 
 Do you want me, girl, to be your thief? 
 Oh baby, just for you 
 I'd steal anything that you want me to 
 K-I-S-S-I-N-G 
 Chicka-chicka dee and do me like a banshee 
 Lowbrow is how 
 Swimming in the sound of Bow Wow Wow 
 Oh baby, do me now 
 Do me here, I do allow 
 Hit me, you can't hurt me, suck my kiss 
 Kiss me, please pervert me, stick with this 
 Is she gonna curtsy? 
 Give to me, sweet sacred bliss 
 That mouth was made to... 
 Should'a been, could'a been, would'a been dead 
 If I didn't get the message going to my head 
 I am what I am 
 Most motherfuckers don't give a damn 
 Oh baby, think you can? 
 Be my girl, I'll be your man 
 Someone full of fun, do me till I'm well done 
 Little Bo-Peep, coming from my stun gun 
 Beware, take care 
 Most motherfuckers have a cold-ass stare 
 Oh baby, please be there 
 Suck my kiss, cut me my share 
 Hit me, you can't hurt me, suck my kiss 
 Kiss me, please pervert me, stick with this 
 Is she talking dirty? 
 Give to me, sweet, sacred bliss 
 Your mouth was made to suck my kiss"
60,Red Hot Chili Peppers,rock,I Could Have Lied,"There must be something in the way I feel 
 That she don't want me to feel 
 The stare she bears cut me 
 I don't care, you see, so what if I bleed 
 I could never change just what I feel 
 My face will never show what is not real 
 A mountain never seems to have the need to speak 
 A look that shares, so many seek 
 The sweetest feeling I got from you 
 The things I said to you were true 
 I could never change just what I feel 
 My face will never show what is not real 
 I could have lied, I'm such a fool 
 My eyes could never, never, never keep their cool 
 Showed her and I told her how 
 She struck me but I'm fucked up now 
 But now she's gone, yes, she's gone away 
 A soulful song that would not stay 
 You see, she hides 'cause she is scared 
 But I don't care, I won't be spared 
 I could have lied, I'm such a fool 
 My eyes could never, never, never keep their cool 
 Showed her and I told her how 
 She struck me but I'm fucked up now 
 I could have lied, I'm such a fool 
 My eyes could never, never, never keep their cool 
 I showed her and I told her how 
 She struck me but I'm fucked up now 
 Fucked up now"
61,Red Hot Chili Peppers,rock,Mellowship Slinky In B-Major,"I've got a mellowship, I've got a fellowship 
 I've got a nonstop ""Yo swan"" hello chip 
 Born to adore the big bad bison 
 Thunderstorm and a man like Tyson 
 Popcorn, peanuts, looking at big butts 
 No, I cannot keep my mouth shut 
 Rocking to the beat of the fabulous Forum 
 My Lakers, I adore 'em 
 Blush, my lady, when I tell her 
 That I do indeed love to smell her 
 Sopping wet, your pink umbrella 
 Do the dog with Isabella 
 I'm so in love, yes, with an artist 
 Imagination, he's the smartest 
 Robert Williams, stroke and splatter 
 I attest to your gray matter 
 Living kings, how true it rings 
 These are just a few of my favorite things 
 Good God, where's my sleigh now 
 Good God, playing for days now 
 Good God, well, any day now 
 Good God, take me away now 
 Good God, the purple haze now 
 Good God, the baddest of brains now 
 Good God, well, any day now 
 Good God, riding my sleigh now 
 Being that I'm the duke of my domain 
 My hat goes off to Mark Twain 
 Singing a song about what true men don't do 
 Killing another creature, that's kind of blue 
 Writing about the world of the wild coyote 
 Good man, Truman Capote 
 Talking about my thoughts 'cause they must grow 
 Cock my brain to shoot my load 
 I'm on the porch 'cause I lost my house key 
 Pick up my book, I read Bukowski 
 Can I get another kiss from you? 
 Kiss me right here on my tattoo 
 Good God, where's my sleigh now 
 Good God, playing for days now 
 Good God, well, any day now 
 Good God, take me away now 
 Good God, De Niro's insane now 
 Good God, racking my brain now 
 Good God, well, any day now 
 Good God, take me away now... take me away 
 Me, my friends and the sex machine 
 Do unto others like my brother, Bean 
 I know you've got a mother, so give her a hug 
 I know you've got a mother with a whole lotta love 
 Billy sings and Basie swings 
 These are just a few of my favorite things 
 These are just a few of my favorite things 
 These are just a few of my favorite things 
 These are just a few... Ho"
62,Red Hot Chili Peppers,rock,The Righteous & The Wicked,"I can't rest in war 
 Will you be my friend? 
 Dark Ages never change 
 Well, I can't comprehend 
 Kiss me, we self destruct 
 Can you hear me Lord? 
 Yes, I think we're fucked 
 But I can't rest in war 
 (Righteous and the wicked on the war and peace) 
 The righteous and the wicked, war and peace 
 The killing fist of the human beast 
 P.O.P., Prodigies of peace 
 Hear me when I'm calling you from my knees 
 I am praying for a better day, oh yeah 
 I am praying for a better day, anyway, oh yeah 
 I am praying for a better day, okay 
 Holy Mother Earth 
 Crying into space 
 Tears on her pretty face 
 For she has been raped 
 Killing your future blood 
 Fill her with disease 
 Global abortion, please 
 That is what she needs 
 (Righteous and the wicked on the war and peace) 
 The righteous and the wicked, war and peace 
 The killing fist of the human beast 
 P.O.P., Prodigies of peace 
 Hear me when I'm calling you from my knees 
 I am praying for a better day, oh yeah 
 Playing for a better day, every way 
 Are we fireflies 
 Flashing in the night? 
 Big thunder rumble fish 
 Did you get it right? 
 Headstrong battle song 
 Exploding souls be gone 
 Marvin Gaye, my love 
 Where did we go wrong? 
 (Righteous and the wicked on the war and peace) 
 The righteous and the wicked, war and peace 
 The killing fist of the human beast 
 P.O.P., Prodigies Of Peace 
 Hear me when I'm calling you from my knees 
 I am praying for a better day, yeah 
 1, 2 (crank it) 1, (this is it) 2, 3"
63,Red Hot Chili Peppers,rock,Give It Away,"Oh 
 Oh 
 What I got, you got to give it to your mama 
 What I got, you got to give it to your papa 
 What I got, you got to give it to your daughter 
 You do a little dance and then you drink a little water 
 Oh, what I got, you got to get it, put it in you 
 What I got, you got to get it, put it in you 
 What I got, you got to get it, put it in you 
 Reeling with the feeling; don't stop, continue 
 A-realize I don't want to be a miser 
 Confide with Sly, you'll be the wiser 
 Young blood is the lovin' upriser 
 How come everybody wanna keep it like the kaiser? 
 Give it away, give it away, give it away now 
 Give it away, give it away, give it away now 
 Give it away, give it away, give it away now 
 I can't tell if I'm a kingpin or a pauper 
 Greedy little people in a sea of distress 
 Keep your more to receive your less 
 Unimpressed by material excess 
 Love is free, love me, say ""Hell, yes"" 
 Low brow but I rock a little know-how 
 No time for the piggies or the hoosegow 
 Get smart, get down with the pow wow 
 Never been a better time than right now 
 Bob Marley, poet and a prophet 
 Bob Marley, taught me how to off it 
 Bob Marley, walkin' like he talk it 
 Goodness me, can't you see, I'm gonna cough it? 
 Give it away, give it away, give it away now 
 Give it away, give it away, give it away now 
 Give it away, give it away, give it away now 
 Oh, oh yeah 
 Give it away, give it away, give it away now 
 Give it away, give it away, give it away now 
 Give it away, give it away, give it away now 
 I can't tell if I'm a kingpin or a pauper 
 Lucky me, swimming in my ability 
 Dancing down on life with agility 
 Come and drink it up from my fertility 
 Blessed with a bucket of lucky mobility 
 My mom, I love her 'cause she love me 
 Long gone are the times when she scrub me 
 Feeling good, my brother gonna hug me 
 Drinking my juice, young love chug-a-lug me 
 There's a river, born to be a giver 
 Keep you warm, won't let you shiver 
 His heart is a-never gonna wither 
 Come on, everybody, time to deliver 
 Give it away, give it away, give it away now 
 Give it away, give it away, give it away now 
 Give it away, give it away, give it away now 
 I can't tell if I'm a kingpin or a pauper 
 What I got, you got to give it to your mama 
 What I got, you got to give it to your papa 
 What I got, you got to give it to your daughter 
 You do a little dance and then you drink a little water 
 What I got, you got to get it, put it in you 
 What I got, you got to get it, put it in you 
 What I got, you got to get it, put it in you 
 Reeling with the feeling; don't stop, continue 
 Oh, realize I don't want to be a miser 
 Confide with Sly, you'll be the wiser 
 Young blood is the lovin' upriser 
 How come everybody wanna keep it like the kaiser? 
 Give it away, give it away, give it away now 
 Give it away, give it away, give it away now 
 Give it away, give it away, give it away now 
 Give it away, give it away, give it away now 
 Give it away now 
 Give it away now 
 Give it away now 
 Give it away now 
 Give it away now 
 Give it away now 
 Give it away now 
 Give it away now 
 Give it away now 
 Give it away now 
 Give it away now 
 Give it away now 
 Give it away now 
 Give it away now 
 Give it away now 
 Give it away now 
 Give it away now 
 Give it away now 
 Give it away now 
 Give it away now 
 Give it away now"
64,Red Hot Chili Peppers,rock,Blood Sugar Sex Magik,"Blood, sugar, suckerfish in my dish 
 How many pieces do you wish? 
 Step into a heaven where I keep it on the soul side 
 Girl, please me, be my soul bride 
 Every woman has a piece of Aphrodite 
 Copulate to create, a state of sexual light 
 Kissing her virginity, my affinity 
 I mingle with the gods, I mingle with divinity 
 Blood sugar baby 
 She's magik, sex magik, sex magik 
 Blood sugar baby 
 She's magik, sex magik, sex magik 
 Blood sugar crazy 
 She has it, sex magik, sex magik 
 Blood sugar baby 
 She's magik, sex magik, sex magik 
 Glorious euphoria is my must 
 Erotic shock is a function of lust 
 Temporarily blind, dimension to discover 
 In time, each into the other 
 Uncontrollable notes from her snow white throat 
 Fill a space in which two bodies float 
 Operatic by voice, a fanatic by choice 
 Aromatic is the flower, she must be moist 
 Blood sugar baby 
 She's magik, sex magik, sex magik 
 Blood sugar baby 
 She's magik, sex magik, sex magik 
 Blood sugar crazy 
 She has it, sex magik, sex magik 
 Blood sugar baby 
 She's magik, sex magik, sex magik 
 Blood sugar baby 
 She magik, sex magik, sex magik 
 Blood sugar baby 
 She magik, sex magik, sex magik 
 Blood sugar crazy 
 She has it, sex magik, sex magik 
 Blood sugar baby 
 She magik, sex magik, sex magik 
 Blood sugar, my girl 
 She magik, sex magik, sex magik 
 Blood sugar baby 
 She magik, sex magik, sex magik 
 Blood sugar crazy 
 She has it, sex magik, sex magik 
 Blood sugar baby 
 She magik, sex magik, sex magik"
65,Red Hot Chili Peppers,rock,Under The Bridge,"Sometimes I feel like I don't have a partner 
 Sometimes I feel like my only friend 
 Is the city I live in, the city of angels 
 Lonely as I am, together we cry 
 I drive on her streets 'cause she's my companion 
 I walk through her hills 'cause she knows who I am 
 She sees my good deeds and she kisses me windy 
 Well, I never worry, now that is a lie 
 And I don't ever want to feel like I did that day 
 Take me to the place I love, take me all the way 
 I don't ever want to feel like I did that day 
 Take me to the place I love, take me all the way 
 Yeah, yeah-yeah 
 It's hard to believe that there's nobody out there 
 It's hard to believe that I'm all alone 
 At least I have her love, the city, she loves me 
 Lonely as I am, together we cry 
 Well, I don't ever want to feel like I did that day 
 Take me to the place I love, take me all the way 
 Well, I don't ever want to feel like I did that day 
 Take me to the place I love, take me all the way 
 Yeah, yeah-yeah 
 Oh, no, no, no, yeah-yeah 
 Love me, I said, yeah, yeah 
 One time 
 Under the bridge downtown 
 Is where I drew some blood 
 Under the bridge downtown 
 I could not get enough 
 Under the bridge downtown 
 Forgot about my love 
 Under the bridge downtown 
 I gave my life away 
 Yeah, yeah-yeah (away) 
 Oh, no, no, no, no, yeah-yeah (away) 
 Alone, I said, oh yeah-yeah (away) 
 Will I stay?"
66,Red Hot Chili Peppers,rock,Naked In The Rain,"Standing on the corner of civilization 
 There's a time, there's a place for me 
 In a world where I can't be found 
 Cold and mean people give me the creeps 
 Going to the jungle where the elephant roams 
 Got to get away, gonna make it my home 
 Losing my taste for the human race 
 Social grace is a waste of time 
 It's absurd when I look around 
 So sublime that we blow my mind 
 Naked in the rain with a killer whale 
 I can't taste the salt when I lick his tail 
 Naked in the rain 
 Doctor Doolittle, what's your secret? 
 Give it to me doctor, don't keep it 
 I never met an animal that I didn't like 
 You can come to me, I won't bite 
 Don't you know dog is man's best friend? 
 There is some love that you can't fight 
 Naked in the rain with black tattoos 
 Running through the woods, laughing at the blues 
 Naked in the rain 
 Doctor Doolittle, what's your secret? 
 Give it to me doctor, don't keep it 
 Listen to the talking heart in my chest 
 With this gift, good Lord, I am blessed 
 There's a lump and it's in my throat 
 I'm in love with the wilderness 
 Naked in the river, skinny dipping my way 
 In the waterfall, I just wanna play 
 Naked in the rain 
 Doctor Doolittle, what's your secret? 
 Give it to me doctor, don't keep it 
 Naked in the rain 
 Doctor Doolittle, what's your secret? 
 Give it to me doctor, don't keep it"
