,0,1,2,3
194,Michael Jackson,pop,Nite Line,"Calling on the Night Line 
 Waking me up 
 Calling on the Night Line (Calling on the Night Line) 
 Can't get enough 
 Calling on the Night Line (Calling on the Night Line) 
 Whisper in my ear 
 Sending through the fire line (Calling on the Night Line) 
 What I'd like to hear 
 Every night about midnight 
 The call comes through 
 You turn it on the Night Line 
 'Cause you know just what to do 
 And I'll be waiting (I'll be waiting) 
 By the phone (By the phone) Alone. 
 Calling on the Night Line 
 Waking me up (Call me, baby) 
 Calling on the Night Line - Hee! 
 Can't get enough (Call me, darling) 
 Calling on the Night Line - Hee! 
 Whisper in my ear - Aow! 
 Sending through the fire line 
 What I'd like to hear 
 Make it person-to-person 
 Make it heart-to-heart 
 Darling, your communication 
 Is sending up sparks 
 I'll be waiting (I'll be waiting) 
 By the phone (By the phone) 
 Why don't you give me a call? 
 (Calling on the Night Line 
 Getting me up) 
 I wanna call 
 (Calling on the Night Line 
 Can't get enough) 
 Why don't you call me, baby? Hee! 
 Call me on the Night Line! (Call me, darling!) 
 Whisper in my ear (Won't you call me, baby!) Hee! 
 Sending through the fire line 
 What I'd like to hear - Ooh! 
 (Call me on the Night Line) 
 (Call me on the Night Line) 
 (Call me on the Night Line) 
 (Call me on the Night Line) Ooh! 
 Calling on the Night Line 
 Waking me up - Oh! 
 Calling on the Night Line - Hee! 
 Can't get enough (Call me, baby!) 
 Calling on the Night Line 
 Whisper in my ear 
 Sending through the fire line 
 What I'd like to hear 
 Calling on the Night Line 
 Getting me up - Oh! 
 Call me on the Night Line - Hee! 
 Can't get enough (Call me, baby!) 
 Calling on the Night Line 
 Whisper in my ear 
 Sending through the fire line 
 What I'd like to hear"
195,Michael Jackson,pop,No Friend Of Mine,"(Tempamental) 
 U not my girl 
 U not my wife 
 Got a couple tips from Mike 
 I'm moonwalkin outcha life 
 I close my eyes, you outta site 
 Now she wanna call me conceited 
 'Cause I'm a Smooth Criminal 
 I told her to Beat It 
 When a lil' love was all I needed 
 U talkin'? I call it how I see it 
 And now I mean it 
 I'm out for good 
 Like a lot of you into movin out the hood 
 But if I told you take me back you would 
 Too late me and P like Pac and Suge 
 Had you into cars with a metro 
 With a couple superstar from the ghetto 
 Now you feelin' so soft and you let go 
 Of da T.E.M.P.A Mental 
 (Michael Jackson) 
 What you gonna do 
 U ain't no friend of mine 
 Look what you put me through 
 I'm the new Gangsta 
 What you gonna do 
 U ain't no friend of mine 
 I can never fall in love 
 The new Gangsta 
 What you gonna do 
 U ain't no friend of mine 
 (Whatchu Gooooonnnnnna Do) 
 Look what you put me through 
 What you gonna doooo 
 U ain't no friend of mine 
 I can never fall in love 
 The new Gangsta 
 (Pras) 
 U ain't no friend 
 A friend u'll neva be 
 Obviously never been wit a real OG 
 From the H.I.T rollin' B.I.G 
 Passin through V.I.P it's the Refugee 
 (Gangsta) 
 Spread some love like the Gold Rush 
 Is was the things you did that used to mean so much 
 Whatever you touched 
 The way you used to blush 
 Now me you brush 
 Don't believe in such 
 Not since lovers don't promote violence 
 Not since just like the dolla no sense 
 No good I can feel it through my sixth sense 
 What's this wanna suck my existence 
 But still I believe in you and Me 
 Quite frankly that's how it's supposed to be 
 That kinda love that could end any poverty 
 So I keep these ghost like the Kennedy's 
 Yeah 
 (Michael Jackson) 
 Whatcha gonna do 
 U ain't no friend of mine 
 Look whatchu put me through 
 I'm the new Gangsta 
 Whatcha gonna do 
 U ain't no friend of mine 
 I can never fall in love 
 The new gangsta 
 (Speak to them Mike) 
 Whatcha gonnna do, 'Cause I'm gonnna getchuu 
 No where ta runnnnn, 
 No where ta hiddddeeee 
 All the things ya said 
 And the things ya done ta me 
 U cannnn no longerrrr make me cry 
 Look whatcha done to me baby 
 I can no longer smile baby 
 And IIIII've waited so long, just to carry on 
 I'm THE NEW GANGSTA 
 Whatcha gonna do 
 U ain't no friend of mine 
 (U ain't no friend of mine) 
 Look whatchu put me through 
 (U ain't a friend of mine) 
 Whatcha gonna do 
 U ain't a friend of mine 
 I never thought I'd fall in love 
 The New Gangsta 
 U gonna know 
 You, u put me 
 (Whoa!) 
 What are you gonna 
 NO! 
 Whatcha gonna! 
 No! 
 Whatcha gonna do 
 U ain't a friend of mine 
 I never thought I'd fall in love 
 The new Gangsta"
196,Michael Jackson,pop,Serious Effect,"You gotta get back every rhyme 
 Gonna jump back 
 She won't get it 
 I got a feeling but giving you, I 
 And I'm so damn 
 So damn glad about it 
 I got a feeling 
 That your jumping around 
 Gonna get back 
 She wont get it 
 I gotta feeling 
 Like jumping around 
 And I'm so damn 
 So damn glad about it 
 Serious effect on me, baby 
 Serious effect on 
 Serious effect on me, baby 
 Serious effect on 
 Serious effect, baby, baby 
 Serious effect on 
 Serious effect, baby, baby 
 Serious 
 And I'm so damn glad about it 
 I gotta feeling 
 Of giving you, I 
 Won't jump back 
 She wont let it 
 I got a feeling 
 Like nothing around 
 And I'm so damn 
 So damn glad about it 
 She don't smoke 
 She don't breathe 
 She don't hash 
 She don't dope 
 But she's a liar 
 I gotta feeling 
 Like nothing around 
 And I'm so damn 
 So damn glad about it 
 Serious effect on me, baby 
 Serious effect on 
 Serious effect on me, baby 
 Serious effect on 
 Serious effect, baby, baby 
 Serious effect on 
 Serious effect, baby, baby 
 Serious 
 And I'm so damn glad about it 
 Rap 
 She's serious 
 Makin' me delirious 
 I'm curious 
 Next thing I know 
 Hittin' us 
 Enjoying 
 The animal magnetism 
 She's too hot to touch 
 Too cool for criticism 
 Each and every things 
 Like a mini movie being filmed 
 'Cause I'm the captain 
 I'm in a body from hell 
 I'm shivering, quivering 
 I smile while I'm delivering 
 Get some love and passion 
 It's never been 
 So intense and spiritual like 
 In sense of above, against 
 And all off in silence 
 Then I scream like a man 
 Out of his rich 
 'Cause I'm so serious 
 So serious effecting 
 Serious effect on me, baby 
 Serious effect on 
 Serious effect on me, baby 
 Serious effect on 
 Serious effect, baby, baby 
 Serious effect on 
 Serious effect, baby, baby 
 Serious 
 And I'm so damn glad about it 
 Hoo! 
 She mentioned that I was 
 She mentioned that I was 
 (Serious) 
 Jumpin' around 
 I gotta break down 
 (Serious) 
 She's the one who get it 
 (Serious) 
 I got a feeling 
 Like jumpin' around 
 (Serious) 
 'Cause I'm so glad 
 And I'm so damn glad about it 
 Serious effect on me, baby 
 Serious effect on 
 Serious effect on me, baby 
 Serious effect on 
 Serious effect, baby, baby 
 Serious effect on 
 Serious effect, baby, baby 
 Serious 
 And I'm so damn glad about it 
 Serious 
 Serious on me 
 Serious 
 Serious on me 
 Serious 
 Serious on me 
 Serious 
 Serious on me 
 Serious 
 Serious on me"
197,Michael Jackson,pop,Smooth Criminal (Extended Version),"As he came into the window 
 Was the sound of a crescendo 
 He came into her apartment 
 He left the bloodstains on the carpet 
 She ran underneath the table 
 He could see she was unable 
 So she ran into the bedroom 
 She was struck down, it was her doom 
 Annie, are you okay? So, Annie are you okay? Are you okay, Annie? 
 Annie, are you okay? So, Annie are you okay? Are you okay, Annie? 
 Annie, are you okay? So, Annie are you okay? Are you okay, Annie? 
 Annie, are you okay? So, Annie are you okay? Are you okay, Annie? 
 Annie are you okay? Will you tell us that you're okay? 
 There's a sign in the window that he struck you, a crescendo Annie 
 He came into your apartment, left the bloodstains on the carpet 
 Then you ran into the bedroom, you were struck down, it was your doom 
 Annie are you okay? So, Annie are you okay? Are you okay Annie? 
 Annie are you okay? So, Annie are you okay? Are you okay Annie? 
 Annie are you okay? So, Annie are you okay? Are you okay Annie? 
 You've been hit by, you've been hit by a smooth criminal 
 So they came into the outway 
 It was Sunday, what a black day 
 Every time I try to find him 
 He's leaving no clues left behind him 
 And they have no way of knowing 
 Of the suspect, or what to expect 
 Mouth to mouth resuscitation 
 Sounding heartbeats, intimidations 
 Annie are you okay? So, Annie are you okay? Are you okay Annie? 
 Annie are you okay? (Annie are you okay?) So, Annie are you okay? (Annie are you okay?) Are you okay Annie? 
 Annie are you okay? (Annie are you okay?) So, Annie are you okay? (Annie are you okay?) 
 Annie are you okay? (Annie are you okay?) So, Annie are you okay? (Annie are you okay?) Are you okay Annie? 
 Annie are you okay? So, Annie are you okay? Are you okay Annie? 
 You've been hit, you've been hit by a smooth criminal 
 Annie are you okay? Will you tell us that you're okay? 
 There's a sign in the window that he struck you, a crescendo Annie 
 He came into your apartment, left the bloodstains on the carpet 
 Then you ran into the bedroom, you were struck down, it was your doom, Annie 
 (So Annie are you okay?) Are you okay, Annie? Hoo! 
 Annie are you okay? Will you tell us that you're okay? 
 There's a sign in the window that he struck you, a crescendo Annie 
 He came into your apartment, left the bloodstains on the carpet 
 Then you ran into the bedroom, you were struck down, it was your doom Annie 
 Annie are you okay? (I don't know) Will you tell us that you're okay? (I don't know) 
 There's a sign in the window, (I don't know) that he struck you, a crescendo Annie (I don't know) 
 He came into your apartment, (I don't know) left the bloodstains on the carpet (I don't know why babe) 
 Then you ran into the bedroom, (I don't know) you were struck down, it was your doom Annie (Dad gone it Annie) 
 Annie are you okay? (Dad gone it Annie) Will you tell us that you're okay? (Dad gone it baby) 
 There's a sign in the window, (Dad gone it Annie) that he struck you, (Hoo!) a crescendo Annie (Hoo!) 
 He came into your apartment, (Dad gone it) left the bloodstains on the carpet (Hoo!) 
 Then you ran into the bedroom, (Hoo! Hoo!) you were struck down (Dad gone it!) it was your doom, Annie 
 Annie are you okay? (I don't know) Will you tell us that you're okay? (I don't know) 
 There's a sign in the window, (I don't know) that he struck you, a crescendo Annie (I don't know) 
 He came into your apartment, (I don't know), left the bloodstains on the carpet (I don't know why babe) 
 Then you ran into the bedroom, (I don't know) you were struck down, it was your doom Annie (Dad gone it Annie) 
 Annie are you okay? (Dad gone it Annie) Will you tell us that you're okay? (Dad gone it baby) 
 There's a sign in the window, (Dad gone it Annie) that he struck you, (Hoo!) a crescendo Annie (Hoo!) 
 He came into your apartment, (Dad gone it) left the bloodstains on the carpet (Hoo!) 
 Then you ran into the bedroom, (Hoo! Hoo!) you were struck down (Dad gone it!), it was your doom, Annie"
198,Michael Jackson,pop,Trouble,"I don't wanna move when I'm in her hands 
 There's nothing I can do or say. Uh! 
 Put everything on hold. Cancel all my plans 
 Tell everybody I'm away - Hey. 
 She may be bad, but she feels so good 
 I'll give her anything she wants. 
 She's trouble (I know it) 
 She only needs to touch me 
 I'm in trouble (I know it) Hee! Ow. 
 She's trouble (I love it) 
 I know just when she does it 
 I'm in trouble (I know it) 
 I never knew what's running through her mind 
 No telling what she's gonna do - Ee. 
 Her every move is like a danger sign 
 And daring me to come on through - Hey! 
 She may be bad, but she feels so good 
 I give her anything she wants. 
 She's trouble (I know it) 
 She only needs to touch me 
 I'm in trouble (I know it) Hee! Ow. 
 She's trouble (I love it) 
 I know just when she does it 
 I'm in trouble (I know it) 
 She's trouble 
 She knows what I like 
 I got a feeling I'm falling (Going in trouble) 
 Trouble 
 There's no hope in sight 
 I'm in way over my head. 
 She's trouble (I know it) 
 She only needs to touch me 
 I'm in trouble (I know it) Ooh! 
 She's trouble (I love it) 
 I know just when she does it 
 I'm in trouble (I know it) Ooh! 
 She's trouble (I know it) 
 Only needs to...(I know it) 
 (I know it) 
 (I love it) 
 (Repeat)"
199,Michael Jackson,pop,What More Can I Give,"(Michael Jackson) 
 Ho... hey, hey 
 No, no, oh, no, oh, no 
 No, no, no 
 How many people will have to die 
 Before we will take a stand 
 How many children will have to cry 
 Before we do what we can 
 If sending your love 
 Is all you can give 
 To help one live (Mmm, hmm) 
 How many times can we turn our heads 
 And pretend we cannot see 
 Feeling the wounds of our broken earth 
 We're one global family 
 Just sending your prayers 
 Is something you feel 
 Helping one heal 
 What have I got that I can give (What have I got that 
 I can give) [Tell me] 
 What have I got that I can give (Yeah, yeah, oh, ho) 
 To love and to teach you 
 To hold and to need you [Hold and to need you] 
 What more can I give (More can I give, oh) 
 Brother to brother lay down our fears 
 And reach out and make a pact 
 Showing love that is in our hearts 
 Let us bring salvation back 
 Just sending your love 
 Has the power to heal 
 So let's all give 
 What have I got that I can give (What have I got that 
 I can give) 
 {It's not a lot to give, just a little bit} 
 What have I got that I can give {Everyone should be a 
 Part of it} 
 To love and to teach you 
 To hold and to need you {Yeah} 
 What more can I give (Oh) 
 Say the words 
 I'll lay me down for you 
 Just call my name 
 I am your friend 
 See, then why do they keep teaching us 
 Such hate and cruelty 
 We should give over and over again 
 What have I got that I can give (Would you give over 
 And over again) 
 What have I got that I can give (Oh, my God, oh, my 
 God) 
 To love and to teach you 
 To hold and to need you 
 What more can I give 
 What have I got that I can give 
 What have I got that I can give (Give you, give you) 
 To love and to teach you 
 To hold and to need you [Oh...] 
 What more can I give {What more} 
 What have I got that I can give {Can I give} 
 What have I got that I can give (Give to you, give it 
 To you, see) 
 To love and to teach you [Oh, yeah] 
 To hold and to need you [Oh, yeah] 
 What more can I give 
 What have I got that I can give (To you, that I can 
 Give to you) 
 What have I got that I can give 
 To hold and to see you [Oh, no] 
 To love and to feel you 
 What more can I give 
 What have I got that I can give 
 What have I got that I can give 
 To love and to teach you 
 To hold and to need you 
 What more can I give 
 What have I got that I can give 
 What have I got that I can give 
 To hold and to see you 
 To love and to feel you 
 What more can I give"
200,Michael Jackson,pop,Worlds Together,"(Start) 
 The first day I saw your face, 
 My heart begin to race, 
 My feelins being to rise, 
 As I look into those eyes, 
 What is this I'm feeling, 
 As you look so appealing, 
 We are worlds together 
 All for the better 
 I feel your love 
 Like doves in a world together 
 You are my girl 
 With teeth like pearls 
 So why don't you come with me 
 And feel world's peace 
 So take my hand 
 In to peace and new lands 
 In a world of love 
 Like two flying doves 
 So let it be you and me 
 For forever and ever and pass eternaty 
 So take my hand 
 In to peace and new lands 
 In a world of love 
 Like two flying doves 
 So let it be you and me 
 For forever and ever and pass eternity 
 (End)"
201,Michael Jackson,pop,You Rock My World (Remix),"(Jay-Z) 
 Uh, the Mike Jordan of rap, the Mike Jackson of pop 
 The Mike Tyson of street, Airs with no socks 
 The Hugh Hef of the game, yeah it won't stop 
 Till I meet the Lara Croft of the hood, it's all good 
 The Spielberg when I spill words to tracks 
 I'm a sick dude, you can't feel worse than that 
 For you slow-minded dudes I reverse it back 
 I gotta sick flow, see ain't no nursin' that 
 But mommie, if ya rock my world 
 I'll get you the baby bucket, you can be my baby pride girl 
 The white Nike Airs, we call em' Wifey Airs 
 Size 4-5, how cute is your size 
 That new, cute mubble, get you horses to drive 
 I paint that picture, cause ain't no nigga 
 Like the one you get from, Mike holla 
 (Michael Jackson) 
 I don't think they're ready for this one 
 (Michael Jackson) 
 My life will never be the same 
 Cause girl, you came and changed 
 The way I walk 
 The way I talk 
 I cannot explain the things I feel for you 
 But girl, you know it's true 
 Stay with me, fulfill my dreams 
 And I'll be all you'll need 
 Oh, oh, oh, oh, ooh, it feels so right (Girl) 
 I've searched for the perfect love all my life (All my life) 
 Oh, oh, oh, oh, ooh, it feels like I (Like I) 
 Have finally found her perfect love is mine 
 (See, I finally found, come on, girl) 
 You rocked my world, you know you did 
 And everything I'm gonna give (You rocked my world) 
 And there ain't nothing we could find 
 Someone like you to call mine (You rocked my world) 
 You rocked my world, you know you did (Girl) 
 And everything I'm gonna give (I want you, girl) 
 And there ain't nothing we could find 
 Someone like you to call mine 
 (Michael Jackson) 
 In time I knew that love would bring 
 This happiness to me 
 I tried to keep my sanity 
 I waited patiently 
 Girl, you know it seems 
 My life is fully complete 
 Our love is true because of you 
 You're doin' what you do 
 Oh, oh, oh, oh, who'd think that I (Oh) 
 Have finally found the perfect love I searched for allmy life 
 (Searched for all my life) 
 Oh, oh, oh, oh, who'd think I'd find 
 (Whoa... oh... oh...) 
 Such a perfect love that's so right (Whoa, girl) 
 (Jay-Z) 
 H to the izzo 
 Make ya leave ya jerkey boy like Frank Rizzo 
 My next get bank 
 Jigga voice his music, forget the track 
 Clap, clap, clap, clap 
 Before we lose it, Trackmasters bring it back, let's go 
 (Trackmaster and Jay-Z) 
 Everybody put cha' hands in the air (Ah Yeah!) 
 Uh, yeah better get it right, who 
 Everybody put cha' hands in the air (Ah Yeah!) 
 Uh, yeah better get it right, who 
 Everybody put cha' hands in the air (Ah Yeah!) 
 Uh, yeah better get it right, who 
 Everybody put cha' hands in the air (Ah Yeah!) 
 Uh, yeah better get it right, who 
 (Chorus to fade)"
202,Michael Jackson,pop,(I Can Make It) Another Day,"My life has taken me beyond the planets and the stars 
 And you're the only one that could take me this far 
 I'll be forever searching for your love 
 (Huh-ooh) 
 I walked away but I was wrong 
 (I can't make it another day) 
 You're the one that keeps me strong 
 (I can't make it another day) 
 You're the fire that keeps me warm 
 (I can't make it another day) 
 How did I get through this storm 
 (I can't make it another day without your love) 
 (Hoo hoo) 
 (Come on now!) 
 At night, 
 I pray before I sleep in hope of finding you 
 (Finding you) 
 I've opened up my heart I want you to come through 
 I've close my eyes I'm searching for your love 
 (Huh-ooh) 
 I walked away but I was wrong 
 (I can't make it another day) 
 You're the one that keeps me strong 
 (I can't make it another day) 
 You're the fire that keeps me warm 
 (I can't make it another day) 
 How did I get through this storm 
 (I can't make it another day without your love) 
 I walked away but I was wrong 
 (I can't make it another day) 
 You're the one that keeps me strong 
 (I can't make it another day) 
 You're the fire that keeps me warm 
 (I can't make it another day) 
 How did I get through this storm 
 (I can't make it another day without your love) 
 (Come on now!) 
 I walked away but I was wrong 
 (I can't make it another day) 
 You're the one that keeps me strong 
 (I can't make it another day) 
 You're the fire that keeps me warm 
 (I can't make it another day) 
 How did I get through this storm? 
 (I can't make it another day without your love) 
 I walked away but I was wrong 
 (I can't make it another day) 
 You're the one that keeps me strong 
 (I can't make it another day) 
 You're the fire that keeps me warm 
 (I can't make it another day) 
 Your the fire to my storm 
 (I can't make it another day without your love)"
203,Michael Jackson,pop,(We've Got) Blue Skies,"We've got blue skies, we've got blue skies 
 It seems like only yesterday 
 You gave your love to me 
 And we made a vow that through the years 
 Our love would always be. 
 Whenever doubts would fill my mind 
 You'd brush my fears away 
 Look into my eyes and hold me close 
 And this is what you'd say 
 We've got blue skies, now can't you see? 
 There'll never ever be another love for me. 
 The pleasant dreams we shared 
 Made our love stronger with each day 
 And the fears that haunted me 
 Seemed like a million miles away. 
 When friends we knew would come to me 
 With lies about your love 
 I'd tell them happiness and sunny skies 
 Are all we're thinking of 
 We're so in love 
 We're thinking of. 
 Blue skies 
 Blue skies 
 I see you there, you're kissing him 
 How can this really be? 
 Well, I guess it's time to realize 
 My dreams are more to me 
 And as I walk off thinking 
 What a fool I must have been 
 Like an echo from my lips today 
 I hear you telling him 
 We've got blue skies, now can't you see? 
 There'll never ever be another love for me. 
 We've got blue skies, now can't you see? 
 There'll never ever be another love for me. 
 Blue skies, we've got blue skies 
 Blue skies, we've got blue skies 
 Blue skies, we've got blue skies, oh baby 
 We've got blue skies, now can't you see? 
 There'll never ever be another love for me. 
 We've got blue skies, now can't you see? 
 There'll never ever be another love for me. 
 Blue skies, we've got blue skies 
 Blue skies, we've got blue skies 
 Blue skies, we've got blue skies, oh baby"
204,Michael Jackson,pop,A Fool For You,"I know you told me 
 Such a long time ago 
 Well, you didn't, you didn't want me around, baby, yeah 
 Hey, hey, you didn't love me no more 
 But I know something, yeah 
 That makes me be 
 I just want to say, yeah 
 I just want to say, yeah 
 I've been a fool for you, baby 
 (I've been a fool so long) 
 I've been a fool for you, baby, yeah 
 Oh, it's not your clothes, yeah 
 It's not your, it's not your walk 
 It's not your easy, yeah, yeah, yeah, yeah 
 It's not your, it's not your easy baby talk, yeah, yeah, oh 
 I know something, it must be somethin', yeah 
 Ooh, oh, that makes me feel, 
 Oh, that makes me feel 
 That I've been a fool for you, baby, yeah 
 (I've been fool for you so long) 
 I've been a, I've been a fool for you baby, yeah 
 Did ya ever wake up in the morning? 
 Just about the, just about the break of day 
 You reach over, you reach over and feel the pillow, yeah, yeah, yeah 
 Ooh, where your baby, where your baby used to lay, yeah, yeah 
 Then you put, then you, then you put on your crying, yeah 
 Like you never, like you never cried before, yeah, yeah 
 I said, I said, I said you ever, you ever cried so loud, yeah 
 You give the blues, you give the blues to the neighbor next door 
 Ever since, ever since you were one, two, three, four, five years old 
 Yeah, I've been a, I've been a fool for you baby, baby, yeah 
 Way down in my, way down in my soul, yeah, yeah 
 I know it must be, I know it must be something, yeah 
 Something, yeah, that makes me feel, that makes me feel 
 I've been a fool for you, baby, yeah 
 Oh, oh, I've been a fool for you, baby 
 (I've been fool for you so long) 
 Ooh, oh, oh, I've been a fool for you, yeah 
 (I've been fool for you so long) 
 'Cause it's, 'cause it's, 'cause it's in my soul, yeah, yeah, yeah 
 (I've been fool for you so long) 
 Fool, I've been a fool, I've been a fool, I've been a cool fool, yeah 
 (I've been fool for you so long) 
 Oh, oh, I've been a fool for you, baby, yeah 
 (I've been fool for you so long) 
 Oh, oh, I've been a fool for you, baby, yeah 
 (I've been fool for you so long)"
205,Michael Jackson,pop,Al Capone,"Too bad, forget it, cause there's Al Capone in it 
 So sad, you regret, cause the man is out tonight 
 Should have told, nobody ever should talk about this 
 And now I scream, nobody should be treated this way 
 Should have told, nobody ever should talk about this 
 And now I scream, nobody should be treated this way 
 Should have told, nobody ever should talk about this 
 And now I scream, nobody should be treated this way 
 Should have told, nobody ever should talk about this 
 And now I scream, nobody should be treated this way 
 I get in my getaway, after the scary might just say 
 Just done it on that cold as ice, screaming my 
 Now it's my job to get revenge 
 Why did you let him a getaway? 
 Why did you let him a getaway? 
 Why did you let him a getaway?"
206,Michael Jackson,pop,All I Need,"Cause this time of ours is borrowed 
 We must give a helping hand 
 Whatever happen to our heroes 
 They must get another chance 
 (We can do it again) 
 We drove close, closer and closer 
 And even though we're almost there 
 You are all I need in my life 
 You are all I dream here at night 
 Close your eyes imagine I'm, taking you, away 
 Tonight 
 Come together all the people (we can do it now) 
 Here's your chance to make it right (go, take a chance) 
 And even though (Even though) we're gettin' close (Gettin' Close) 
 We're not there just yet 
 And even though we're almost there 
 You are all I need in my life 
 You are all I dream here at night 
 Close your eyes imagine I'm taking you away 
 Then one more time close your eyes 
 I'm always here to stay 
 (Oh my) 
 Tonight 
 (I'm always here) 
 (Oh My) 
 (I'm always here) 
 We can do it again 
 (I'm always here)"
