,0,1,2,3
0,Michael Jackson,pop,Ain't No Sunshine,"Spoken Intro: 
 You ever want something 
 That you know you shouldn't have 
 The more you know you shouldn't have it, 
 The more you want it 
 And then one day you get it, 
 It's so good too 
 But it's just like my girl 
 When she's around me 
 I just feel so good, so good 
 But right now I just feel cold, so cold 
 Right down to my bones 
 'Cause ooh... 
 Ain't no sunshine when she's gone 
 It's not warm when she's away 
 Ain't no sunshine when she's gone 
 And she's always gone too long 
 Anytime she goes away 
 Wonder this time where she's gone 
 Wonder if she's gone to stay 
 Ain't no sunshine when she's gone 
 And this house just ain't no home 
 Anytime she goes away 
 I know, I know, I know, I know, 
 I know, know, know, know, know, 
 I know, I know, 
 Hey I ought to leave 
 I ought to leave her alone 
 Ain't no sunshine when she's gone 
 Ain't no sunshine when she's gone 
 Only darkness every day 
 Ain't no sunshine when she's gone 
 And this house just ain't no home 
 Anytime she goes away"
1,Michael Jackson,pop,I Wanna Be Where You Are,"Can it be I stayed away too long 
 Did I leave your mind when I was gone 
 It's not my thing trying to get back 
 But this time let me tell you where I'm at 
 You don't have to worry 'cause I'm coming 
 Back to where I should have always stayed 
 And now I've heard the maybe to your story 
 And it's enough love for me to stay 
 Can it be I stayed away too long 
 Did I leave your mind when I was gone 
 It's not my thing trying to get back 
 But this time let me tell you where I'm at 
 I wanna, wanna be where you are 
 Anywhere you are 
 I wanna, wanna be where you are 
 Everywhere you are 
 Please don't close the door to our future 
 There's so many things we haven't tried 
 I could love you better than I used to 
 And give you all the love I have inside 
 I wanna, wanna be where you are 
 Any, any, anywhere you are 
 I wanna, wanna be where you are 
 I gotta be where you are"
2,Michael Jackson,pop,Girl Don't Take Your Love From Me,"Ooh 
 Foolish of me, I couldn't see 
 The forest for the trees 
 You've been so true 
 I've been so cruel to you 
 Oh, girl please don't leave me 
 If you stay I'll find a way 
 To erase the past 
 Baby don't leave me 
 Girl don't take your love from me 
 Oh girl 
 What can I say to make you stay 
 Baby, don't leave me 
 You've been so kind 
 It blows my mind to know 
 Oh girl, I really hurt you 
 Tell me girl, it's not to late 
 And you give me a chance 
 To make it up to you 
 Don't take your love from me 
 Girl don't take your love 
 Don't take your love 
 Girl, if you take your love away from me 
 I'm gonna be in misery 
 Your love is the strength that I lean upon 
 How will I make it when it's gone 
 Of all the little things I wanted to say... 
 ...I really wanted to do 
 Girl, this time... 
 Ooh, oh girl I really mean it 
 So tell me girl, it's not too late 
 And you'll give me a chance 
 To make it up to you 
 Don't take your love from me 
 Don't take your love, no no no no no 
 Don't take your love 
 Don't leave me girl 
 Don't take your love from me 
 Baby, don't take your love from me 
 Don't take your love from me 
 Ooh, don't take your love from me 
 Baby, don't take your love from me"
3,Michael Jackson,pop,In Our Small Way,"Maybe you and I can't do great things 
 We may not change the world in one day 
 But we still can change some things today... 
 In our small way 
 Empty words are not enough 
 Where there's hurt we'll be a crush 
 When there's thirst we'll fill each other's cup 
 Because we care we love enough to share 
 Maybe you and I can't do great things 
 We may not change the world in one day 
 But we still can change some things today... 
 In our small way 
 In despair we'll be the hope 
 And the prayer that frees the soul 
 We'll be there to share each lonely road 
 Because we love, I know 
 We care enough 
 Maybe you and I can't do great things 
 We may not change the world in one day 
 But we still can change some things today... 
 In our small way 
 Just a little time is all it takes 
 What a difference just a smile can make, you'll see 
 Love is all we need 
 Maybe you and I can't do great things 
 We may not change the world in one day 
 But we still can change some things today... 
 In our small way"
4,Michael Jackson,pop,Got To Be There,"Got to be there, got to be there 
 In the morning 
 When she says hello to the world 
 Got to be there, got to be there 
 Bring her good times 
 And show her that she's my girl 
 Oh what a feeling there'll be 
 The moment I know she loves me 
 'Cause when I look in her eyes I realize 
 I need her sharing her world beside me 
 So I've got to be there 
 Got to be there in the morning 
 And welcome her into my world 
 And show her that she is my girl 
 When she says, ""Hello world!"" 
 I need her sharing the world beside me 
 That's why I've got to be there 
 Got to be there where love begins 
 And that's everywhere she goes 
 I've got to be there so she knows 
 That when she's with me, she's home 
 Got to be there 
 Got to be there"
5,Michael Jackson,pop,Rockin' Robin,"He rocks in the tree tops all day long 
 Hoppin' and a-boppin' and singing his song 
 All the little birdies on Jaybird Street 
 Love to hear the robin go tweet tweet tweet 
 Rockin' robin, rock rock 
 Rockin' robin' 
 Blow rockin' robin 
 'Cause we're really gonna rock tonight 
 Every little swallow, every chick-a-dee 
 Every little bird in the tall oak tree 
 The wise old owl, the big black crow 
 Flappin' their wings singing go bird go 
 Rockin' robin, rock rock 
 Rockin' robin' 
 Blow rockin' robin 
 'Cause we're really gonna rock tonight 
 Pretty little raven at the bird-band stand 
 Told them how to do the bop and it was grand 
 They started going steady and bless my soul 
 He out-bopped the buzzard and the oriol 
 He rocks in the tree tops all day long 
 Hoppin' and a-boppin' and singing his song 
 All the little birdies on Jaybird Street 
 Love to hear the robin go tweet tweet tweet 
 Rockin' robin, rock rock 
 Rockin' robin' 
 Blow rockin' robin 
 'Cause we're really gonna rock tonight"
6,Michael Jackson,pop,Wings Of My Love,"When this old world gets you down 
 When your spirit's on the ground 
 Just remember I will always be around 
 Just climb on the wings of my love 
 I'll take you high on the wings of my love 
 When you're feeling all alone 
 Like a child who's got no home 
 You know you've always got a place where you can go 
 Just climb on the wings of my love 
 Like a beach that knows no boundaries with all the trees 
 As it rushes to the seas darling we'll be just as free 
 I'll lift your spirits high our love will fly 
 We'll have heaven blue skies and forever sunshine 
 'Til you break those ties that bind 
 'Til that day you're really mine 
 Anytime you want to leave your world behind 
 Just climb on the wings of my love 
 I'll lift your spirits high our love will fly 
 We'll have heaven blue skies and forever sunshine 
 We've got rainbows yet to find 
 And we'll find them all in time 
 Girl you know someday we'll even touch the sky 
 Just climb on the wings of my love 
 Anytime you want to leave your world behind 
 I'll take you high on the wings of my love 
 Just take my hand and together we'll touch the sky 
 Just climb on the wings of my love 
 Yes remember I will always be around 
 I'll take you high on the wings of my love"
7,Michael Jackson,pop,Maria (You Were The Only One),"Maria hey hey Maria 
 Maria don't you hear me calling Maria 
 Maria girl you know you were the only one 
 Hey hey Maria 
 Maria don't you miss me just a little 
 Maria after all you were the only one 
 Come on back to me Maria 
 Maria come on back to me girl 
 Hey hey Maria 
 Maria it's been long so long 
 Maria since you've been gone 
 Hey hey Maria 
 Maria don't you need me just a little 
 Maria 'cause honest girl you were the only one 
 Come on back to me Maria 
 Oh come on back to me girl 
 Maria I need you 
 Maria why d'you keep a-running away 
 Oh baby you keep a-running away 
 Oh baby yeah Maria 
 I need you honey 
 Oh Maria you sweet little sunflower 
 Oh hear my plea for sympathy 
 I just want you here with me Maria 
 If you're on that lonely night 
 What's my life without you girl 
 I'm so lonely I'm so blue 
 Without you darling my life is through 
 Come on back"
8,Michael Jackson,pop,Love Is Here And Now You're Gone,"Love is here 
 And oh my darling, now you're gone 
 Love is here 
 And oh my darling, now you're gone 
 You persuaded me to love you 
 And I did 
 But instead of tendeness 
 I found heartache instead 
 Into your arms I fell 
 So unaware of the loneliness 
 Thar was waiting there 
 spoken: 
 You closed the door to your heart, girl 
 And you turned the key 
 Locked your love away from me 
 Love is here 
 And oh my darling, now you're gone 
 You made me love you 
 And oh my darling, now you're gone 
 You said loving you 
 Would make life beautiful 
 With each passing day 
 But as soon as love came 
 Into my heart 
 You turned and you walked 
 Just walked away 
 spoken: 
 You stripped me of my dreams 
 You gave me faith, then you took my hope 
 Look at me now 
 Look at me 
 See what loving has done to me 
 Look at my face 
 See how cryin' has left its trace 
 After you made me all your own 
 Then you left me all alone 
 You made your words sound so sweet 
 Knowing that your love I couldn't keep 
 spoken: 
 My heart cries out for your tuch 
 But baby, you're not there 
 And the lonely cry fades in the air 
 Love is here 
 And oh my darling, now you're gone 
 Love is here 
 And oh my darling, now you're gone 
 You made me love you 
 Oh oh my darling, now you're gone 
 Talking 'bout love, love, love, love, 
 Ooh ooh my darling, now you're gone"
9,Michael Jackson,pop,You've Got A Friend,"When you're down and trubled 
 And you need some love and care 
 And nothin', no nothin' is goin' right 
 Just close your eyes and think of me 
 And soon I'll be there to brighten up 
 Yeah, even your darkest night 
 You just call out my name 
 And you know, wherever I am 
 I'll come a-runnin' 
 To see you again 
 Winter, spring, summer or fall 
 All you have to do is call 
 And I'll be there, yeah I will 
 You've got a friend 
 When the sky above you 
 Grows dark and full of clouds 
 And that old north wind 
 He begins to blow 
 Here's what you do baby 
 Keep your head together 
 And call my name out loud 
 And soon you'll hear me 
 Knockin' at your door 
 Oh yes I will, yes I will 
 You just call out my name 
 And you know, wherever I am 
 I'll come a-runnin' 
 To see you again 
 Winter, spring, summer or fall 
 All you have to do is call 
 And I'll be there, yeah I will 
 You've got a friend 
 Ain't it good to know 
 That you've got a friend 
 People can be so cold 
 They'll hurt you and desert you 
 And take your soul if you let them 
 Oh, don't let them 
 Winter, spring, summer or fall 
 All you have to do is call 
 And I'll be there, yes I will 
 You've got a friend, yes you do 
 You've got a friend, yes you do 
 Right till the end, for you 
 Ain't it good to know"
10,Michael Jackson,pop,Ben,"Ben, the two of us need look no more 
 We both found what we were looking for 
 With a friend to call my own 
 I'll never be alone 
 And you my friend will see 
 You've got a friend in me 
 (You've got a friend in me) 
 Ben, you're always running here and there 
 (Here and there) 
 You feel you're not wanted anywhere 
 (Anywhere) 
 If you ever look behind 
 And don't like what you find 
 There's something you should know 
 You've got a place to go 
 (You've got a place to go) 
 I used to say ""I"" and ""me"" 
 Now it's ""us"", now it's ""we"" 
 (I used to say ""I"" and ""me"") 
 (Now it's ""us"", now it's ""we"") 
 Ben, most people would turn you away 
 (turn you away) 
 I don't listen to a word they say 
 (a word they say) 
 They don't see you as I do 
 I wish they would try to 
 I'm sure they'd think again 
 If they had a friend like Ben 
 (A friend) 
 Like Ben 
 (Like Ben) 
 Like Ben"
11,Michael Jackson,pop,Greatest Show On Earth,"Love is like a circus and a carnival is beautiful to see 
 Love can turn your mind around like ferris wheels and spinning carosels 
 You'll be a part of the world of make believe 
 Flying high like a man on a trapeze 
 Oh, everyday is a holiday 
 Get your tickets right away 
 Love, love, love 
 Is the Greatest Show on Earth 
 The fantasy you see is like a child again through rainbow colored eyes 
 Step right up its circus time and get your moneys worth of love today 
 You'll be a part of the world of make believe 
 Flying high like a man on a trapeze 
 Everyday is a holiday 
 Get your tickets right away 
 Love, love, yea 
 Is the Greatest Show on Earth 
 Everyday is a holiday 
 Get your tickets right away 
 Love, love, love 
 Is the Greatest Show on Earth 
 Love, love, love 
 Is the greatest show on earth (yea e yea) 
 Love, love, yea 
 Is the greatest show on earth 
 Love, love, yea"
12,Michael Jackson,pop,People Make The World Go 'Round,"People... 
 ('Round and 'round and around...) 
 People make the world go 'round 
 ('Round and 'round and around...) 
 Teachers on strike, no more school today 
 They want more money but the board won't pay 
 People 
 Everybody's talkin' 'bout ecology 
 The air's so polluted that it's hard to breathe 
 People 
 But that's what makes the world go round 
 The ups and downs a carousel 
 Changing people's heads around 
 Go underground young men... 
 People make the world go round... 
 Old folks judge you by the clothes you wear 
 They'd swear you're a hippy if you have long hair 
 Young politicians fight for poverty 
 While people still cry for equality 
 But that's what makes the world go round 
 The ups and downs a carousel 
 Changing people's heads around 
 Go underground young men... 
 People make the world go round... 
 But that's what makes the world go round 
 The ups and downs a carousel 
 Changing people's heads around 
 Go underground young men... 
 People make the world go round..."
13,Michael Jackson,pop,We've Got A Good Thing Going,"Bad news, bad news! 
 I heard you're packing to leave! 
 I come running right over 
 I just couldn't believe it 
 I couldn't believe it 
 Oh baby, baby 
 You must be out of your mind 
 Do you know what you're kicking away? 
 We've got a good thing goin', baby 
 We've got a groovy thing 
 I've never done you no wrong 
 I never hit you when you're down 
 I always gave you good thing 
 I never ran around 
 I never ran around 
 Oh baby, baby 
 You must be out of your mind 
 Do you know what you're kicking away? 
 We've got a good thing goin', baby 
 We've got a groovy thing 
 There's something you ought to know 
 If you're fixing to go 
 I can't make it without you 
 No no no no, no no no no 
 No no no no, no no no no 
 Oh baby, baby 
 You must be out of your mind 
 Do you know what you're kicking away? 
 We've got a good thing goin', baby 
 We've got a groovy thing 
 We've got a good thing goin', baby 
 We've got a groovy thing"
14,Michael Jackson,pop,Everybody's Somebody's Fool,"Everybody's somebody's fool 
 The world is the biggest school 
 As you live, you learn though a torch will burn 
 Everybody's somebody's fool 
 You go through life making fools of others 
 Prentending you're giving them love 
 But remember sister or brother 
 You all have to answer to the one up above 
 It's beautiful to watch love begin 
 But oh so sad when it ends 
 As you got through life remember this rule 
 Everybody's somebody's fool 
 It's beautiful to watch love begin 
 But oh so sad when it ends 
 As you got through life remember this rule 
 Everybody's somebody's fool"
15,Michael Jackson,pop,My Girl,"I've got sunshine 
 On a cloudy day 
 When it's cold outside 
 I've got the month of May 
 I guess you'd say 
 What can make me feel this way? 
 My girl 
 (My girl, my girl) 
 Talkin' 'bout my girl 
 (My girl) 
 I've got so much honey 
 The bees envy me 
 I've got a sweeter song than 
 The birds in the trees 
 I guess you'll say 
 What can make me feel this way? 
 My girl 
 (My girl, my girl) 
 Talkin' 'bout my girl 
 (My girl) 
 Hey hey hey 
 Hey hey hey 
 Ooh... 
 I don't need no money, 
 Fortune or fame 
 I've got all the riches baby 
 One man can claim 
 Well I guess you'll say 
 What can make me feel this way? 
 My girl 
 (My girl, my girl) 
 Talkin' 'bout my girl 
 (My girl)"
16,Michael Jackson,pop,What Goes Around Comes Around,"My pocket were full and now my money's gone 
 My friends come around and now they're gone 
 Things come and they come and then they go 
 And where they go nobody knows 
 It's gonna come around 
 What goes around comes around 
 It's gonna come around 
 What goes around comes around 
 My cup over runneth with the fullness and grace 
 Yet people push bullshit in my face 
 The future can't hold what your money can't buy 
 My brother keep striving your child relies 
 It's gonna come around 
 What goes around comes around 
 It's gonna come around 
 What goes around comes around 
 The world keep on spinning does the future know? 
 We're destined to screw ourselves one blow 
 We've ruined what's pure down from nature below? 
 You'd better look back it'll all be gone 
 It's gonna come around 
 What goes around comes around 
 It's gonna come around 
 What goes around comes around 
 So children please listen this world is yours 
 This message to deep to ignore 
 Your forefathers said but they did not do 
 The things that would show that they cared for you 
 It's gonna come around 
 What goes around comes around 
 It's gonna come around 
 What goes around comes around 
 Comes around, comes around, comes around 
 Comes around, comes around, comes around 
 Comes around, comes around, comes around 
 Comes around yeah 
 Gonna take you higher 
 I'm gonna take you higher 
 I'm gonna take you higher 
 Yeah yeah yeah 
 I'm gonna take you higher 
 Gonna take you higher 
 Yeah yeah yeah 
 Gonna take you higher, higher 
 Higher, higher, higher, higher 
 Gonna take you higher 
 Gonna take you higher"
17,Michael Jackson,pop,Shoo-Be-Doo-Be-Doo-Da-Day,"Your precious sweetheart, she's so faithful 
 She's so true, oh yeah 
 Her dreams are tumblin' 
 Her world is crumblin' 
 Because of you, uh uh 
 One day you'll hurt her just once too much 
 And when you finally lose your tender touch 
 Shoo-be-doo-be-doo-be-doo-da-day 
 Her feet may wander, her heart may stray 
 Shoo-be-doo-be-doo-be-doo-da-day 
 You gonna send your baby straight to me 
 I'm gonna give her all the lovin' 
 Within my heart, oh yeah 
 I'm gonna patch up every single little dream 
 You torn apart, understand me now? 
 And when she tells you she's cried her last tear 
 Heaven knows I'm gonna be somewhere near 
 Shoo-be-doo-be-doo-be-doo-da-day 
 Her feet may wander, her heart may stray 
 Shoo-be-doo-be-doo-be-doo-da-day 
 You gonna send your baby straight to me 
 Oh yeah-yeah, you better 
 You better listen to me, yeah 
 Heartaches are callin' and tears are fallin' 
 Because of you, oh yeah 
 And when you're gone she'll know 
 I'm the one to go to her rescue 
 Maybe you didn't know that baby 
 You're gonna leave her one too many times 
 And when you come back that 
 Girl's gonna be mine, all mine"
18,Michael Jackson,pop,You Can Cry On My Shoulder,"Just because you know I love you so much 
 Don't be afraid to tell me you're sad 
 Because you lost his love 
 Though your love is not for me 
 I don't wanna see you in mysery, so come on, baby come on 
 You can cry on my shoulder... 
 You can cry on my shoulder 
 And bring all your troubles to me 
 All your troubles to me 
 Big girls ain't supposed to cry, 
 If you do I'll understand, 
 Maybe I can show you how you can win his love again 
 It may seem strange I know 
 But it's just that I love you 
 So come on, baby come on 
 You can cry on my shoulder 
 You can cry on my shoulder 
 And bring all your troubles to me. 
 All your troubles to me 
 Girl you've given him all you had 
 He, d better stop treating you so bad, 
 Come on babe, come on, oh yeah 
 You can cry on my shoulder, yes you can girl 
 You can cry on my shoulder 
 And bring all your troubles to me, yeah babe, yes you can now 
 Darling, ooh, ooh yes, yes you can girl... 
 I'll be there to help, 
 You can cry, you can cry, you can cry 
 Baby 
 (You can cry on my shoulder) 
 Ooh yeah babe, yeah babe 
 (You can cry on my shoulder) 
 You can cry, you can cry..."
19,Michael Jackson,pop,With A Child's Heart,"With a child's heart 
 Go face the worries of the day 
 With a child's heart 
 Turn each problem into play 
 No need to worry no need to fear 
 Just being alive makes it all so very clear 
 With a child's heart 
 Nothing can ever get you down 
 With a child's heart 
 You've got no reason to frown 
 Love is as welcome 
 As a sunny sunny day 
 No grown-up thoughts 
 To lead our hearts astray 
 Take life easy, so easy nice and easy 
 Like a child so gay and so carefree 
 The whole world smiles with you 
 As you go your merry way 
 Oh with a child's heart 
 Nothing's gonna get me down"
20,Michael Jackson,pop,Up Again,"Into each life some rain falls 
 Then comes the snow 
 But after the snow 
 The flowers will grow 
 Girl when my life got stormy 
 You stayed for the ride 
 You stayed my side 
 You make the sun shine 
 I'm up again I never let you down 
 Nothing's ever gonna stop me now 
 Up again I never let you down 
 I love you 
 This Humpty Dumpty's lucky 
 He's had his fall 
 But after it all 
 He brushed himself off 
 Knowing how much you loved me 
 I made one more try 
 I reached for the sky 
 And I made it this time 
 I'm up again I never let you down 
 Nothing's ever gonna stop me now 
 Up again I never let you down 
 I love you"
21,Michael Jackson,pop,All The Things You Are,"You are the promised kiss of springtime 
 That makes the lonely winter seem long 
 You are the breathless hush of evening 
 That trembles on the brink of a lovely song 
 You are the angel glow that lights a star 
 The dearest things I know are what you are 
 Some day my happy arms will hold you 
 And some day I'll know that moment divine 
 When all the things you are, are mine 
 You are the angel glow that lights a star 
 The dearest things I know are what you are 
 Some day my happy arms will hold you 
 And some day I'll know that moment divine 
 When all the things you are, are mine"
22,Michael Jackson,pop,Happy,"Sadness had been close as my next of kin 
 Then Happy came one day, chased my blues away 
 My life began when Happy smiled 
 Sweet, like candy to a child 
 Stay here and love me just a while 
 Let sadness see what Happy does 
 Let Happy be where Sadness was 
 Happy, that's you 
 You made my life brand new 
 Lost as a little lam was I till you came in 
 My life began when Happy smiled 
 Sweet, like candy to a child 
 Stay here and love me just a while 
 Let sadness see what Happy does 
 Let Happy be where Sadness was 
 (Till now) 
 Where have I been? 
 What lifetime was I in? 
 Suspended between time and space 
 Lonely until Happy came smiling up at me 
 Sadness had no choice but to flee 
 I said a prayer so silently 
 Let Sadness see what Happy does 
 Let Happy be where Sadness was till now"
23,Michael Jackson,pop,Too Young,"They try to tell us we're too young 
 Too young to really be in love 
 They say that love's a word 
 A word we've only heard 
 But can't begin to know the meaning of 
 And yet we're not too young to know 
 This love will last though years may go 
 And then someday they may recall 
 We were not to young at all"
24,Michael Jackson,pop,Doggin' Around,"You better stop 
 Your doggin' around 
 Yeah, yeah, yeah, yeah 
 'Cause if you don't stop 
 I'm gonna have to put you down 
 I can't take it much longer 
 My heart's getting weak 
 It's not getting any stronger 
 You keep me so upset 
 My head's in a whirl 
 But if you wanna be, yeah 
 Be my girl 
 You better stop 
 Your doggin' around 
 You know what I'm talkin' about 
 Yeah, yeah, yeah 
 If you don't stop 
 I'm gonna have to put you down 
 Baby, yes I do, yes I do 
 Gonna, gonna put you down 
 You're doggin' me (repeat) 
 I'm gonna have to put you down 
 Yes you do, you're doggin' me 
 Yes you do, you're doggin' me 
 You better stop 
 Your doggin' me around"
25,Michael Jackson,pop,Johnny Raven,"Free and untamed that's how I've grown 
 Settling down ain't my nature 
 Roots I'll never own 
 Oh your smile 
 But tell me, ain't your child 
 How can you cage a bird 
 Born to be wild 
 I'm Johnny Raven by and by 
 Oh, I'm going to leave yoour nest girl 
 Another nest to try 
 Ooh Johnny Raven 
 Girl you know I shouldn't have loved you 
 Yeah, but I gotta leave yoou 
 When my restless heart says goodbye 
 Look at you little girl 
 You feel love so deep 
 If I could change in a second 
 I'd change for you like that 
 Stay right here for keeps 
 But I'm home free for no thrills 
 Stray I will 
 Seems I gotta need one girl 
 Never can feel 
 Yeah I'm Johnny Raven by and by 
 Oh, I'm going to leave yoour nest girl 
 Another nest to try 
 Ooh Johnny Raven 
 Girl you know I shouldn't have loved you 
 Yeah, but I gotta leave yoou 
 When my restless heart says goodbye 
 Everybody knows my name 
 I'm Johnny Raven yeah, yeah by abd by 
 I'm gonna fly 
 When you cry part of me's gonna die"
