,0,1,2,3
138,Michael Jackson,pop,The Lost Children,"We pray for our fathers, pray for our mothers 
 Wishing our families well 
 We sing songs for the wishing, of those who are kissing 
 But not for the missing 
 So this one's for all the lost children 
 This one's for all the lost children 
 This one's for all the lost children, wishing them well 
 And wishing them home 
 When you sit there addressing, counting your blessings 
 Biding your time 
 When you lay me down sleeping and my heart is weeping 
 Because I'm keeping a place 
 For all the lost children 
 This is for all the lost children 
 This one's for all the lost children, wishing them well 
 And wishing them home 
 Home with their fathers, 
 Snug close and warm, loving their mothers 
 I see the door simply wide open 
 But no one can find it 
 So pray for all the lost children 
 Let's pray for all the lost children 
 Just think of all the lost children, wishing them well 
 This is for all the lost children 
 This one's for all the lost children 
 Just think of all the lost children 
 Wishing them well, and wishing them home"
139,Michael Jackson,pop,Whatever Happens,"He gives another smile, tries to understand her side 
 To show that he cares, she can't stay in the room 
 She's consumed with everything that's been goin' on 
 She says 
 Whatever happens, don't let go of my hand 
 Everything will be alright, he assures her 
 But she doesn't hear a word that he says 
 Preoccupied, she's afraid 
 Afraid what they've been doin's not right 
 He doesn't know what to say, so he prays 
 Whatever, whatever, whatever 
 Whatever happens, don't let go of my hand 
 Whatever happens, don't let go of my hand 
 Whatever happens, don't you let go of my hand 
 Don't let go of my hand 
 Don't let go of my hand 
 He's working day and night, thinks he'll make her happy 
 Forgetting all the dreams that he had 
 He doesn't realize it's not the end of the world 
 It doesn't have to be that bad 
 She tried to explain, ""It's you that makes me happy,"" 
 Whatever, whatever, whatever 
 Whatever happens, don't let go of my hand 
 Whatever happens, don't you let go of my hand 
 Whatever happens, don't let go of my hand 
 Whatever happens, don't you let go of my hand 
 Whatever happens, don't let go of my hand 
 Whatever happens, don't let go of my hand 
 Whatever happens, don't you let go of my hand 
 Whatever happens, don't let go of my hand 
 [Carlos Santana:] Thank you, man! 
 [Michael Jackson:] Thank you, Carlos!"
140,Michael Jackson,pop,Threatened,"Tonight's story is somewhat unique and calls for a different kind of 
 Introduction 
 A monster had arrived in the village 
 The major ingredient of any recipe for fear is the unknown 
 And this person or thing is soon to be met 
 He knows every thought, he can feel every emotion 
 Oh yes, I did forget something didn't I? 
 I forgot to introduce you to the monster. 
 You're fearing me, 'cause you know I'm a beast 
 Watching you when you sleep, when you're in bed I'm underneath 
 You're trapped in halls, and my face is the walls 
 I'm the floor when you fall, and when you scream it's 'cause of me 
 I'm the living dead, the dark thoughts in your head 
 I know just what you said 
 That's why you've got to be threatened by me 
 You should be watching me, you should feel threatened 
 Why you sleep, why you creep, you should be threatened 
 Every time your lady speaks she speaks to me, threatened 
 Half of me you'll never be, so you should feel threatened by me 
 You think you're by yourself, but it's my touch you felt 
 I'm not a ghost from Hell, but I've got a spell on you 
 Your worst nightmare, it's me I'm everywhere 
 In one blink I'll disappear, and then I'll come back to haunt you 
 I'm telling you, when you lie under tomb I'm the one watching you 
 That's why you got to be threatened by me 
 You should be watching me, you should feel threatened 
 Why you sleep, why you creep, you should be threatened 
 Every time your lady speaks she speaks to me, threatened 
 Half of me you'll never be, so you should feel threatened by me 
 The unknown monster is about to embark 
 From a far corner, out of the dark 
 A nightmare, that's the case 
 Never Neverland, that's the place 
 This particular monster can read minds 
 Be in two places at the same time 
 This is judgment night, execution, slaughter 
 The devil, ghosts, this monster is torture 
 You can be sure of one thing, that's fate 
 A human presence that you feel is strange 
 A monster that you can see disappear 
 A monster, the worst thing to fear. 
 You should be watching me, you should feel threatened 
 Why you sleep, why you creep, you should be threatened 
 Every time your lady speaks she speaks to me, threatened 
 Half of me you'll never be, so you should feel threatened by me 
 You should be watching me, you should feel threatened 
 Why you sleep, why you creep, you should be threatened 
 Every time your lady speaks she speaks to me, threatened 
 Half of me you'll never be, so you should feel threatened by me 
 You should be watching me, you should feel threatened 
 Why you sleep, why you creep, you should be threatened 
 Every time your lady speaks she speaks to me, threatened 
 Half of me you'll never be, so you should feel threatened by me 
 What you have just witnessed could be the end of a particularly 
 Terrifying nightmare. It isn't. It's the beginning."
141,Michael Jackson,pop,One More Chance,"Song: One More Chance 
 Artist: Michael Jackson 
 Uh huh, all right 
 This time I'm gonna do my best to make it right 
 Can't go on without you by my side 
 Hold on 
 Shelter come and rescue me out of this storm 
 And out of this cold I need someone 
 Oh why oh why why why 
 If you see her 
 Tell her this from me 
 All I need is 
 One more chance at love 
 One more chance at love 
 One more 
 One more chance at love 
 One more 
 See 
 Chance at love 
 One more 
 One more chance at love 
 One more chance at love 
 One more 
 One more chance at love 
 All right 
 One more chance at love 
 Searching for that one who is gonna make me whole 
 Help me make these mysteries unfold 
 Hold on 
 Lightning about to strike in rain only on me 
 Hurt so bad sometime it's hard to breathe 
 Oh why why 
 If you see her 
 Tell her this from me 
 All I need is 
 One more chance at love 
 One more chance at love 
 One more 
 One more chance at love 
 One more chance at love 
 One more chance for love 
 One more chance at love 
 One more chance at love 
 One more 
 One more chance at love 
 One more chance at love 
 And I would walk around this world to find her 
 And I don't care what it takes no 
 Why 
 I'd sail the seven seas to be near her 
 And if you happen to see her 
 See, tell her this from me 
 One more chance at love 
 Yeah yeah 
 One more chance at love 
 Tell her this from me 
 One more chance at love 
 Yeah yeah 
 One more chance at love 
 One more chance at love 
 One more chance at love 
 Lovin' you 
 One more chance at love 
 I can't find 
 One more chance at love 
 Lovin' you 
 One more chance at love 
 Yeah yeah one more 
 One more chance at love 
 One more chance at love 
 For love 
 One more chance at love 
 One more chance at love 
 Yeah yeah I can't stop 
 One more chance at love 
 One more chance at love 
 Lovin' you 
 One more chance at love 
 One more chance at love 
 I can't stop 
 One more chance at love 
 Lovin' you 
 Aaow! 
 One more chance at love 
 I can't stop 
 Lovin' you..."
142,Michael Jackson,pop,You Can't Win,"You can't win, you can't break even 
 And you can't get out of the game 
 People keep sayin' things are gonna change 
 But they look just like they're stayin' the same 
 You get in way over your head 
 And you've only got yourself to blame 
 You can't win chil' 
 (You can't win chil') 
 You ain't break even 
 And you can't get out of the game 
 You can't win, the world keeps movin' 
 And you're standin' far behind 
 People keep sayin', things'll get better 
 (Just to ease your state of mind) 
 (So you lean back, and you smoke that smoke) 
 (And you drink your glass of wine) 
 Sayin' you can't win, chil', you can't break even 
 And you can't get out of the game 
 You can't win, you can't win no way 
 If your story stays the same, no, no 
 (You ain't winnin') 
 (But it's nice to see you) 
 (I'm awfully glad you came) 
 (Better cool it 'cause it ain't about losin') 
 And the world has got no shame 
 You can't win, chil' 
 You can't break even 
 You can't get out of the game 
 You can't win, you can't break even 
 Ain't the way it's supposed to be, no, no 
 (You'll be spendin') 
 (Your little bit of money) 
 While someone else rides for free, ooh 
 (Learn your lesson) 
 (Refuel your mind) 
 (Before someone blows out your flame) 
 You can't win, chil' (no, you can't win) 
 You can't win chil' (no, you can't win) 
 You can't win chil' (no, you can't win) 
 You can't win chil' (no, you can't win) 
 You can't win, chil', you can't break even 
 And you can't get out of the game 
 You can't get out of the game 
 You can't get out PHEW! of the game, no, no"
143,Michael Jackson,pop,Sunset Driver,"All alone 
 She's in the ego zone 
 The word is out that you're doin' wrong 
 On the move 
 Got fire in your shoes 
 By word of mouth you are on the news 
 You're livin' in sunset times (Livin' in sunset times) 
 Feelin' bad 
 You're livin' much too fast 
 The truth, the truth that you're on the pass 
 In the raw 
 They don't know what you saw 
 By word of mouth you're breakin' every law 
 Sunset driver 
 Midnight rider 
 Friday's brighter 
 Morning rider 
 You're a Saturday-nighter, aow! 
 On the go 
 Got fever in your soul 
 You better not shout where you gonna go 
 Livin' hot 
 Doin' what you should not 
 The break's on me, then what do you got 
 You're livin' on sunset times (Livin' on sunset times) 
 Want that dime 
 Shoot the breeze 
 You feel that she's a tease 
 Your night is free, what you wanna be 
 Who's to trust 
 When livin' dangerous 
 Tonight's your night, but this is what you loose 
 Sunset driver 
 Midnight rider 
 Friday's brighter 
 Gettin' higher 
 You're a Saturday-nighter, aow! 
 You are there when the night's in town 
 Standin' there with the top of the round 
 They don't care about the things you wished you saw 
 You're like the cinema 
 You think that nothin's wrong 
 Doin' town 
 You do it every time 
 The word's got out that you're on the line 
 On the move 
 Got fever in your shoes 
 The night's on you, what are you gonna do? 
 Sunset driver 
 Midnight rider 
 Friday's brighter 
 Just to reach that driver 
 The Saturday-nighter, aow!"
144,Michael Jackson,pop,Scared Of The Moon,"Alone she lays waiting 
 Surrounded by gloom 
 Inflated by shadows 
 Painting the room 
 The light from the window 
 Cuts trough the air 
 And pins the child lying there 
 Scared of the moon 
 She pulls up the curtain 
 And shivers in fright 
 She hides from the colours 
 That rides on the night 
 The light through the window 
 That lights up the sky 
 And causes her moanfull cry 
 Scared of the moon 
 There's nothing wrong 
 Don't be bothered they said 
 It's just childish fantasies turning your head 
 No need to worry 
 It's really too soon 
 But there she lies shivering 
 Scared of the moon 
 Scared of the moon 
 Scared of the moon 
 Scared of the moon 
 Scared of the moon 
 The years go by swiftly 
 And soon childhood ends 
 But life is still fearful 
 When evening descends 
 The fear of a child 
 Still intrude the night 
 Returning on beams of light 
 Scared of the moon 
 The feeling of terror 
 She felt as a youth 
 Has turned from a fantasy 
 Into the truth 
 The moon is the enemy 
 Twisting her soul 
 And taking its fearful tone 
 Scared of the moon 
 But now there are others who sit here alone 
 And wait for the sunlight to brighten their gloom 
 Together they gather 
 The loners see shade 
 But knowing just why they're scared 
 Scared of the moon 
 Scared of the moon 
 Scared of the moon 
 Scared of the moon 
 Scared of the moon"
145,Michael Jackson,pop,We Are The World (Demo),"There is a time when we should hear the certain calls 
 'Cause the world it seems it's right in this line 
 'Cause there's a chance for taking in needing our own lives 
 It seems we need nothing at all 
 I used to feel I should give away my heart 
 And it shows that fear of needing them 
 Then I read the headlines and it said they're dying there 
 And it shows that we must heed instead 
 We are the world 
 We are the children 
 We are the ones who make a brighter day 
 So let's start giving 
 There's a chance we're taking 
 We're taking our own lives 
 It's true we'll make a brighter day 
 Just you and me 
 Give in your heart and you will see that someone cares 
 'Cause you know that they can feed them all 
 Then I read the paper and it said that you've been denied 
 And it shows the second we will call 
 We are the world 
 We are the children 
 We are the ones who make a brighter day 
 So let's start giving 
 There's a chance we're taking 
 We're taking our own lives 
 It's true we'll make a brighter day 
 Just you and me 
 Now there's a time when we must love them all 
 And it seems that life, it don't make love at all 
 But if you'd been there, and I'll love you more and more 
 It seems in life, I didn't do that 
 We are the world, the world 
 We are the children, are the children 
 We are the ones who make a brighter day 
 So let's start giving, let's start giving 
 There's a chance we're taking 
 We're taking our own lives 
 It's true we'll make a brighter day 
 Just you and me 
 We are the world, are the world 
 We are the children, are the children 
 We are the ones who make a brighter day 
 So let's start giving, let's start giving 
 But there's a chance we're taking, taking 
 We're taking our own lives 
 It's true we'll make a brighter day 
 Just you and me 
 We are the world, shalom 
 We are the children, shalingin 
 We are the ones who make a brighter day, shalom 
 So let's start giving, 'cause that's what we're being 
 There's a chance we're taking 
 We're taking our own lives 
 It's true we'll make a brighter day 
 Just you and me 
 Come on, yeah 
 We are the world, shalom 
 We are the children, shalingin 
 We are the ones who make a brighter day, shalom 
 So let's start giving, 'cause that's what we're being 
 There's a chance we're taking 
 We're taking our own lives 
 It's true we'll make a brighter day 
 Just you and me 
 Oh yeah, we got it 
 We are the world, shalom 
 We are the children, shalingin 
 We are the ones who make a brighter day, shalom 
 So let's start giving, cause that's what we're being 
 There's a chance we're taking 
 We're taking our own lives 
 It's true we'll make a brighter day 
 Just you and me 
 (Repeat and Fade Out)"
146,Michael Jackson,pop,We Are Here To Change The World,"We're on a mission 
 In the everlasting light that shines 
 A revelation 
 Of the truth in chapters of our minds 
 So long, bad times 
 We're gonna shake it up and break it up 
 We're sharing light brighter than the sun 
 Hello, good times 
 We're here to simulate, eliminate 
 An' congregate, illuminate 
 (We are here to change the world) 
 Gonna change the world, Hee 
 (We are here to change the world) 
 Gonna change the world, Ooh 
 So do surrender 
 'Cause the power's deep inside my soul 
 Sing it 
 (We are here to change the world) 
 Gonna change the world, Sing it 
 (We are here to change the world) 
 Hee, Gonna change the world, Ooh 
 (We are here to change the world) 
 We're gonna change the world, girl 
 (We are here to change the world) 
 My brothers my brother Na 
 We're gonna change the world 
 (We are here to change the world) 
 Hee, Deep down in my body, 
 Deep down in my soul, Baby 
 (We are here to change the world) 
 Hee, We're gonna change the world,"
147,Michael Jackson,pop,Cheater,"Verse one 
 You know I work to hard for this kinda play, (ho!) 
 I wrote a letter, for the getto of the CIA, (ho!) 
 I don't care a jack, or about what cha' do, (ho!) 
 Just put ya dime on the line baby, 'cause I own you, (ho!) 
 Somebody said, give up instead on how you feel, (ah-uh) 
 One blow to the head is all you need 
 (I ain't takin' it... ya,) 
 Cheater (ooh!, Do it!, What!, (Ya Got) Do it!, What! (Get back on me...)) 
 Verse two 
 !) 
 I know ya name and the game is ""I own you"" (ho!) 
 Ya, tellin' me that ya comin' to a compramise (ho!) 
 Ya smilin' at me while, ya stealin right before my eyes (Daggone it (ho!)) 
 Somebody said, give up instead on how ya feel, (ah-uh) 
 One blow to the head is all ya need, 
 (I ain't takin' it, ya...) 
 Cheater (ooh! Do it!, What, Do it!, What!, Get back on me...) 
 I hurt my backbone baby, 
 I start to give it up, 
 Life is an aggrovator, 
 Sumtimes I part it up, 
 I broke my radiator, 
 I live to starve the bone, 
 I pray to leave my body, 
 Don't you ever call! 
 Verse three 
 I don't care a jack, or about what you do (ho!) 
 Just sign your name on the line baby, I own you (Daggone it) 
 (You are a...) 
 Cheater (oooo0000ooh!, Give it to me, What!, What!, get jack on me...) 
 Somebody said, give up instead on how you feel, (ah-uh) 
 One blow to the head is all you need, 
 (I ain't takin' it..!) 
 Cheater... (ooh) Daggone it, Got-Give Give it to me, (cheatin' baby) 
 (You are a..) Cheater..."
148,Michael Jackson,pop,Monkey Business,"Well, Lord have mercy 
 Well, Lord have mercy 
 This ain't no good for me 
 This ain't no good for me, babe 
 Well, Lord have mercy 
 Well, Lord have mercy 
 Ain't no good for me, babe 
 Tell me what's goin' down, babe 
 Every time I wanna say it, it is just too much for me 
 I don't ever wanna say it cause of all the blasphemy 
 Everybody's doin' it to somebody's love in sight of me 
 I might tell on you 
 Don't you start no stuff with me 
 Your brother's gone and kissed the mother-in-law 
 I might tell Dad about what I saw 
 Oh, no 
 I caught your mother, she's doin' a dude 
 You can't like it that I'm lookin' right at you 
 Stop it, it's too much 
 Monkey business goin' down 
 Well, Lord have mercy 
 Well, Lord have mercy 
 Don't be callin' out ""mercy me"" 
 (Don't be callin' out ""mercy me"") 
 Don't be callin' down, babe 
 (Don't be callin' out mercy) 
 Well, Lord have mercy 
 Even burst the breast 
 Don't be callin' out ""mercy me"" 
 (Don't be callin' out ""mercy me"") 
 Don't be goin' down, babe 
 (Don't be callin' out ""mercy"") 
 Every time I wanna say it, it is just too much for me 
 Everybody's doin' it to somebody's love it seems to me 
 I just can't believe the things I'm seein', so just let it be 
 I might tell on you 
 So don't you start no stuff with me 
 Your brother's gone and kissed the mother-in-law 
 I might tell Dad about what I saw 
 Oh, no 
 I caught your mother, she's doin' a dude 
 You can't like it that I'm lookin' right at you 
 No, baby, too much 
 Monkey business goin' down 
 I read the paper and I can't believe what's goin' round 
 Somebody's doin' it to somebody's up, somebody's down 
 The government won't pay my taxes and I'm really mad 
 My mouth might let it be 
 So don't you monkey shy with me 
 Your brother's gone and kissed the mother-in-law 
 I might tell Dad about what I saw 
 Oh, no 
 I caught your mother, she's doin' a dude 
 You can't like it that I'm lookin' right at you 
 Oh, no, you're dirty, you're dirty babe dirty babe 
 Your brother's gone and kissed the mother-in-law 
 I might tell Dad about what I saw 
 Oh, no 
 Your brother didn't make a nickel, or dime too 
 Sittin' around tellin' how he did it to you 
 Stop it, it's too much 
 Monkey business goin' down 
 Goin' down, baby 
 Woh, monkey, woh, monkey, monkey, woh, monkey 
 Monkey business going down 
 I'm not satisfied 
 Oh, baby 
 Monkey business goin' down 
 Kowin', knowin', knowin' baby 
 I do wanna party 
 It's monkey, monkey 
 Monkey business goin' down 
 It's my business 
 Your business 
 It's my business 
 You know it for monkey 
 Woh, monkey, monkey, monkey 
 Monkey business goin' down 
 I caught your mother, she's doin' a dude 
 You can't like it that I'm lookin' right at you 
 Oh, no 
 Oh, mercy, oh, mercy 
 Monkey business goin' down 
 And monkey see, and monkey do 
 Oh, mercy 
 You can't like it that I'm lookin' right at you 
 Oh, mercy 
 Woh, monkey, woh, monkey, woh, monkey 
 Monkey business goin' down 
 Your business 
 It's my business 
 It's your business 
 It's my business 
 Your business 
 It's my business 
 Your business 
 Monkey business goin' down 
 Your business 
 It's my business 
 Your business 
 It's my business 
 Your business 
 Too much for kids, baby 
 It's monkey business goin' down 
 Oh, babe 
 You're gone"
149,Michael Jackson,pop,Who Is It (IHS Mix),"I gave her money 
 I gave her time 
 I gave her everything 
 Inside one heart could find 
 I gave her passion 
 My very soul 
 I gave her promises 
 And secrets so untold 
 And she promised me forever 
 And a day we'd live as one 
 We made our vows 
 We'd live a life anew 
 And she promised me in secret 
 That she'd love me for all time 
 It's a promise so untrue 
 Tell me what will I do? 
 And it doesn't seem to matter 
 And it doesn't seem right 
 'Cause the will has brought 
 No fortune 
 Still I cry alone at night 
 Don't you judge of my composure 
 'Cause I'm lying to myself 
 And the reason why she left me 
 Did she find in someone else? 
 (Who is it?) 
 It is a friend of mine 
 (Who is it?) 
 Is it my brother! 
 (Who is it?) 
 Somebody hurt my soul, now 
 (Who is it?) 
 I can't take this stuff no more 
 I am the damned 
 I am the dead 
 I am the agony inside 
 The dying head 
 This is injustice 
 Woe unto thee 
 I pray this punishment 
 Would have mercy on me 
 And she promised me forever 
 That we'd live our life as one 
 We made our vows 
 We'd live a love so true 
 It seems that she has left me 
 For such reasons unexplained 
 I need to find the truth 
 But see what will I do! 
 And it doesn't seem to matter 
 And it doesn't seem right 
 'Cause the will has brought 
 No fortune 
 Still I cry alone at night 
 Don't you judge of my composure 
 'Cause I'm bothered everyday 
 And she didn't leave a letter 
 She just up and ran away 
 (Who is it?) 
 It is a friend of mine 
 (Who is it?) 
 Is it my brother? 
 (Who is it?) 
 Somebody hurt my soul, now 
 (Who is it?) 
 I can't take it 'cause I'm lonely 
 (Who is it?) 
 It is friend of mine 
 (Who is it?) 
 To me I'm bothered 
 (Who is it?) 
 Somebody hurt my soul, now 
 (Who is it?) 
 I can't take it 'cause I'm lonely 
 And it doesn't seem to matter 
 And it doesn't seen right 
 'Cause the will has brought 
 No fortune 
 Still I cry alone at night 
 Don't you judge of my composure 
 'Cause I'm lying to myself 
 And the reason why she left me 
 Did she find someone else? 
 And it doesn't seem to matter 
 And it doesn't seem right 
 'Cause the will has brought 
 No fortune 
 Still I cry alone at night 
 Don't you judge of my composure 
 'Cause I'm bothered everyday 
 And she didn't leave a letter 
 She just up and ran away 
 And it doesn't seem to matter 
 And it doesn't seem right 
 'Cause the will has brought 
 No fortune 
 Still I cry alone at night 
 Don't you judge of my composure 
 'Cause I'm lying to myself 
 And the reason why she left me 
 Did she find someone else? 
 And it doesn't seem to matter 
 And it doesn't seem right 
 'Cause the will has brought 
 No fortune 
 Still I cry alone at night 
 Don't you judge of my composure 
 'Cause I'm bothered everyday 
 And she didn't leave a letter 
 She just up and ran away 
 And it doesn't seem to matter 
 And it doesn't seem right 
 'Cause the will has brought 
 No fortune 
 Still I cry alone at night 
 Don't you judge of my composure 
 'Cause I'm bothered everyday 
 And she didn't leave a letter 
 She just up and ran away 
 And it doesn't seem to matter 
 And it doesn't seem right 
 'Cause the will has brought 
 No fortune 
 Still I cry alone at night 
 Don't you judge of my composure 
 'Cause I'm lying to myself 
 And the reason why she left me 
 Did she find someone else?"
150,Michael Jackson,pop,Someone Put Your Hand Out,"Never try to talk about it 
 It's got to sound good to me inside 
 I just think about it 
 I'm so undemanding 
 'Cause they say love is blind 
 I've lived this life pretending 
 I can bear this hurt deep inside 
 The truth is that I'm longing 
 For love that's so divine 
 I've searched this whole world wishing 
 She'll be there time after time 
 So someone put your hand out 
 I'm begging for your love 
 All I do is hand out a heart that needs your love 
 I've lived my life the lonely 
 A soul that cries of shame 
 With handicapped emotions 
 Save me now from what still remains 
 I'll be your story hero 
 A serenading ryne 
 I'm just needing that someone 
 Save me now from the path I'm on... 
 Someone put your hand out 
 I'm begging for your love 
 'Cause all I do is hand out a heart that needs your love 
 Someone put your hand out 
 I'm begging for your love 
 All I do is hand out a heart that needs your love 
 When you say we will dance 'til the light of day 
 It's just like the children in earth's joy 
 When we pray will you promise me you'll always stay 
 It's because I'm needing that someone 
 Someone put your hand out 
 I'm begging for your love 
 'Cause all I do is hand out a heart that needs your love 
 Someone put your hand out 
 I'm begging for your love 
 All I do is hand out 
 Someone put your hand out 
 I'm begging for your love 
 All I do is hand out 
 Love"
