,0,1,2,3
16,Killer Mike,hiphop,Ready Set Go,"Hut one, hut two, two 
 Ready set go 
 Make these niggas get right 
 Or get low 
 Hut one, hut two, two 
 Ready set go 
 Make these niggas get right 
 Or get low 
 Get low, get low or get right right 
 Holla kill, kill for da, nigga, big Mike, big Mike 
 Get low get low or get right right 
 Holla kill, kill for da, nigga, big Mike, big Mike 
 I know these streets 'bout tired of this weak shit 
 Ya style been ran through like a freak bitch 
 Da pussy club got ya angered with ya frequent 
 Ed hard hard ass nigga and ya sequence 
 Might as well shop at Victoria Secret have 'em 
 Gift warp you some ""I love Pink"" shit 
 Rap due and y'all niggas delinquent 
 Ya better find anotha nigga to link with 
 'Cause da nigga you link with is a lie fool 
 I used to bully dat monkey nigga in high school 
 Sit at da lunch table, steal and eat his damn food 
 Da pretty girls, dey say, Michael a damn fool 
 I get my work on, and get my flirt on 
 I say fuck 'em, he a pussy put a skirt on 'em 
 I said fuck 'em, he a pussy put a skirt on 'em 
 Hut one, hut two, two 
 Ready set go 
 Make these niggas get right 
 Or get low 
 Hut one, hut two, two 
 Ready set go 
 Make these niggas get right 
 Or get low 
 Get low, get low or get right right 
 Holla kill, kill for da, nigga, big Mike, big Mike 
 Get low get low or get right right 
 Holla kill, kill for da, nigga, big Mike, big Mike 
 I'm da Prada, of da age of narcotta 
 Da kings on dope like da pill you swallow 
 Down by law I lead don't follow 
 Grind time, grand hustilin for gualla 
 I remain in the game to break lames off 
 Some of dem sensitive and some too soft 
 Da hood been forced to fuck with y'all by default 
 But now da truth here da bullshit cuts off 
 This is real homie, no fake, no filler, 100 percent grade A killer 
 Somethin' like da bitch that I keep in Villa Rica 
 But I'm a be quiet cause dey might Mike Vick ya 
 Might catch Mike with a light Mike Vicka 
 Some purple kush that'll get me high like a missile 
 Smokin' one deep 'cause I don't fuck with cha 
 Sincerely from da hustle and grind time official 
 Let's go, let's go, grand hustle 
 Money on our mind and we ain't goin' down sucka 
 And grind time, hut two and grand hustle 
 Send 'em here got 'em here look at da king bankhead sucka 
 Hut one, hut two, two 
 Ready set go 
 Make these niggas get right 
 Or get low 
 Hut one, hut two, two 
 Ready set go 
 Make these niggas get right 
 Or get low 
 Get low, get low or get right right 
 Holla kill, kill for da, nigga, big Mike, big Mike 
 Get low get low or get right right 
 Holla kill, kill for da, nigga, big Mike, big Mike 
 Zone 1 through zone 4, nigga zone 6 
 As well homeboy you know what's happenin' 
 Yeah, yeah da niggas who been 'posed to been 
 Runnin' dis shit done started runnin' da shit 
 Patna, ya understand? Muhfucka ain't nothin' 
 You gone do about it homes 
 Ya betta muhfuckin' keep ya lunch money in ya 
 Got damn wastebasket nigga"
17,Killer Mike,hiphop,Burn,"Yeah, yeah, yeah 
 Yeah, yeah, yeah 
 Yeah, yeah, yeah 
 Yeah, yeah, yeah 
 You and your folks love me and my folks 
 Me and my folks love you and your folks 
 Never was poor, that ever ever was poor 
 It seems a nigga can't get a job but he can get arrested 
 Thought shit was changing which this black president shit 
 My bitch got me fucked up, going to get tested 
 'Cause while I was locked up, she was living reckless 
 Just another ordeal a real nigga got a deal with 
 If you on the bottom right now, you got to feel this 
 I know that you're frustrated and you want to kill shit 
 Stockpile your weapons cause that day just might come real quick 
 Yeah, yeah, yeah 
 (Burn) 
 Yeah, yeah, yeah 
 (This mother) 
 Yeah, yeah, yeah 
 (Fucker) 
 Yeah, yeah, yeah 
 (Down) 
 Yeah, yeah, yeah 
 (I will burn) 
 Yeah, yeah, yeah 
 (This mother) 
 Yeah, yeah, yeah 
 (Fucker) 
 Yeah, yeah, yeah 
 (Down) 
 You and your folks love me and my folks 
 Me and my folks love you and your folks 
 Never was poor, that ever ever was poor 
 You and your folks love me and my folks 
 Me and my folks love you and your folks 
 Never was poor, that ever ever was poor 
 They say the cop wrote a letter apologizing to Oscar 
 Guess they say I'm wrong 'cause I still say drop him 
 Police in the ghetto, they is killing niggas daily 
 But when we get to busting back they'll say that we crazy 
 Prisons overcrowded and school is too 
 'Cause they under educate you and got a place for you, yeah 
 Niggas go to prison, new age slavery 
 Now you knowing why they under educate your baby 
 Yeah, yeah, yeah 
 (Burn) 
 Yeah, yeah, yeah 
 (This mother) 
 Yeah, yeah, yeah 
 (Fucker) 
 Yeah, yeah, yeah 
 (Down) 
 Yeah, yeah, yeah 
 (I will burn) 
 Yeah, yeah, yeah 
 (This mother) 
 Yeah, yeah, yeah 
 (Fucker) 
 Yeah, yeah, yeah 
 (Down) 
 You and your folks love me and my folks 
 Me and my folks love you and your folks 
 Never was poor, that ever ever was poor 
 You and your folks love me and my folks 
 Me and my folks love you and your folks 
 Never was poor, that ever ever was poor 
 They say get a job, you can think and grow rich 
 But what are you to do when the dollar ain't worth shit? 
 And the jobs ain't hiring, unemployment is gone 
 They going to repo your car and foreclose your home 
 Me I suggest you get yourself a shotgun 
 So when they come to evict you can make them run 
 The banks got bailed out but we still suffering 
 So I got a gun 'cause I've done had enough of them 
 Yeah, yeah, yeah 
 (Burn) 
 Yeah, yeah, yeah 
 (This mother) 
 Yeah, yeah, yeah 
 (Fucker) 
 Yeah, yeah, yeah 
 (Down) 
 Yeah, yeah, yeah 
 (I will burn) 
 Yeah, yeah, yeah 
 (This mother) 
 Yeah, yeah, yeah 
 (Fucker) 
 Yeah, yeah, yeah 
 (Down) 
 You and your folks love me and my folks 
 Me and my folks love you and your folks 
 Never was poor, that ever ever was poor 
 You and your folks love me and my folks 
 Me and my folks love you and your folks 
 Never was poor, that ever ever was poor 
 They say love Jesus and listen to your pastor 
 But Jesus told the truth and the pastor's a lying bastard 
 All he talk about is economic elevation 
 And all Jesus talked about soul salvation 
 Jesus sat with the sick and he walked with the poor 
 If he gave blood for our sins why we giving more? 
 I got some gangster disciples at church with me tonight 
 With five dollars worth of gas and a matchbook to light 
 Yeah, yeah, yeah 
 (Burn) 
 Yeah, yeah, yeah 
 (This mother) 
 Yeah, yeah, yeah 
 (Fucker) 
 Yeah, yeah, yeah 
 (Down) 
 Yeah, yeah, yeah 
 (I will burn) 
 Yeah, yeah, yeah 
 (This mother) 
 Yeah, yeah, yeah 
 (Fucker) 
 Yeah, yeah, yeah 
 (Down) 
 You and your folks love me and my folks 
 Me and my folks love you and your folks 
 Never was poor, that ever ever was poor 
 You and your folks love me and my folks 
 Me and my folks love you and your folks 
 Never was poor, that ever ever was poor"
18,Killer Mike,hiphop,Go Out On The Town,"This the shit that happen when we go out on the town 
 This the shit that happen when we go out on the town 
 Bottles get to poppin' and them bitches get to jocking 
 And the kush bag that we smoking running out 
 (Repeat) 
 (Verse 1 - Killer Mike) 
 Pull up to the club, you can hear the car park 
 Tip your man, so you know I gotta run it 
 Promo dunn already paid my money 
 I'mma make it rain some sugar and honey 
 Bigga baby Bigga baby, ball like a dogg 
 ... Like a t-shirt gang 
 Laying niggas deep, going ""bang bang bang!"" 
 Black T, black t, bottles in the air 
 Submit Verse 
 This the shit that happen when we go out on the town 
 This the shit that happen when we go out on the town 
 Bottles get to poppin' and them bitches get to jocking 
 And the kush bag that we smoking running out 
 (Repeat) 
 Submit Verse 
 This the shit that happen when we go out on the town 
 This the shit that happen when we go out on the town 
 Bottles get to poppin' and them bitches get to jocking 
 And the kush bag that we smoking running out 
 (Repeat) 
 (Young Jeezy) 
 Let go, get the car meet me in the old valley 
 From everything new to the old Chevroley 
 Half of them them bitches ain't got no top 
 Half of them bitches part brand new trucks 
 All them bitches got brand new wheels 
 None of my niggers ain't got no deal 
 None of my niggers ain't got no job 
 All of my niggers got 2-3 cars 
 What you mean nigger ain't got no care 
 Like telling og ain't got no air 
 Don't look nine nigger ...on the stage 
 ...Nigger got a raise 
 How you know a nigg ...all that work 
 ...Why a nigger ain't so hard in the city 
 'Cause they got a 3-4 spots in the city 
 ...On the east, hard on the west, smoke on the south side, 
 ... 
 Yo all know the risk 
 ...To old and it ain't no blood, ain't coping no stone and it ain't no what 
 Hit it in the front and it ain't no coupe, and ... and it ain't no Snoop 
 GA baby wanna smoke that brown, your name ain't Young and this ain't your town 
 None said pussy like the 3 rose, a lot ... free oze 
 None say chips like free do lay, keep playing that ... like go deejay 
 Matter of fact all free all my niggers gotta ... my niggers 
 Know what I did that you might be ... one more time and I might spit eleven 
 This the shit that happen when we go out on the town 
 This the shit that happen when we go out on the town 
 Bottles get to poppin' and them bitches get to jocking 
 And the kush bag that we smoking running out 
 (Repeat)"
19,Killer Mike,hiphop,God In The Building II,"God is still with me (He's still with me) [x4] 
 It's hot like Haiti down in Hades 
 The false prophet say the Lord has forsaken us black babies 
 To make it off a island in Mercedes 
 We going sell it white as Michelangelo's Christ 
 Babies need rice, the baby need beans 
 To feed our babies beans we might have to flip a bean 
 I have sold my people dope yet provided them with hope 
 Sinner and saint, yeah, I did 'em both 
 Yeah I sold a brick on a basketball court 
 And bought the uniforms for the basketball coach 
 Can't wash a way the blood so I put rings on my fingers 
 25 carats symbolize my redeemer 
 And my redeemer's blood is capable of taking Chris Dudus 
 Making him a savior of others 
 My God will take a Sual, fashion him a Pual 
 So only God can judge me and to hell with all y'all 
 I lift my eyes upon the hills 
 From whence cometh my health 
 Only God can judge me 
 And nobody else 
 I beat these streets to make the Devil a lie 
 Marching at hell to the gangster's eye 
 I can feel the fire still everywhere 
 If heaven got a ghetto I'm a make it there 
 The critics ask why Michael never blowed 
 Well, truthfully I met the Devil at the crossroad 
 He offered me success in exchange for my soul 
 He stripped me of my riches, broke me down like Job 
 First he took my car, and then he took my house 
 But he couldn't take the Lord's name out a nigga mouth 
 So then he took my friends, and then he took my fame 
 And then he had my former friends dirty up my name 
 And while he was lying/lion I was Daniel in the den 
 Walking with an angel, a testament to men 
 I can walk on water, I defy the odds 
 The Devil give you fame, but he can't defy my God 
 My God is amazing, I don't need the Masons 
 I just need the junkies and the liars and the thieves 
 I need the pimps, prostitues and pushers out the streets 
 That's where I'm seeking God 'cause that's where he found me 
 That's where I'm seeking God 'cause that's where he found me 
 Amen 
 They tried to tell me ""Don't make these kind of records 
 You're never going to be who you're suppossed to be"" 
 The record that people are most connected to is (God in the Building 1) 
 So I give you (God in the Building 2) 
 I'm a keep doing what I am doing 
 I'm a keep building my testament 
 My empire, my legacy, my way 
 Because I know God moves through me 
 God is in me at all given times 
 So some of you all can shortcut, take whatever road you like to 
 I prefer the high road (high road)"
20,Killer Mike,hiphop,American Dream Prelude,"""The American dream had a price tag and only one man in a million was hungry enough to pay"" 
 Hey man, you can save that morality for your minister 
 And you can save that speech for the sisters of the church 
 This is America, jack 
 This is all about corporate takeovers and money makeovers 
 Wealth matters and poverty doesn't 
 We all say we love Martin Luther King, but we all wanna live like Don King, don't we? 
 God bless America! God bless America! 
 Home of the Rockefellers, home of the Carnegies 
 Home of the end justifies the means, legitimized through larceny 
 ""Fuck the king! Fuck your taxes!"" is what they told their masters 
 Before they became our masters 
 So rebelling against power is natural 
 And being an outlaw is actually..."
21,Killer Mike,hiphop,American Dream,"My American dreams, my American schemes 
 Fueled by American greed 
 My American dreams, my American schemes 
 Fueled by American dreams 
 It's American me, it's American me 
 By any means necessary 
 American me, my American dreams 
 Fueled by American schemes 
 It's American me 
 In America the crooks get the castles 
 Never see a Rothschild or Rockefeller shackled 
 While Rockefeller Drug Laws keep us in a shackle 
 Eventually this weed'll be as legal as tobacco 
 By then every CEO I hope will be a black, though 
 Message to the felon, keep sellin', my brethren 
 The end of an era soon coming I tell 'em 
 Bumpy Johnson showed us the way, don't fail him 
 Big Meech united all the streets, they jailed him 
 Pablo fought the government so they killed him 
 Probably took his bricks and brought 'em to us to deal 'em 
 My critics say I celebrate the dope dealer ... probably 
 'Cause I'm pro whatever prevents me from feeling poverty 
 For the same reason Prescott Bush worked with Nazis 
 The same reason Kennedy's dad ran the rum 
 By any means necessary I will overcome 
 You become a sociopath flipping birds 
 The same mindstate it takes to build a Bilderberg 
 Or an Enron or any other big con 
 That could fleece a million people out of billions 
 I'm trying to get a cheaper price, you know, a bigger bag 
 Mexican work... how American is that? 
 As American as steering in a German car 
 Fucking a Russian chick snorting coke from Colombia"
22,Killer Mike,hiphop,Follow Your Dreams,"(Intro, spoken) 
 The world fears a person with a dream. 
 Because to have a dream gives you the ambition to wanna fulfill wanna that dream 
 And if you live your life fulling that dream, you're gonna glow man. 
 Because there's a magnificence in the moment that comes with fulfilling you dream that you can't achieve being a part of someone else's 
 Follow your dreams no matter what people may say. 
 They gonna talk they gonna front they gonna hate at the end of the day its between you and God cause you know what it takes 
 Follow my dreams and get right back down, two steps forward three steps back round. 
 They keep pulling, I'm pushing, I'm shoving, they showing no love - oh God I need you right now 
 You got famous your love came back up, that's insane 
 The same as you must be to be in this game 
 In this game you suffer, hit strangers 
 Like Usain you bolt towards your dream 
 But haters speak disdain 
 Know my name and your name 
 But one thing's for sure man 
 Success is a sickness and there ain't no cure, man 
 Cure all is work hard and don't take no tours off 
 And even on off days you came back like you're off 
 The payoff is tenfold in dollars and euros 
 Pitfalls of vanity, pride, and your ego 
 Just let go and live up to your full potential 
 What they say is hearsay, it's inconsequential 
 But naysayers say no, but they are so simple 
 That they judge appearances and can't touch the mental 
 They are sheep, they follow shepherds of men 
 Or Malcolm, or Martin; I follow my plan 
 Do it for family, but they don't believe 
 That dreams that you have can even be achieved 
 Get ready young sailor, here's rough on the seas 
 Can't let no doubt or self-pity drown me 
 It's design when you sign and the vultures appear 
 And if you should succeed, it gets worse by the year 
 But the worse curse is failure, it kills by the day 
 Watch your dreams and ambitions as they fade away 
 See, my curse is I'll verse in these verses I verse 
 Will still be overlooked like a body in hearse 
 But this Lazarus rap and this is my rebirth 
 And no paper, just my dream on verse 
 The boot lady told me she dreamed I was cursed 
 Told her, if you can't tell I returned to Earth 
 Returned to the dirt, returned to the essence 
 Cause no weapon formed that gives me a succession 
 (Outro, spoken) 
 I hope you've learned about the business of chasing your dreams out there. 
 I hope you're chasing your dreams till you're exhausted, till your feet hurt, till your bones ache, 
 And till you get it, you're hoping that you won't let it go. 
 I want this to be more than good music to you, I hope it's inspiration for you. 
 Chad Butler told me a few years back, ""fight for your dream, Michael, like a drowning man fightin' for air."""
23,Killer Mike,hiphop,Ready Set Go (Remix),"Hook - T.I.: 
 Hut one, Hut two two 
 Ready set go 
 Make these niggas get right 
 Or get low 
 Hut one, hut two two 
 Ready set go 
 Make these niggas get right 
 Or get low 
 Get low, get low or get right right 
 Holla killer kill for the villa Big Mike Big Mike 
 Get low get low or get right right 
 Holla killer kill for the villa Big Mike Big Mike 
 Verse 1 - Killer Mike: 
 I know these streets bout tired of this weak shit 
 Your style been ran through like a freak bitch 
 The pussy club got you angered with your frequent 
 Ed Hardy ass nigga and ya sequins 
 Might as well shop at Victoria Secret 
 Have 'em gift wrap you some ""I love Pink"" shit 
 Rent due and y'all niggas delinquent 
 You better find another nigga to link with 
 Cause the nigga you link with is a lie fool 
 I used to bully that monkey nigga in high school 
 Sit at the lunch table, steal and eat his damn food 
 The pretty girls, they say, Michael a damn fool 
 I get my work on, and get my flirt on 
 I say fuck 'em he a pussy put a skirt on 'em 
 I say fuck 'em he a pussy put a skirt on 'em 
 (Hook - T.I.) 
 Verse 2 - Big Boi: 
 Nigga, how it's gonna bet bigger? 
 With that nigga the B-I-G and the microphone killer 
 Jack The Ripper all thriller, no filler 
 'Less I'm filling your broad up with nigga 
 I drill her while you finger prick her 
 That means she barely feel a thang when you hit her 
 Boy, drop this thangs like a sabre-tooth tigger, or tiger 
 The prehistoric rap writer 
 And I'm a keep my foot on the neck on all these non-rhyming sack biters 
 The golden arm Johnny Unitas rap titan 
 Boy, your life is like Sterling silver it needs a little shining 
 Steadily styling on you suckas like a hairdo 
 Beauty parlor rapping-ass niggas, we say, ""how dare you? "" 
 I can't stand you 
 You making the game soft like a? 
 I'm blowing this bitch down like I'm Hurrican Andrew 
 It's Dungeon Family and my man's too 
 Grind Time/Grand Hustle, fucker we will drag you 
 (Hook - T.I.) 
 Verse 3 - Killer Mike: 
 I'm the product, of the age of narcotta 
 Which means I'm dope like the pills you swallow 
 Down by law I lead don't follow 
 Grind time, grand hustling for gualla 
 I remain in the game to break lames off 
 Some of them sensitive and some too soft 
 The hood been forced to fuck with y'all by default 
 But now the truth here the bullshit cuts off 
 This is real homie, no fake, no filler 
 One hundred percent grade A killer 
 Something like the bitch that I keep in Villa Rica 
 But I'm a be quiet 'cause they might Mike Vick ya 
 Might catch Mike with a light Mike Vicka 
 Some purple kush that'll get me high like a missile 
 Smoking one deep homie 'cause I don't fuck with you 
 Sincerely from the hustle and grind time official 
 T.I.: 
 Let's go let's go 
 Grand hustle 
 Money on our mind 
 And we ain't going down sucker 
 And Grind time, Hut two and Grand Hustle 
 Send them here got them looking like the king bankhead sucker 
 (Hook - T.I.)"
24,Killer Mike,hiphop,Big Beast,"(Verse 1: Killer Mike) 
 Hardcore G shit, homie, I don't play around 
 Ain't shit sweet 'bout the peach -- this Atlanta, clown 
 Home of the dealers and the strippers and the clubs, though 
 Catch you coming out that Magic City with a snub, ho 
 Lurking in the club on tourist motherfuckers 
 Welcome to Atlanta -- up your jewelry, motherfucker! 
 These monkey niggas looking for some Luda and Jermaine 
 And all a nigga found was a Ruger and some pain 
 Pow, motherfucker, pow! Come up off the chain 
 Pow, motherfucker, pow! One off in the brain 
 We some money-hungry wolves, and we down to eat the rich 
 Your bodyguard ain't shit, we strip him like a stripper bitch 
 These real-ass killers move in silence with violence 
 The minute it set off, we the motherfucking wildest 
 How you from Atlanta that they never speak upon 
 Where everybody got a sack of dope and a gun 
 (Hook: Trouble) 
 And you know just how it go 
 We ain't playing round with that bullshit 
 Nigga, we ain't let that shit go 
 When you come here, you better come correct 
 This real G shit, you gotta show respect 
 (Verse 2: Bun B) 
 Once upon a time in the projects 
 An O.G. saw a young Bun B as a prospect 
 Thought that I would understand the streets from a very young age 
 So he opened up the G code to the front page 
 He sat me on the porch, said, ""This where little dogs sit"" 
 Pointed at the yard, said, ""That's where big dogs shit"" 
 He said, ""Don't leave till your ass get growed 
 And don't come back till your ass get throwed 
 Whatever you want is whatever you can have 
 Bring the pain and leave 'em wet, like they soaking in some salve 
 When you step out on the ave, make sure they wanna see ya 
 Cause being trill is an onomatopoeia 
 Be about it like a G, a hater wanna catch you slipping 
 Try to be a Jordan, but settle for a Pippen"" 
 Player, I ain't even tripping, but I don't really care 
 Cause my pistol's in your face, so put your hands in the air 
 (Verse 3: T.I.) 
 In a six, I'm riding with a pistol grip, banana clip 
 From Simpson Road to Adamsville, I'm repping this Atlanta shit 
 Nigga trying to handle up, let's see can they handle this 
 A hundred round at em, that ain't no Louisiana shit 
 Drinking on that Hennessey, blowing on that cannabis 
 Amerikkka's nightmare, trap nigga fantasy 
 A record full of felonies, searching for a better me 
 But choppers go off in my hood like Iraq, Cuba, Tel Aviv 
 Pretty nigga, let him be -- fuck him, shorty 
 Sucker nigga I'll never be, don't give a fuck about it 
 Quick to round up on that Audi, make 'em get the fuck up out it 
 Nigga better be about it, he deserve it he allow it 
 What's a coward to a kamikaze? 
 He ain't robbed a man, ain't predator or prey; the law of nature where I stay 
 I catch you slipping with that K, ain't no illusion, no confusion 
 Better come up off that cake and all that jewelry or you're snoozing 
 (Verse 4: Killer Mike) 
 Wha-da-da-dang, wha-da-da-da-da-dang 
 Listen to my clip before that five go bang 
 Bang bang, Grindtime, rap game 
 We the readers of the books and the leaders of the crooks 
 Predators, we eyeballing all of y'all lames 
 Let me fall off, I'm taking all of y'all chains 
 All of y'all watches and all of y'all cars 
 Well, who you talking to? All of y'all stars 
 All of y'all rappers and producers and such 
 No homo promo, homie, you might get your ass touched 
 Like Def Jam circa '83, you get rushed 
 If you rolling with some winners, then you rolling with us 
 I know some dumb country niggas, but them niggas ain't we 
 Know they dressing looking hard, but them niggas ain't cheap 
 I don't make dance music, this is R.A.P 
 Opposite of the sucker shit they play on TV"
