,0,1,2,3
72,Rush,rock,Force Ten,"Tough times demand tough talk 
 Demand tough hearts, demand tough songs 
 Tough times demand tough talk 
 Demand tough hearts, demand tough songs 
 Demand 
 We can rise and fall like empires 
 Flow in and out like the tide 
 Be vain and smart, humble and dumb 
 We can hit and miss like pride 
 Just like pride 
 We can circle around like hurricanes 
 Dance and dream like lovers 
 Attack the day like birds of prey 
 Or scavengers undercover 
 Undercover 
 Look in 
 To the eye of the storm 
 Look out 
 For the force without form 
 Look around 
 At the sight and sound 
 Look in, look out, look around 
 Tough times demand tough talk 
 Demand tough hearts, demand tough songs 
 Demand 
 We can move with savage grace 
 To the rhythms of the night 
 Cool and remote like dancing girls 
 In the heat of the beat and the lights 
 And the lights 
 We can wear the rose of romance 
 An air of joie de vivre 
 Too tender hearts upon our sleeves 
 Or skin as thick as thieves 
 Thick as thieves 
 Look in 
 To the eye of the storm 
 Look out 
 For the force without form 
 Look around 
 (Rising, falling at force ten) 
 At the sight and sound 
 (We twist the world and ride the wind) 
 Look in, look out, look around 
 Tough times demand tough talk 
 Demand tough hearts, demand tough songs 
 Demand 
 Look in 
 To the eye of the storm 
 Look out 
 For the force without form 
 Look around 
 At the sight and sound 
 Look in 
 Look the storm in the eye 
 Look out 
 To the sea and the sky 
 Look around 
 At the sight and sound 
 Look in, look out, look around 
 Tough times demand tough hearts 
 Tough times demand tough talk"
73,Rush,rock,Time Stand Still,"I turn my back to the wind 
 To catch my breath 
 Before I start off again 
 Driven on without a moment to spend 
 To pass an evening 
 With a drink and a friend 
 I let my skin get too thin 
 I'd like to pause 
 No matter what I pretend 
 Like some pilgrim 
 Who learns to transcend 
 Learns to live as if each step was the end 
 (Time, stand still) 
 I'm not looking back, but I want to look around me now 
 (Time, stand still) 
 See more of the people and the places that surround me now 
 Time, stand still 
 Freeze this moment a little bit longer 
 Make each sensation a little bit stronger 
 Experience slips away 
 Experience slips away 
 Time, stand still 
 I turn my face to the sun 
 I close my eyes 
 I let my defenses down 
 All those wounds that I can't get unwound 
 I let my past go too fast 
 No time to pause 
 If I could slow it all down 
 Like some captain 
 Whose ship runs aground 
 I can wait until the tide comes around 
 (Time, stand still) 
 I'm not looking back, but I want to look around me now 
 (Time, stand still) 
 See more of the people and the places that surround me now 
 Time, stand still 
 Freeze this moment a little bit longer 
 Make each sensation a little bit stronger 
 Make each impression a little bit stronger 
 Freeze this motion a little bit longer 
 The innocence slips away 
 The innocence slips away 
 Time, stand still 
 Time, stand still 
 I'm not looking back, but I want to look around me now 
 See more of the people and the places that surround me now 
 Time, stand still 
 Summer's going fast, nights growing colder 
 Children growing up, old friends growing older 
 Freeze this moment a little bit longer 
 Make each sensation a little bit stronger 
 Experience slips away 
 Experience slips away 
 The innocence slips away"
74,Rush,rock,Open Secrets,"It went right by me 
 At the time it went over my head 
 I was looking out the window 
 I should have looked 
 At your face instead 
 It went right by me 
 Just another wall 
 There should have been a moment 
 When we let our barriers fall 
 I never meant what you're thinking 
 That's not what I meant at all 
 Well I guess we all have these feelings 
 We can't leave unreconciled 
 Some of them burned on our ceilings 
 Some of them learned as a child 
 The things that we're concealing 
 Will never let us grow 
 Time will do its healing, you've got to let it go 
 Closed for my protection 
 Opened to your scorn 
 Between these two directions 
 My heart is sometimes torn 
 I lie awake with my secrets 
 Spinning around my head 
 Something that somehow escaped me 
 Something you shouldn't have said 
 I was looking out the window 
 I should have looked at your face instead 
 Well I guess we all have these feelings 
 We can't leave unreconciled 
 Some of them burned on our ceilings 
 Some of them learned as a child 
 The things that we're concealing 
 Will never let us grow 
 Time will do its healing, you've got to let it go 
 Let it go 
 I find no absolution 
 In my rational point of view 
 Maybe somethings are instinctive 
 But there's one thing  you could do 
 You could try to understand me 
 I could try to understand you 
 You could try to understand me 
 I could try to understand you 
 Well I guess we all have these feelings 
 We can't leave unreconciled 
 Some of them burned on our ceilings 
 Some of them learned as a child 
 The things that we're concealing 
 Will never let us grow 
 Time will do its healing, you've got to let it go 
 Let it go 
 Let it go 
 Let it go"
75,Rush,rock,Second Nature,"A memo to a higher office 
 Open letter to the powers that be 
 To a god, a king, a head of state 
 A captain of industry 
 To the movers and the shakers 
 Can't everybody see? 
 It ought to be a second nature 
 I mean the places where we live 
 Let's talk about this sensibly 
 We're not insensitive 
 I know progress has no patience 
 But something's got to give 
 I know you're different 
 You know I'm the same 
 We're both too busy 
 To be taking the blame 
 I'd like some changes 
 But you don't have the time 
 We can't go on thinking 
 It's a victimless crime 
 No one is blameless 
 But we're all without shame 
 We fight the fire 
 While we're feeding the flames 
 Folks have got to make choices 
 And choices got to have voices 
 Folks are basically decent 
 Conventional wisdom would say 
 Well we read about the exceptions 
 In the papers everyday 
 It ought to be second nature 
 At least that's what I feel 
 Now I lay me down in dreamland 
 I know perfect's not for real 
 I thought we might get closer 
 But I'm ready to make a deal 
 Today is different 
 And tomorrow the same 
 It's hard to take the world 
 The way that it came 
 Too many rapids 
 Keep us sweeping along 
 Too many captains 
 Keep on steering us wrong 
 It's hard to take the heat 
 It's hard to lay blame 
 To fight the fire 
 While we're feeding the flames 
 It ought to be second nature 
 At least that's what I feel 
 Now I lay me down in dreamland 
 I know perfect's not for real 
 I thought we might get closer"
76,Rush,rock,Prime Mover,"Basic elemental 
 Instinct to survive 
 Stirs the higher passions 
 Thrill to be alive 
 Alternating currents 
 In a tidewater surge 
 Rational resistance 
 To an unwise urge 
 Anything can happen 
 From the point of conception 
 To the moment of truth 
 At the point of surrender 
 To the burden of proof 
 From the point of ignition 
 To the final drive 
 The point of the journey 
 Is not to arrive 
 Anything can happen 
 Basic temperamental 
 Filters on our eyes 
 Alter our perceptions 
 Lenses polarize 
 Alternating currents 
 Force a show of hands 
 Rational responses 
 Force a change of plans 
 Anything can happen 
 From a point on the compass 
 To magnetic north 
 The point of the needle 
 Moving back and forth 
 From the point of entry 
 Until the candle is burned 
 The point of departure is not to return 
 Anything can happen 
 I set the wheels in motion 
 Turn up all the machines 
 Activate the programs 
 And run behind the scenes 
 I set the clouds in motion 
 Turn up light and sound 
 Activate the window 
 Watch the world go 'round 
 From the point of conception 
 To the moment of truth 
 At the point of surrender 
 To the burden of proof 
 From the point of ignition 
 To the final drive 
 The point of the journey 
 Is not to arrive 
 Anything can happen 
 Anything can happen 
 Anything can happen 
 Anything can happen 
 Anything can happen 
 The point of surrender 
 Anything can happen 
 The point of the journey 
 Anything can happen"
77,Rush,rock,Lock And Key,"I don't want to face 
 The killer instinct 
 Face it in you or me 
 We carry a sensitive cargo 
 Below the waterline 
 Ticking like a time bomb 
 With a primitive design 
 Behind the finer feelings 
 This civilized veneer 
 The heart of a lonely hunter 
 Guards a dangerous frontier 
 The balance can sometimes fail 
 Strong emotions can tip the scale 
 Don't want to silence 
 A desperate voice 
 For the sake of security 
 No one wants to make 
 A terrible choice 
 On the price of being free 
 I don't want to face 
 The killer instinct 
 Face it in you or me 
 So we keep it under lock and key 
 Lock and key 
 It's not a matter of mercy 
 It's not a matter of laws 
 Plenty of people will kill you 
 For some fanatical cause 
 It's not a matter of conscience 
 A search for probable cause 
 It's just a matter of instinct 
 A matter of fatal flaws 
 No reward for resistance 
 No assistance, no applause 
 I don't want to face 
 The killer instinct 
 Face it in you or me 
 So we keep it under lock and key 
 I don't want to face 
 The killer instinct 
 Face it in you or me 
 So we keep it under lock and key 
 Lock and key 
 Don't want to silence 
 A desperate voice 
 For the sake of security 
 No one wants to make 
 A terrible choice 
 On the price of being free 
 I don't want to face 
 The killer instinct 
 Face it in you or me 
 So we keep it under lock and key 
 I don't want to face 
 The killer instinct 
 Face it in you or me 
 So we keep it under lock and key 
 Lock and key 
 We don't want to be victims 
 On that we all agree 
 So we lock up the killer instinct 
 And throw away the key"
78,Rush,rock,Mission,"Hold your fire 
 Keep it burning bright 
 Hold the flame 'til the dream ignites 
 A spirit with a vision is a dream with a mission 
 I hear their passionate music 
 Read the words that touch my heart 
 I gaze at their feverish pictures 
 The secrets that set them apart 
 When I feel the powerful visions 
 Their fire has made alive 
 I wish I had that instinct 
 I wish I had that drive 
 Spirits fly on dangerous missions 
 Imaginations on fire 
 Focussed high on soaring ambitions 
 Consumed in a single desire 
 In the grip of a nameless possesion 
 A slave to the drive of obsession 
 A spirit with a vision 
 Is a dream with a mission 
 I watch their images flicker 
 Bringing life to a lifeless screen 
 I walk through their beautiful buildings 
 And I wish I had their dreams 
 But dreams don't need to have motion 
 To keep their spark alive 
 Obsession has to have action 
 Pride turns on the drive 
 Spirits fly on dangerous missions 
 Imaginations on fire 
 Focussed high on soaring ambitions 
 Consumed in a single desire 
 In the grip of a nameless possesion 
 A slave to the drive of obsession 
 A spirit with a vision 
 Is a dream with a mission 
 It's cold comfort 
 To the ones without it 
 To know how they struggled 
 How they suffered about it 
 If their lives were exotic and strange 
 They would likely have gladly exchanged them 
 For something a little more plain 
 Maybe something a little more sane 
 We each pay a fabulous price 
 For our visions of paradise 
 But a spirit with a vision 
 Is a dream with a mission 
 A spirit with a vision 
 Is a dream"
79,Rush,rock,Turn The Page,"Nothing can survive in a vacuum 
 No one can exist all alone 
 We pretend things only happen to strangers 
 We've all got problems of our own 
 It's enough to learn to share our pleasures 
 We can't soothe pain with sympathy 
 All that we can do is be reminded 
 We shake our heads at the tragedy 
 Every day we're standing in a time capsule 
 Racing down a river from the past 
 Every day we're standing in a wind tunnel 
 Facing down the future coming fast 
 It's just the age 
 It's just a stage 
 We disengage 
 We turn the page 
 Looking at the long-range forecast 
 Catching all the names in the news 
 Checking out the state of the nation 
 Learning the environmental views 
 Truth is after all a moving target 
 Hairs to split and pieces that don't fit 
 How can anybody be enlightened? 
 Truth is after all so poorly lit 
 Every day we're standing in a time capsule 
 Racing down a river from the past 
 It's just the age 
 It's just a stage 
 We disengage 
 We turn the page 
 We turn the... 
 It's just the age 
 It's just a stage 
 We disengage 
 We turn the page 
 Every day we're standing in a time capsule 
 We disengage 
 We turn the page 
 Racing down a river from the past 
 Every day we're standing in a wind tunnel 
 It's just a stage 
 We disengage 
 We turn the page 
 Facing down the future coming fast 
 Every day we're standing in a time capsule 
 It's just a stage 
 We disengage 
 We turn the page 
 Racing down a river from the past 
 (It's just a stage) 
 Every day we're standing in a wind tunnel 
 It's just a stage 
 We disengage 
 We turn the page"
80,Rush,rock,Tai Shan,"High on the sacred mountain 
 Up the seven thousand stairs 
 In the golden light of autumn 
 There was magic in the air 
 Clouds surrounded the summit 
 The wind blew strong and cold 
 Among the silent temples 
 And the writings carved in gold 
 Somewhere in my instincts 
 The primitive took hold 
 I stood at the top of the mountain 
 And China sang to me 
 In the peaceful haze of harvest time 
 A song of eternity 
 If you raise your hands to heaven 
 You will live a hundred years 
 I stood there like a mystic 
 Lost in the atmosphere 
 The clouds were suddenly parted 
 For a moment I could see 
 The patterns of the landscape 
 Reaching for the eastern sea 
 I looked upon a presence 
 Spanning forty centuries 
 I stood at the top of the mountain 
 And China sang to me 
 In the peaceful haze of harvest time 
 A song of eternity 
 I thought of time and distance 
 The hardships of history 
 I heard the hope and the hunger 
 When China sang to me 
 When China sang to me"
81,Rush,rock,High Water,"When the waters rose in the darkness 
 In the wake of the endless flood 
 It flowed into our memory 
 It flowed into our blood 
 When something broke the surface 
 Just to see the starry dome 
 We still feel that relation 
 When the water takes us home 
 In the flying spray of the ocean 
 The water takes you home 
 The water takes you home 
 Springing from the weight of the mountains 
 Like the heart of the Earth would burst 
 Flowing out from marble fountains 
 In the dreams of a desert thirst 
 Something swam through the jungles 
 Where the mighty rivers roam 
 Something breaks the silence 
 When the water takes you home 
 I hear, hear the wordless voices 
 When the water takes me home 
 When the water takes me home 
 Waves that crash on the shoreline 
 Torrents of tropical rain 
 Streaming down beyond our memory 
 Streaming down inside our veins 
 When something left the ocean 
 To crawl high above the foam 
 We still feel that elation 
 When the water takes us home 
 In a driving rain of redemption 
 The water takes me home 
 The water takes me home 
 Take me home"
82,Rush,rock,Intro,Hello... Hello!...HELLO!
83,Rush,rock,Show Don't Tell,"How many times do you hear it? 
 It goes on all day long 
 Everyone knows everything 
 And no one's ever wrong 
 Until later 
 Who can you believe? 
 It's hard to play it safe 
 But apart from a few good friends 
 We don't take anything on faith 
 Until later 
 Show don't tell 
 SHOW ME DON'T TELL ME 
 You've figured out the score 
 SHOW ME DON'T TELL ME 
 I've heard it all before 
 SHOW ME DON'T TELL ME 
 I don't care what you say 
 SHOW ME DON'T TELL ME 
 You can twist perceptions 
 Reality won't budge 
 You can raise objections 
 I will be the judge 
 And the jury 
 I'll give it due reflection 
 Watching from the fence 
 Give the jury direction 
 Based on the evidence 
 I, the jury 
 Show don't tell 
 SHOW ME DON'T TELL ME 
 Hey - order in the court 
 SHOW ME DON'T TELL ME 
 Let's try to keep it short 
 SHOW ME DON'T TELL ME 
 Enough of your demands 
 SHOW ME DON'T TELL ME 
 Witness take the stand 
 SHOW ME DON'T TELL ME 
 Show don't tell 
 Show (show) 
 Don't tell (don't tell) 
 Show (show) 
 Don't tell (don't tell) 
 SHOW ME DON'T TELL ME 
 Hey - order in the court 
 SHOW ME DON'T TELL ME 
 Let's try to keep it short 
 SHOW ME DON'T TELL ME 
 I don't care what you say 
 SHOW ME DON'T TELL ME 
 Let's see exhibit A 
 SHOW ME DON'T TELL ME 
 You've figured out the score 
 SHOW ME DON'T TELL ME 
 I've heard it all before 
 SHOW ME DON'T TELL ME 
 Enough of your demands 
 SHOW ME DON'T TELL ME 
 Witness take the stand 
 SHOW ME DON'T TELL ME 
 Hey - order in the court 
 SHOW ME DON'T TELL ME 
 Let's try to keep it short 
 SHOW ME DON'T TELL ME 
 I don't care what you say"
84,Rush,rock,Chain Lightning,"Energy is contagious 
 Enthusiasm spreads 
 Tides respond to lunar gravitation 
 Everthing turns in synchronous relation 
 Laughter is infectious 
 Excitement goes to my head 
 Winds are stirred by planets in rotation 
 Sparks ignite and spread new information 
 Respond, vibrate, feed back, andresonate 
 Sundogs fire on the horizon 
 Meteor rain stars across the night 
 This moment may be brief 
 But it can be so bright 
 Hope is epidemic 
 Optimism spreads 
 Bitterness breeds irritation 
 Ignorance breeds imitation 
 Respond, vibrate, feed back, and resonate 
 Sun dogs fire on the horizon 
 Meteor rain stars across the night 
 This moment may be brief 
 But it can be so bright 
 Reflected in another source of light 
 When the moment dies 
 The spark still flies 
 Reflected in another pair of eyes 
 Dreams are somtimes catching 
 Desire goes to my head 
 Love responds to your invitation 
 Love responds to imagination 
 Respond, vibrate, feed back and resonate 
 Respond, vibrate, feed back and resonate 
 Sun dogs fire on the horizon 
 Meteor rain stars across the night 
 This moment may be brief 
 But it can be so bright 
 Reflected in another source of light 
 When the moment dies 
 The spark still flies 
 Reflected in another pair of eyes 
 Reflected in another source of light 
 When the moment dies 
 The spark still flies 
 Reflected in another pair of eyes 
 Reflected in another source of light 
 When the moment dies 
 The spark still flies 
 Reflected in another pair of eyes 
 (That's nice)"
85,Rush,rock,The Pass,"Proud swagger out of the schoolyard 
 Waiting for the world's applause 
 Rebel without a conscience 
 Martyr without a cause 
 Static on your frequency 
 Electrical storm in your veins 
 Raging an unreachable glory 
 Straining at invisible chains 
 And now you're trembling on a rocky ledge 
 Staring down into a heartless sea 
 Can't face life on a razor's edge 
 Nothing's what you thought it would be 
 All of us get lost in the darkness 
 Dreamers learn to steer by the stars 
 All of us do time in the gutter 
 Dreamers turn to look at the cars 
 Turn around and turn around and turn around 
 Turn around and walk the razor's edge 
 Don't turn your back and slam the door on me 
 It's not as if this barricade 
 Blocks the only road 
 It's not as if you're all alone 
 In wanting to explode 
 Someone set a bad example 
 Made surrender seem all right 
 The act of a noble warrior 
 Who lost the will to fight 
 And now you're trembling on a rocky ledge 
 Staring down into a heartless sea 
 Done with life on a razor's edge 
 Nothing's what you thought it would be 
 All of us get lost in the darkness 
 Dreamers learn to steer by the stars 
 All of us do time in the gutter 
 Dreamers turn to look at the cars 
 Turn around and turn around and turn around 
 Turn around and walk the razor's edge 
 Don't turn your back and slam the door on me 
 No hero in your tragedy 
 No daring in your escape 
 No salutes for your surrender 
 Nothing noble in your fate 
 Christ, what have you done? 
 All of us get lost in the darkness 
 Dreamers learn to steer by the stars 
 All of us do time in the gutter 
 Dreamers turn to look at the cars 
 Turn around and turn around and turn around 
 Turn around and walk the razor's edge 
 Turn around and walk the razor's edge 
 Turn around and walk the razor's edge 
 Don't turn your back and slam the door on me"
86,Rush,rock,War Paint,"Girl before the mirror 
 Appraises her disguise 
 Child become a mother 
 Tries to fix her eyes 
 No more of his excuses 
 It has to be today 
 She can keep her fantasy 
 If she can get away 
 Paint her name on a one-way street 
 Painted cheeks with angry heat 
 Wounded pride on painted eyes 
 Paint the night with battle cries 
 All puffed up with vanity 
 We see what we want to see 
 To the beautiful and the wise 
 The mirror always lies 
 The mirror always lies 
 Boy before the mirror 
 Checks his camouflage 
 Polishes his armor 
 And the charger in the garage 
 No more lame excuses 
 It has to be tonight 
 He can take the princess 
 If he can take the fight 
 Pound the drums with martial beat 
 Pound the streets with marching feet 
 Wounded pride, distorted eyes 
 Paint the night with battle cries 
 All puffed up with vanity 
 We see what we want to see 
 To the powerful and the wise 
 The mirror always lies 
 The mirror always lies 
 Boys and girls together 
 Mistake conceit for pride 
 Ambition for illusion 
 Dreams for self-delusion 
 Girls and boys together 
 See what it is we lack 
 Boys and girls together 
 Let's paint the mirror black 
 Paint it black 
 All puffed up with vanity 
 We see what we want to see 
 To the beautiful and the wise 
 The mirror always lies 
 The mirror always lies 
 The mirror always lies 
 Boys and girls together 
 Paint the mirror black 
 The mirror always lies 
 Girls and boys together 
 Paint the mirror black 
 The mirror always lies 
 Boys and girls together 
 Paint the mirror black 
 The mirror always lies 
 Girls and boys together 
 Paint the mirror black 
 The mirror always lies 
 Boys and girls together 
 Paint the mirror black 
 The mirror always lies 
 Girls and boys together 
 Paint the mirror black 
 The mirror always lies 
 Boys and girls together 
 Paint the mirror black 
 The mirror always lies 
 Girls and boys together..."
87,Rush,rock,Scars,"Hey 
 I've stood upon my mountaintop 
 And shouted at the sky 
 Walked above the pavement 
 With my senses amplified 
 I get this feeling 
 All my nerves are naked wires 
 Tender to the touch 
 Sometimes super sensitive 
 But who can care too much? 
 I get this feeling 
 Scars of pleasure 
 Scars of pain 
 Atmospheric changes 
 Make them sensitive again 
 Scars of pleasure 
 Scars of pain 
 Atmospheric changes 
 Make them sensitive again 
 Each emotional injury 
 Leaves behind it's mark 
 Sometimes they come tumbling out 
 Like shadows in the dark 
 I get this feeling 
 When I think about all I have seen 
 And all I've never seen 
 When I think about the people 
 Who have opened up to me 
 I get this feeling 
 Scars of pleasure 
 Scars of pain 
 Atmospheric changes 
 Make them sensitive again 
 Scars of pleasure 
 Scars of pain 
 Atmospheric changes 
 Make them sensitive again 
 Snow falls deep around my house 
 And holds the winter light 
 I've heard the lions hunting 
 In the Serengeti night 
 I get this feeling 
 Forests turned to factories 
 And river, sea, and sky 
 Hungry child in the desert 
 And the flies that cloud her eyes 
 I get this feeling 
 Scars of pleasure 
 Scars of pain 
 Atmospheric changes 
 Make them sensitive again 
 Scars of pleasure 
 Scars of pain 
 Atmospheric changes 
 Make them sensitive again 
 Scars of pleasure 
 Scars of pain 
 Atmospheric changes 
 Make them sensitive again 
 Scars of pleasure 
 Scars of pain 
 Atmospheric changes 
 Make them sensitive again 
 Pleasure leaves a fingerprint 
 As surely as mortal pain 
 In memories they resonate 
 And echo back again 
 Scars of pleasure 
 Scars of pain 
 Atmospheric changes 
 Make them sensitive again 
 Scars of pleasure 
 Scars of pain 
 Atmospheric changes 
 Make them sensitive again 
 Scars of pleasure 
 Scars of pain 
 Atmospheric changes 
 Make them sensitive again"
88,Rush,rock,Presto,"If I could wave my magic wand... 
 I am made from the dust of the stars 
 And the oceans flow in my veins 
 Here I hide in the heart of the city 
 Like a stranger coming out of the rain 
 The evening plane rises up from the runway 
 Over constellations of light 
 I look down into a million houses 
 And wonder what you're doing tonight 
 If I could wave my magic wand 
 I'd make everything all right 
 I'm not one to believe in magic 
 But I sometimes have a second sight 
 I'm not one with a sense of proportion 
 When my heart still changes overnight 
 I had a dream of a winter garden 
 A midnight rendezvous 
 Silver, blue, and frozen silence 
 What a fool I was for you 
 I had a dream of the open water 
 I was swimming away out to sea 
 So deep I could never touch bottom 
 What a fool I used to be 
 If I could wave my magic wand 
 I'd set everybody free 
 I'm not one to believe in magic 
 Though my memory has a second sight 
 I'm not one to go pointing my finger 
 When I radiate more heat than light 
 Don't ask me, I'm just improvising 
 My illusion of careless flight 
 Can't you see my temperature's rising 
 I radiate more heat than light 
 Don't ask me I'm just sympathizing 
 My illusion's a harmless flight 
 Can't you see my temperature's rising 
 I radiate more heat than light 
 I'm not one to believe in magic 
 But I sometimes have a second sight 
 I'm not one with a sense of proportion 
 When my heart still changes overnight 
 I'm not one to believe in magic 
 (If I could wave my magic wand...) 
 Though my memory has a second sight 
 (I'd make everything all right) 
 I'm not one to go pointing my finger 
 (If I could wave my magic wand...) 
 When I radiate more heat than light 
 (I'd set everybody free!) 
 I'm not one to believe in magic 
 (If I could wave my magic wand...) 
 I'm not one to believe in magic"
