,0,1,2,3
0,Rush,rock,Finding My Way,"Yeah, oh yeah 
 Ooh, said I 
 I'm comin' out to get you 
 Ooh, sit down 
 I'm comin' out to find you 
 Ooh, yeah. Oh yeah 
 Findin' my way 
 I've been gone so long 
 I've lost count of the years 
 Well I've sang some sad songs 
 Oh yes, and cried some bad tears 
 Look out, I'm comin' 
 Whoa, whoa 
 Look out I'm comin' 
 Whoa, yeah 
 I'm runnin' 
 Finding my way back home 
 Oh yeah 
 Yeah, oh yeah 
 Ooh said I 
 I'm comin' back to look for you 
 Ooh sit down 
 I'm comin' by the back door 
 Ooh, yeah, ooh yeah 
 Findin' my way 
 You've done me no right 
 But you've done me some wrong 
 Left me lonely each night 
 While I sing my sad song 
 Look out, I'm comin' 
 Whoa, whoa 
 Look out, I'm comin' 
 Whoa, yeah 
 I'm runnin' 
 Findin' my way back home 
 I'm comin' 
 Ooh babe, I said I'm runnin' 
 Whoa babe, I said I'm comin' 
 To get you, mama 
 Said I'm runnin' 
 Ooh babe, I said I'm comin' 
 Back for you babe 
 I said I'm runnin' 
 Ooh yes, babe, I said I'm comin' 
 To get you babe, I said I'm comin' 
 Ooh yeah 
 I'm findin' 
 Finding my way back home 
 Well, I've had it for now 
 Livin' on the road 
 Ooh, yeah 
 Ooh, yeah 
 I'm findin' 
 Finding my way back home 
 Well, I've had it for now 
 Livin' on the road 
 Ooh, yeah 
 Ooh, yeah 
 Ey, yeah 
 Yeah, oh yeah 
 Ooh, said I 
 I'm comin' out to get you 
 Ooh, sit down 
 I'm comin' out to find you 
 Ooh, yeah, ooh yeah 
 Findin' my way"
1,Rush,rock,Need Some Love,"I'm runnin' here 
 I'm runnin' there 
 I'm lookin' for a girl 
 'Cause there's nothing I need 
 There's nothing I want more 
 In the whole wide world 
 Well I need it quick 
 And I need it now 
 Before I start to fade away 
 That's why I'm searchin' 
 That's why I'm lookin' 
 Each and every day 
 Ooh I need some love 
 I said I need some love 
 Ooh yes I need some love 
 This feeling I can't rise above 
 Yeah, yeah 
 Well I been hustlin' here 
 I been hustlin' there 
 I been searchin' for about a week 
 And I started feeling this strange sensation 
 My knee's are startin' gettin' weak 
 Well I need what keeps 
 A young man alive 
 I said I need it now 
 I'm gonna get my message across to you 
 Someway, somehow 
 Ooh I need some love 
 I said I need some love 
 Ooh yes I need some love 
 This feelin' I can't rise above 
 Ooh yeah yeah 
 Ooh I need some love 
 I said I need some love 
 Ooh yes I need some love 
 This feelin' I can't rise above 
 Ooh yeah yeah yeah"
2,Rush,rock,Take A Friend,"Well I'm lookin' at you 
 And I'm wondering what you're gonna do 
 Looks like you've got no friends 
 No one to stick with you to the end 
 Take yourself a friend 
 Keep 'em till the end 
 Whether woman or man 
 It makes you feel so good 
 So good 
 Yes you think you're all right 
 And now you're lonely every night 
 Well you need a friend 
 Someone on whom you can always depend 
 Take yourself a friend 
 Keep 'em till the end 
 Whether woman or man 
 It makes you feel so good 
 So good 
 Yes you need some advice 
 Well let me put it to you nice 
 I said you need a friend 
 Someone who'll stick with you to the end 
 Take youself a friend 
 Keep 'em till the end 
 Whether woman or man 
 It makes you feel so good 
 Take youself a friend 
 Keep 'em till the end 
 Whether woman or man 
 It makes you feel so good 
 Yeah yeah yeah yeah 
 Take youself a friend 
 Yeah yeah, yeah yeah 
 Keep 'em till the end, whoa-whoa 
 Whether woman or man 
 It makes you feel so good 
 So good"
3,Rush,rock,Here Again,"I said I played this song 
 So many times before 
 That the melody keeps repeating 
 Growing new ideas 
 Flowing chords and notes 
 Like a mountain river bleeding 
 Well I say as I look back 
 And all the thoughts I've had 
 They reflect just what I'm learning 
 Yes, you know that the hardest part 
 Yes, I say it is to stay on top 
 On top of a world forever churning 
 Whoa yeah, oh yeah 
 Well, you say you laugh 
 But I can see that your eyes are blind 
 Well do you see, can't you see, can't you see what I'm feeling? 
 Yes I've seen your face before 
 Why, I've said I've seen it everywhere 
 Showing up to me without a scent revealing 
 Well, I said will it ever change? 
 Well yes lord I said will it stay the same? 
 I'd surely like to know before it's over 
 Well, I said I play this song 
 Yes I said it won't be long 
 Won't be long before I stop and play it over 
 Oh, oh I've, I've seen your face before 
 Is it ever gonna, ever gonna change again? 
 And I, oh I, I've been in one place to long 
 Is it ever gonna, ever gonna change again? 
 Oh oh 
 Well I, oh I, I've seen your face before 
 Is it ever gonna, ever gonna change again? 
 And I, oh I, I've been in one place to long 
 Is it ever gonna, ever gonna change again?"
4,Rush,rock,What You're Doing,"Well I see you standing there 
 With your finger in the air 
 Everything we do 
 You wanna leave it up to you 
 Who do you think you are 
 You think you wanna start 
 Try to run the town 
 Always try to put us down 
 Well you think that you're right 
 You think you're out of sight 
 Tell me something mister 
 Why do you have to make us so uptight? 
 Well you say you've been tryin' 
 You know that you're lyin' 
 I think you need some groovin' 
 Who do you think you're foolin' now? 
 Well you better start changin' 
 You're life needs rearrangin' 
 You better do some talkin' 
 Or you better do some walkin' now 
 Yeah you think that you're right 
 You think you're out of sight 
 Tell me something mister 
 Why do you have to put us so uptight? 
 I know what you're doing 
 All that you've been doing wrong 
 I don't know what you're feelin' 
 Oh, but you been feelin' long 
 Well you say that you're right 
 Tell me something mister 
 Why do you have to make us so uptight? 
 Whoa yeah 
 Well I know what you're doing 
 All that you've been doing wrong 
 I don't know what you're feelin' 
 Oh, but you been feelin' long 
 Well you think that you're right 
 Tell me something mister 
 Why do you have to put us so uptight? 
 Yeah yeah"
5,Rush,rock,In The Mood,"Ah hey now baby 
 Well I like your smile 
 Won't you come and talk to me 
 For a little while 
 Well you're makin me crazy 
 The way you roll them eyes 
 Won't you come and sit with me 
 I'll tell you all my lies 
 Hey baby it's a quarter to eight 
 I feel I'm in the mood 
 Hey baby, the hour is late 
 I feel I've got to move 
 Well ah hey now baby 
 Don't ya talk so fast 
 I'm just tryin to make this good time 
 I'm tryin to make it last 
 Everything's gettin hazy 
 Now honey where'd you go 
 I just want to find out baby 
 Where'd you learn what you know 
 Hey baby it's a quarter to eight 
 I feel I'm in the mood 
 Hey baby, the hour is late 
 I feel I've got to move 
 Hey baby it's a quarter to eight 
 I feel I'm in the mood 
 Hey baby, the hour is late 
 I feel I've got to move 
 Well ah hey now baby 
 I said I like your style 
 You really got me baby 
 Way down deep inside 
 Ooh ya drive me crazy 
 Baby you're the one 
 I just wanna rock and roll you woman 
 Until the night is done 
 Hey baby it's a quarter to eight 
 I feel I'm in the mood 
 Hey baby, the hour is late 
 I feel I've got to move 
 Yes I do"
6,Rush,rock,Before And After,"Love won't see my comin' 
 On a Sunday noon today 
 I still don't believe we're fadin' 
 But now the world should wait 
 And now you're finally listenin' 
 To what I have to say 
 Well the time is right 
 And it is today 
 Yeah, yeah, yeah, yeah 
 Maybe we could talk about it 
 And try to get it straight 
 After all these years baby 
 Maybe it's too late 
 But I really need to 
 Have you by my side 
 And that's the only feeling 
 Baby I can't hide 
 Yeah, yeah, yeah, yeah 
 Well you aren't listenin' 
 I ain't talkin' 
 We ain't gettin' nowhere 
 I keep tryin' to get 
 Through to you baby 
 All you do is stare 
 I don't wanna see that 
 I need you by my side 
 Well I don't wanna be your lover 
 Babe, I wanna be your man 
 Yeah, yeah, yeah, yeah 
 Well now my story's over baby 
 And I ain't gonna tell it twice 
 Well you better start listenin' 
 Or get out of my life 
 (sounds more like ""Hell yeah, to my advice"") 
 Or you're gonna be left out 
 I said left out in the cold 
 Yeah, before you get my lovin' babe 
 You'll be too old 
 Yeah, yeah, yeah, yeah 
 Yeah, yeah, yeah, yeah 
 Well I'm talkin' to you baby 
 Well, I said 
 Yeah, yeah, yeah, yeah, yeah"
7,Rush,rock,Working Man,"Well I get up at seven, yeah 
 And I go to work at nine 
 I got no time for livin' yes 
 I'm workin' all the time 
 It seems to me 
 I could live my life 
 A lot better than I think I am 
 I guess that's why they call me 
 They call me the working man 
 They call me the working man 
 I guess that's what I am 
 I get home at five o'clock 
 And I take myself out a nice cold beer 
 Always seem to be wonderin' 
 Why there's nothin' goin' down here 
 It seems to me 
 I could live my life 
 A lot better than I think I am 
 I guess that's why they call me 
 The workin' man 
 Well they call me the working man 
 I guess that's what I am 
 Well they call me the working man 
 I guess that's what I am 
 Well I get up at seven yeah 
 And I go to work at nine 
 I got no time for livin' yes 
 I'm workin' all the time 
 It seems to me 
 I could live my life 
 A lot better than I think I am 
 I guess that's why they call me 
 They call me the working man 
 Well they call me the working man 
 I guess that's what I am 
 They call me the working man 
 I guess that's what I am"
8,Rush,rock,Anthem,"Know your place in life is where you want to be 
 Don't let them tell you that you owe it all to me 
 Keep on looking forward, no use in looking 'round 
 Hold your head above the crowd and they won't bring you down 
 Anthem of the heart and anthem of the mind 
 A funeral dirge for eyes gone blind 
 We marvel after those who sought 
 The wonders in the world, wonders in the world 
 Wonders in the world they wrought 
 Live for yourself 
 There's no one else more worth living for 
 Begging hands and bleeding hearts 
 Will only cry out for more 
 Anthem of the heart and anthem of the mind 
 A funeral dirge for eyes gone blind 
 We marvel after those who sought 
 The wonders in the world, wonders in the world 
 Wonders in the world they wrought 
 Well, I know they've always told you 
 Selfishness was wrong 
 Yet it was for me, not you 
 I came to write this song 
 Anthem of the heart and anthem of the mind 
 A funeral dirge for eyes gone blind 
 We marvel after those who sought 
 The wonders in the world, wonders in the world 
 Wonders in the world they wrought, wrought, wrought"
9,Rush,rock,Best I Can,"I've got a livin' that's rough, a future that's tough 
 You know what I mean 
 Blankers and boasters, all the bluffers and posers 
 I'm not into that scene 
 You can tell me that I got no class 
 Look around, you'll see who's laughin' last 
 Don't give me speeches 'cause they're oh so droll 
 Leave me alone, let me rock and roll 
 Got an itchin' to rock, a hate for small talk 
 I'm funny that way 
 Got my sights on the stars, won't get that far 
 But I'll try anyway 
 I just like to please, I don't like to tease 
 I'm easy like that 
 Don't like long rests, I must confess 
 I'm an impatient cat 
 You can tell me that I got no class 
 Look around, you'll see who's laughin' last 
 Don't give me speeches 'cause they're oh so droll 
 Leave me alone, let me rock and roll 
 I do the best that I can 
 I'm just what I am 
 I do the best I can 
 Well, I know what I am 
 I do the best that I can 
 I'm just what I am 
 I do the best I can 
 Well, I know what I am 
 Got an itchin' to rock, a hate for small talk 
 I'm funny that way 
 Got my sights on the stars, won't get that far 
 But I'll try anyway 
 Rock and roll-in's a scream, makin' millions my dream 
 Well, I do that a lot 
 I'll just give it a try, won't let good times pass me by 
 They're all I've got"
10,Rush,rock,"Beneath, Between & Behind","Ten score years ago, defeat the kingly foe 
 A wondrous dream came into being 
 Tame the trackless waste, no virgin land left chaste 
 All shining eyes, but never seeing 
 Beneath the noble bird 
 Between the proudest words 
 Behind the beauty, cracks appear 
 Once with heads held high 
 They sang out to the sky 
 Why do their shadows bow in fear? 
 Watch the cities rise, another ship arrives 
 Earth's melting pot and ever growing 
 Fantastic dreams come true, inventing something new 
 The greatest minds, but never knowing 
 Beneath the noble bird 
 Between the proudest words 
 Behind the beauty, cracks appear 
 Once with heads held high 
 They sang out to the sky 
 Why do their shadows bow in fear? 
 The guns replace the plow, facades are tarnished now 
 The principles have been betrayed 
 The dreams's gone stale, but still, let hope prevail 
 History's debt won't be repaid 
 Beneath the noble bird 
 Between the proudest words 
 Behind the beauty, cracks appear 
 Once with heads held high 
 They sang out to the sky 
 Why do their shadows bow in fear?"
11,Rush,rock,By-Tor & The Snow Dog,"I. At the Tobes of Hades 
 Tobes of Hades lit by flickering torchlight 
 The Netherworld is gathered in the glare 
 Prince By-Tor takes the cavern to the north light 
 The sign of Eth is rising in the air 
 By-Tor, knight of darkness 
 Centurion of evil, Devil's prince 
 II. Across the Styx 
 Across the river Styx out of the lamplight 
 His nemesis is waiting at the gate 
 The Snow Dog, ermine glowing in the damp night 
 A coal-black eye is shimmering with hate 
 By-Tor and the Snow Dog 
 Square for battle, let the fray begin 
 III. Of the Battle 
 (Instrumental) 
 IV. Epilogue 
 The battle's over and the dust is clearing 
 Disciples of the Snow Dog sound the knell 
 Rejoicing echoes as the dawn is nearing 
 By-Tor in defeat, retreats to Hell 
 Snow Dog is victorious 
 The land of the Overworld is safe again 
 Safe again"
12,Rush,rock,Fly By Night,"Why try? I know why 
 This feeling inside me says it's time I was gone 
 Clear head, new life ahead 
 It's time I was king now, not just one more pawn 
 Fly by night away from here 
 Change my life again 
 Fly by night, goodbye my dear 
 My ship isn't coming and I just can't pretend 
 Moon rise, thoughtful eyes 
 Staring back at me from the window beside 
 No fright or hindsight 
 Leaving behind that empty feeling inside 
 Fly by night away from here 
 Change my life again 
 Fly by night, goodbye my dear 
 My ship isn't coming and I just can't pretend, whoa! 
 Fly by night away from here 
 Change my life again 
 Fly by night, goodbye my dear 
 My ship isn't coming and I just can't pretend 
 Start a new chapter, I find what I'm after 
 It's changing every day 
 The change of the season's enough of a reason 
 To want to get away 
 Quiet and pensive, my thoughts apprehensive 
 The hours drift away 
 Leaving my homeland, playing alone 
 And my life begins today 
 Fly by night away from here 
 Change my life again 
 Fly by night, goodbye my dear 
 My ship isn't coming and I just can't pretend 
 My ship isn't coming and I just can't pretend 
 Fly by night away from here 
 Change my life again 
 Fly by night, goodbye my dear 
 My ship isn't coming and I just can't pretend 
 My ship isn't coming and I just can't pretend 
 My ship isn't coming and I just can't pretend"
13,Rush,rock,Making Memories,"There's a time for feeling as good as we can 
 The time is now, and there's no stopping us 
 There's a time for living as high as we can 
 Behind us you will only see our dust 
 So we just keep smiling, move onward every day 
 And try to keep our thoughts away from home 
 We're traveling all around, no time to settle down 
 And satisfy our wanderlust to roam, hey 
 You know we're having good days 
 And we hope they're gonna last 
 Our future still looks brighter than our past 
 We feel no need to worry 
 No reason to be sad 
 Our memories remind us, maybe road life's not so bad 
 Well from sea to shining sea, and a hundred points between 
 Still we go on digging every show 
 The cities in the land all extend a welcome hand 
 Till the morning when it's time for us to go 
 Well you know we're having good days 
 And we hope they're gonna last 
 Our future still looks brighter than our past 
 We feel no need to worry 
 No reason to be sad 
 Our memories remind us, maybe road life's not so bad 
 Whoa, yeah, yeah, yeah, yeah 
 Maybe road life's not so bad 
 Road life's not so bad 
 Oh yeah, yeah 
 Oh yeah, yeah, yeah, yeah"
14,Rush,rock,Rivendell,"Sunlight dances through the leaves 
 Soft winds stir the sighing trees 
 Lying in the warm grass 
 Feel the sun upon your face 
 Elven songs and endless nights 
 Sweet wine and soft relaxing lights 
 Time will never touch you 
 Here in this enchanted place 
 I've traveled now for many miles 
 It feels so good to see the smiles of 
 Friends who never left your mind 
 When you were far away 
 From the golden light of coming dawn 
 Till the twilight when the sun is gone 
 We treasure every season 
 And every passing day 
 You feel there's something calling you 
 You're wanting to return 
 To where the Misty Mountains rise and friendly fires burn 
 A place you can escape the world 
 Where the dark lord cannot go 
 Peace of mind and sanctuary by Loudwater's flow 
 We feel the coming of a new day 
 Dark gives way to light a new way 
 Stop here for a while until the world 
 The world calls you away 
 Yet you know I've had the feeling 
 Standing with my senses reeling 
 This is the place to grow old 'til 
 I reach my final day 
 You feel there's something calling you 
 You're wanting to return 
 To where the Misty Mountains rise and friendly fires burn 
 A place you can escape the world 
 Where the dark lord cannot go 
 Peace of mind and sanctuary by Loudwater's flow"
15,Rush,rock,In The End,"Well, I can see what you mean 
 It just takes me longer 
 And I can feel what you feel 
 It just makes you stronger 
 Well you can take me for a little while 
 You can take me, you can make me smile in the end 
 Yes you can 
 Well, I can see what you mean 
 It just takes me longer 
 And I can feel what you feel 
 It just makes you stronger 
 I know, I know, I know 
 Oh, the feeling grows 
 I see, I see, I see 
 It's got to be 
 Whoa yeah, whoa yeah 
 Well, I can do what you do 
 You just do it better 
 And I can cry like you cry 
 It just makes me sadder 
 I know, I know, I know 
 Oh, the feeling grows 
 I see, I see, I see 
 Uh it's got to be 
 Whoa yeah, whoa yeah 
 Whoa yeah yeah 
 Whoa you can take me for a little while 
 You can take me, you can make me smile in the end 
 Whoa yeah 
 Well, I can shine like you shine 
 It don't make me brighter 
 But if I think like you think 
 It don't make my load much lighter whoa 
 Whoa 
 Well, I can see what you mean 
 It just takes me longer 
 And I can feel what you feel 
 It just makes me stronger 
 Whoa yeah yeah 
 Oh yeah"
16,Rush,rock,Bastille Day,"Ooh, there's no bread, let them eat cake 
 There's no end to what they'll take 
 Flaunt the fruits of noble birth 
 Wash the salt into the earth 
 But they're marching to Bastille Day 
 La guillotine will claim her bloody prize 
 Free the dungeons of the innocent 
 The king will kneel, and let his kingdom rise 
 Ooh, bloodstained velvet, dirty lace 
 Naked fear on every face 
 See them bow their heads to die 
 As we would bow when they rode by 
 And we're marching to Bastille Day 
 La guillotine will claim her bloody prize 
 Sing, o choirs of cacophony 
 The king has kneeled, to let his kingdom rise 
 Lessons taught, but never learned 
 All around us, anger burns 
 Guide the future by the past 
 Long ago, the mould was cast 
 For they marched up to Bastille Day 
 La guillotine claimed her bloody prize 
 Hear the echoes of the centuries 
 Power isn't all that money buys, whoa"
17,Rush,rock,I Think I'm Going Bald,"I looked in the mirror today 
 My eyes just didn't seem so bright 
 I've lost a few more hairs 
 I think I'm, I'm going bald 
 I think I'm going bald 
 Ooh it seems like only yesterday 
 We would sit and talk of dreams all night 
 Dreams of youth 
 And simple truths 
 Now we're all so involved 
 So involved with life 
 I walk down vanity fair 
 Memory lane everywhere 
 Wall Street shuffles there 
 Dressed in flowing hair 
 Go wild! 
 Once we loved the flowers 
 Now we ask the price of the land 
 Once we would take water 
 But now it must be wine 
 Now we've been 
 And now we've seen 
 What price peace of mind 
 Take a piece of my mind 
 My life is slipping away 
 I'm aging every day 
 But even when I'm grey 
 I'll still be grey my way 
 Yeah 
 Whoa 
 Oh yeah 
 Oh yeah"
18,Rush,rock,Lakeside Park,"Midway hawkers calling, ""Try your luck with me"" 
 Merry-go-round wheezing same old melody 
 A thousand ten cent wonders, who could ask for more? 
 A pocketful of silver, the key to heaven's door 
 Lakeside Park, willows in the breeze 
 Lakeside Park, so many memories 
 Laughing rides, midway lights 
 Shining stars on summer nights 
 Days of barefoot freedom racing with the waves 
 Nights of starlit secrets, crackling driftwood flames 
 Drinking by the lighthouse, smoking on the pier 
 Still we saw the magic was fading every year 
 Lakeside Park, willows in the breeze 
 Lakeside Park, so many memories 
 Laughing rides, midway lights 
 Shining stars on summer nights 
 Everyone would gather on the twenty-fourth of May 
 Sitting in the sand to watch the fireworks display 
 Dancing fires on the beach, singing songs together 
 Though it's just a memory, some memories last forever"
19,Rush,rock,The Necromancer,"I. Into the Darkness 
 Spoken: 
 As grey traces of dawn tinge the eastern sky, 
 The three travelers, men of Willowdale, 
 Emerge from the forest shadow. 
 Fording the River Dawn, they turn south, journeying 
 Into the dark and forbidding lands of the Necromancer. 
 Even now the intensity of his dread power can be felt, 
 Weakening the body and saddening the heart. 
 Ultimately they will become empty, mindless spectres; 
 Stripped of will and soul, 
 Only their thirst for freedom 
 Gives them hunger for vengeance... 
 Silence shrouds the forest 
 As the birds announce the dawn 
 Three travellers ford the river 
 And southward journey on 
 The road is lined with peril 
 The air is charged with fear 
 The shadow of his nearness 
 Weighs like iron tears 
 II. Under the Shadow 
 Spoken: 
 Shreds of black cloud loom in overcast skies. 
 The Necromancer keeps watch with his magic prism eyes. 
 He views all his lands and is already aware 
 Of the three helpless invaders trapped in his lair... 
 Brooding in the tower 
 Watching o'er his land 
 Holding ev'ry creature 
 Helplessly they stand 
 Gaze into his prisms 
 Knowing they are near 
 Lead them to the dungeons 
 Spectres numb with fear 
 They bow defeated 
 III. Return of the Prince 
 Spoken: 
 Enter the Champion. 
 Prince By-Tor appears to battle for freedom 
 From chains of long years. 
 The spell has been broken; the Dark Lands are bright. 
 The Wraith of the Necromancer soars away in the night. 
 Stealthily attacking 
 By-Tor slays his foe 
 The men are free to run now 
 From labyrinths below 
 The Wraith of the Necromancer 
 Shadows through the sky 
 Another land to darken 
 With evil prism eye, whoa"
